word,decade,cluster,cluster_size,rank_in_cluster,distance_to_centroid,target_word_visible,snippet
coffee,1850,1,2362,1004,5.3408,True,".1"" degenp- unchanged. coffee a _ grocery qualities, other prices remained ady at past rates. ate quotations. rice 'one on former terms. _ principal at full olt:eemeci. french grh..."
coffee,1850,1,2362,1015,5.3557,True,"...sugar the market continues inactive, but prices are unaltered. the small public sale of foreign was bought in above the market value. refined steady. coffee the publi"
coffee,1850,1,2362,1017,5.3566,True,"for medium congou and gunpowder at former rates. the sales in coffee are confined to 100 bags native ceylon at 525. per cwt. there was no disposition evinced to purchase the rice offered by auction, a"
coffee,1850,1,2362,1024,5.3592,True,"second report. sugar stiff. sales of west india 500 hhds. refined active. porto rico at auction sold at 355. gd. to 40s. coffee sells freely native ceylon, 406. to clean santos, 435. to 465. tea—rathe"
coffee,1850,1,2362,1032,5.367,True,"....) london produce market--tbraday. sngar dull; prices declined le per cwt. sales of west india 345 lihde. refined dull, and easier; brown lamps, 60e. coffee brisk"
coffee,1850,1,2362,1045,5.3783,True,"saturday's market, london produce.—sugar: there continues to be more inquiry for this article, and the market has a wore healthy tone. coffee is firm at late quotations. tea :nb alteration to notice c"
coffee,1850,1,2362,1066,5.398,True,"london produce market.-april 13 sugar the market has a quiet appearance, and the public sales are again going off without spirit. coffee the small public sale went off without showing any material alt"
coffee,1850,1,2362,1072,5.4037,True,"..._a_d,ket.—dec. 12, stigaß—the transactions in the in ivate contract nmrket since friday have. been folv.i and 'unimportant. quotations are nuattered. coffee has a firm appearance te"
coffee,1850,1,2362,1081,5.4138,True,"...lic sales are advertised for to-mor- -sugar, 550 hhds. west india, and 3,000 bags 2,500 bags native ceylon 100 cases 0 bags of costa rica. cocoa, 150 coffee, 4."
coffee,1850,1,2362,1083,5.4169,True,"from french ports, but not _ reported, no sales reported in molasses. for coffee a better demand, but limited supply. tea the sales of new have been actively proceeded with af good prices. rice has me"
coffee,1850,1,2362,1084,5.4189,True,"from french ports, but not reported, no sales reported in molasses. for coffee a better demand, but limited supply. tea the sales of new have been actively proceeded with at good prices. rice has met "
coffee,1850,1,2362,1109,5.4502,True,"london produce market, mat 3. st:oaß—demand increasing, and a small advance on rates of friday realised. coffee —s i transactions in plantation ceylon, and rates fully as high; native quiet. tea—deman"
coffee,1850,1,2362,1128,5.4631,True,"...n. 21. sugar: the market is firm at the advance of 6d to is quoted yesterday on all good consuming qualities. refined steady lumps, 61s 6d to 63s 6d. coffee the public sales "
coffee,1850,1,2362,1141,5.4741,True,"london producc market, april 16. sugar—fair home and export business at previous rates; refined quiet, and terms easier. coffee dull at a small decline; supply larger. tea dull at former rates; aactio"
coffee,1850,1,2362,1145,5.4773,True,"coffee, but by private treaty more disposition was evinced to operate, and prices are firmer. in native ceylon a good business was concluded, but lmost ex- ..."
coffee,1850,1,2362,1147,5.4788,True,"known coffee no improvement has taken place in this market, native ceylon quoted at 51s to 51fi 6d. a cargo of santee has been sold at 45, for a near pore, tea th..."
coffee,1850,1,2362,1148,5.4799,True,"...n. 12. the following public sales are advertised for to-morrow —sugar 220 hhds. west india 14,009 bags mauritius 7,500 bags bengal 1.300 bags madras. coffee 150 casks plan' a"
coffee,1850,1,2362,1149,5.482,True,"...the sales of west india amount to 494 casks, making for the week 1,944. refined quiet, at former prices. 14,000 bags mauritius went at 27s to 36s 6d. coffee brisk"
coffee,1850,1,2362,1155,5.4874,True,"...uce market.—dec. 18 sugar the market remains inactive, and only 300 bags benares sold at 52s to 52s 91 per cwt, being rather easier molasses, rum, or coffee we are still without any rans"
coffee,1850,1,2362,1162,5.4936,True,"'1951651 24222' pronuce.---nothing doing in sugar, and prices are not quoted. for coffee a fair demand at steady rates. new tea has been sold at prices ruling from 10 -d. to 2s„ tor other descriptions"
coffee,1850,1,2362,1170,5.5031,True,"london produce market, april 2. sugar—foreign quiet, and prices not lower. refined' in demand. coffee not lower, but sales small. native ceylon, 475. to 475. 6d.; plantation, 533. to 808. tx t dull. o"
coffee,1850,1,2362,1183,5.5123,True,"london produce market, jule 27. stioaß.—west indio firm; several buyers. refined stiff. coffee not lower, but supply more plentiful. tea.—thitnand increasing; ordinary cungou 80. to d. corron dull and"
coffee,1850,1,2362,1185,5.5135,True,"...—this market continues to have an upward tendency, and prices are 6d. to ls. dearer than last week. refined lumps are now quoted 495. 6d. to als. 6d. coffee has a "
coffee,1850,1,2362,1195,5.5209,True,"...ket, jan 2. sugar—the market opened with firm feeling, with prices not more than is per cwt. below the last highest point, with several transactions. coffee on the spot the"
coffee,1850,1,2362,1200,5.5258,True,"...bay.ers have shown a disposition at the recent decline, but, owing to the firmness of holders, no transac- tions have taken place. molasses, rum, and coffee t"
coffee,1850,1,2362,1202,5.5273,True,"jamaica. the business of the last fortnight has been marked with a little more activity than usual. coffee in very small supply, and there is no pimento offering. the health of the island continues go"
coffee,1850,1,2362,1203,5.5297,True,"...auritius, and 650 bags madras. of foreign sugar the sales corn- prised 4000 bags and barrels brazil, and 200 boxes havana. in molasses nothing doing. coffee is steady, and"
coffee,1850,1,2362,1208,5.534,True,"london produce market, sept, 26. srn tit in good demand; prices fully as high for colonial and foreign. refined held stiffly. coffee in fair demand. sales firm. tea—several sales of common cengous nt "
coffee,1850,1,2362,1211,5.5369,True,"london produce market-may 16, sugar quiet. coffee flat. tea :at public sales there was more disposition to purchase, and the rates are about the same as last week. rice market firm, about 10,000 to 1..."
coffee,1850,1,2362,1220,5.5446,True,"london produce niarr.es, nov. 27. suuar improving, and better qualities bring a small advrkuce. more doing in refined at previous terms. coffee wanted. plantation ceylon a little dearer. tea—demand la"
coffee,1850,1,2362,1231,5.5593,True,"london produce market, jan. 21. sugar—previous advance fully maintained; parcels offering moderate. coffee wanted; prices stiff; native c3ylon, 533 to 670. tea—dernand moderate; sound congou, 110. ric"
coffee,1850,1,2362,1233,5.5601,True,"london produce market. —nov. 5 sugar the market is rather dull, and the public sales are progressing without spirit. coffee the public sales are large to-day, and are going off heavily. tea the trade "
coffee,1850,1,2362,1243,5.5713,True,"...ce market.-sept. _l4 -- the following sales are adrerti-ed for tomorrow, viz :—sugar. 50 hhds west india; 1,030 bags mauritius; and 2.400 bics bengal coffee.-70 casks plantation ceylon. sa"
coffee,1850,1,2362,1252,5.5781,True,"produce market. sugar foreign is dull, at previous terms refined quiet but brown lumps 465. coffee dull, and rates are barely sus- tained. tea is quiet, but firm ordinary congou, wool is very firm, an"
coffee,1850,1,2362,1257,5.5862,True,"london produce market, august 14. sugar business small, and rates rather lower. coffee—fair demand; full prices paid for costa rica and plantation ceylon. tea quiet, but not cheaper. mtpetii/: active;"
coffee,1850,1,2362,1258,5.5881,True,"at yestfit london sugar the market has a steady appearance, day's prices, which showed a decline of 6d to 24 low grocery lumps, 523 coffee remains steady. tea the trade are occupied with the samplo 0,"
coffee,1850,1,2362,1261,5.5905,True,"ho.r3, amy nn tl---r an 0-eano. yot k. ~ market news -(this day.) coffee —the market is quiet. good erd notice ce)lm, is 394 per owe. hum.--the market is heavy. the quantity itind ,de4 last week at th"
coffee,1850,1,2362,1265,5.5932,True,"...don produce market-tuesday. sugar.—good business done at full prices. sales of west india goo hhds. refined much wanted; brown lumps, 63s 6d per cwt. coffee"
coffee,1850,1,2362,1272,5.5984,True,"london produce market, may 18. suoma—bought more readily, and prices rather higher; no auctions declared. coffee wanted, and rather dearer; supply email; clean native ceylon 54s to 56s 6d. tea firm, a"
coffee,1850,1,2362,1273,5.5992,True,"london produce market, july 13. segal% dull at previous terms, although stock less then last year. refined low lumps, 67s to 67a 6d. coffee wanted and fully as high, although severs, auctions declared"
coffee,1850,1,2362,1279,5.6048,True,"london produce market, jan% 26. st*gall—much demand; very full prices paid; cloyed manilla afloat, 30s. coffee much in request; good clean native, .55s ci. tel—demand brisk; sound common congou, is id"
coffee,1850,1,2362,1286,5.6176,True,"london produce market. -jan 20. -.- sugar the market has opened with a good demand, and the public sales are progressing at rather higher prices. coffee the small public sales of east india and st. do"
coffee,1850,1,2362,1288,5.6186,True,"...duce market. sugar foreign is quiet but firm yellow havana 223 to .255, for export. refined home dealers are fair buyers grocery lumps 46s 6d to 495. coffee is firm, and in good demand; native ceyl"
coffee,1850,1,2362,1294,5.6237,True,"...market, dec. 23. sugar wanted, and rates fully as high. best yellow brings a small advance. sales of west india 300 hhds. refined firm at 565 to 625. coffee firm. good demand for planta"
coffee,1850,1,2362,1298,5.6309,True,".... si,oar in good demand, and prices fully as dear. saks of west india 211 wide, making 1,623 for the week. refined in fair request; brown lumps, 635. coffee is brisk demand, and rates fii"
coffee,1850,1,2362,1299,5.6309,True,"london produce market, sept. 14. suoab—severel transactions. prices linnet, although many auctions dechirej. refined in good demand, low lumps, gds. coffee wanted, and an advance realised. clean nativ"
coffee,1850,1,2362,1305,5.6384,True,"..._a_d,ket.—dec. 12, stigaß—the transactions in the in ivate contract nmrket since friday have. been folv.i and 'unimportant. quotations are nuattered. coffee has a firm appearance te"
coffee,1850,1,2362,1306,5.6387,True,"...ort. _ sugar elni firmly, with a fair demand. sale; of west india 215 mids., making 983 for the week. refined brings full prima. brown lumps 633 641. coffee not much in demand, but rates ful"
coffee,1850,1,2362,1309,5.6393,True,"london produce market, sept, 26. srn tit in good demand; prices fully as high for colonial and foreign. refined held stiffly. coffee in fair demand. sales firm. tea—several sales of common cengous nt "
coffee,1850,1,2362,1311,5.6411,True,"igal wcre ti mid; 1,1110 coffee —steady demand; 0 159 bags native ceylon 474; 3!. 64s gd 1,250 ordmary 42s w. o tea.—lirniteu nsiness ny private. 'clay 3,000 packages, with all faul..."
coffee,1850,1,2362,1313,5.6471,True,"... day. sroab.—the public sales declared for tomorrow consiet of 350 hhda. west india, 5,000 bags mauritius, 7,500 begs bengal, and 1,3::0 begs madras —coffee: "
coffee,1850,1,2362,1314,5.648,True,".... -feb 10. sugar the public sales are progressing steadily at about last friday's prices. the refined market firm, lumps, fair to fine, 64s to 665. • coffee the public sales consi"
coffee,1850,1,2362,1316,5.6503,True,"london produce m a.rket.-titnt 18 sugar market steady, being 6d dearer for the week for good grocery qualities. coffee market firm. tea quiet. common congou is 3d nominal. rice steady. saltpetre is qu"
coffee,1850,1,2362,1319,5.6568,True,"mincing-lane.-this day. the public sales declared for to morrow are—bugar goo hhds. west india; 2.300 hags bengal; and 760 bags madras. coffee 2,700 begs costa rica 1 000 casks plan- tation ceylon and"
coffee,1850,1,2362,1323,5.6636,True,"london produce market.---april 28. sugar the market is flat. coffee the whole of the quantity offered to-day has been withdrawn, there being no buyers. tea the market is quiet common congou is reporte"
coffee,1850,1,2362,1324,5.6637,True,"...dat. the folaringpnblie sales an advertised for to-morrow briar: 360 bads. west india, 6,600 bags mauritius, 7,000 begs bengal, and 6.000 begs maths. coffee 1,600 bags paths ceylon "
coffee,1850,1,2362,1325,5.6646,True,"london produce market, sept. 28. at present little doing in colonial produce, hut holders of coffee, tea, sugar, and rice are firm, supplies being moderate. itunl much wanted and advancing. tallow dul"
coffee,1850,1,2362,1328,5.6712,True,"markets. liverpool, noe. 19. the sales to-day are :—sugar a small lot of jamaica, at 315.; 900 bags dotes, 275. 66. to 28s. coffee 30 lois ordi- nary rio, 38s. fusie 360 tons aranilla, 31. to 5. saltp"
coffee,1850,1,2362,1330,5.6717,True,"...2. lands, 106 k 106 dovers, great westerns, 641; london produce market.—oaronen 22. sugar market firm the quantity advertised for tues- day is large. coffee quiet. tea dull, pending t"
coffee,1850,1,2362,1331,5.6727,True,"london produce nilrket4 oct. 20, sugar—demand rather better, but np advanee. supply generally eonaibta of cuba and porto rico. refined bteady, coffee bought cautiously. prices about the same. large au"
coffee,1850,1,2362,1337,5.6847,True,"liverpool produce market.--dec. 19. sugar we continue to have a quiet marzet, and only 550 bags benares sold at 53s per cwt. molasses, rum, and coffee nothing has occurred. rice: of 4,000 bags bengal "
coffee,1850,1,2362,1340,5.6888,True,"...ce market.- sugar.—west india sales 600 hhds, at pr, refined sells more freely, brown lumps, 43s 44s to 475. foreign porto rico, low to fine to 405.. coffee brisk plantation ceylon, 68s na"
coffee,1850,1,2362,1343,5.6895,True,"molasses, rum, and coffee nothing has taken plac rice nottung to notice. saltpetre per cent. 300 bags are reported at 40s. per cwt. for eapeseed: 3,000 bags, at 365. for scind..."
coffee,1850,1,2362,1344,5.6902,True,...directions from the london papers of yesterday. [received last night by express.] .. he commercial advises from antwerp report more acti- vity in the coffee 
coffee,1850,1,2362,1345,5.6909,True,".... svolil —the market is steady for good desirable qualities, but other descriptions scarcely support previous mee. re- fined lumps, 6.3.. to 611. 6d. coffee —fine native ceylon"
coffee,1850,1,2362,1352,5.7046,True,"the continent, present in coffee a renewec speculative feeling has arisen ylon has this day been sold there at 50s. we should recommend caution, as one extreme only begets another, a..."
coffee,1850,1,2362,1353,5.7049,True,"...-sept. 16. sucar.—the market continues steady; 20 hhds porto rico are reported at ms 61, and 510 box a brawn havana at 473 per cwt. molasses, rum and coffee —nothing has occu"
coffee,1850,1,2362,1359,5.7157,True,"...ov. 21, 1557. ashes —pat are steady at the decline noticed in our last. coal —the mtrket is better supplied with livetpcol, and prices favour buyers. coffee —the market continues de"
coffee,1850,1,2362,1362,5.7189,True,"london produce market.-this day. sugar in west india little doing, but full rates are demanded. refined slow of sale. brown lumps, 455. 6d. to 465. coffee firm, demand increasing. native ceylon, 435. "
coffee,1850,1,2362,1364,5.7247,True,"second report. sugar— although supply large full rates realised. both home and foreign demand larger. refined wanted. low lumps 57s 6d. coffee dull, and rather lower rates taken privately for plantati"
coffee,1850,1,2362,1368,5.7284,True,"commercial and markets. mincing lane.-this day. there has been more inquiry for sugar and coffee to- day, and business to some extent has been done in both ar- ticles at the full prices of friday last"
coffee,1850,1,2362,1372,5.7327,True,"london produce market, july 3. sugar dull 376 sales for the week, at a decline of is in refined home business larg,er, at 688 6d to 71s. coffee firoi and a fair demand. clean native cep lon, is to 675"
coffee,1850,1,2362,1375,5.7348,True,"...24. sugar—favourable result of dutch sale, and reduced stocks caused holders to be very firm. refined wanted. low to fine grocery lumps, 51s. to 575. coffee active. good n"
coffee,1850,1,2362,1376,5.7354,True,"london produce market.-july 11 sugar is in better demand, and the quantity advertised for sale this week is very moderate. coffee inquiry continues. about 2,000 bags sold to- day santas at 51s for a n"
coffee,1850,1,2362,1380,5.7393,True,"... dec. 14. sugar—went india firm; sales, goo hhds. refined sells freely. grocery lumps, 44s to 475. several pur- chases made in foreign at full rates. coffee —several buyers at fa"
coffee,1850,1,2362,1386,5.746,True,"...l el the general produc( (luring the wed cbseriable in suga limited. molasses continue to meet with a inquiry, at fully late rates. rum continues the coffee market is b"
coffee,1850,1,2362,1402,5.7637,True,... the 15th february vices from havannah to the bth ultimo sr continued very firm. exchange on london 5i to 6 we have advices from haiti to the 16th-fe coffee was very scarce-85 to 86 dollars log
coffee,1850,1,2362,1413,5.7809,True,"london. • a :•.""'lol9 the public sales advertised for to-morrow arifauritd 750 hhds of west india, and 6,500 bags of v-as- es, too coffee, 300 casks of plantation ceylon, 2u're; 02' 1,200 bags east in"
coffee,1850,1,2362,1420,5.7995,True,"second report. sugar —scarcely any bnsiness dons privately, anj parcels in public sales withdrawn. prices cannot be accurately given. coffee —l.l intation ceylon wanted. publie sales went at full rate"
coffee,1850,1,2362,1423,5.8015,True,"produce.—there has been a steady trade in sugar during the week, chiefly in madras and mauritius. in coffee little doing. rice without alteration. tea slightly dearer. saltpetre, ss. to gs. per cwt. l"
coffee,1850,1,2362,1429,5.8069,True,"...good middling laic 101 c. to 101 c cra.rleston ito 500 t havanna. sept. 1 favonrabl more inquiry for su, and still higher freights, p the business in coffee is ve"
coffee,1850,1,2362,1433,5.8136,True,"molasses and rum coffee the demand continues steady; 300 bags santog, by auction, brought 51s to 525, and 150 bags bahia 45s per' cwt. rice the market is without change, the..."
coffee,1850,1,2362,1434,5.8149,True,"...ere has been little doing to day. the sales consist of —sugar a small lot of joinska, at 31s. al. • and 263 cares 03 osrrris brasil. at 16., as ship. coffee 170 tree. a.i"
coffee,1850,1,2362,1439,5.8221,True,"mint w 116001318 t, and blotting room the tendency of prices has sugar has advanced about lower sorts of east india ...nd british west india coffee has been • have been fair • firm, and rum •i and on "
coffee,1850,1,2362,1445,5.8254,True,"...lic sales declared for to-morrow are rather large, viz. :—sugar 400 hbds. wept india, 4,000 bags mauritius, 5,000 bags bengal, and 3,500 bags madras. coffee ico bales mo"
coffee,1850,1,2362,1451,5.8302,True,"... market continues very quiet, the business being confined to 500 bags dates at 38s per cwt nothin \ve have no sal(' has occurred in molasses, rum, or coffee to notice in i?ire. of dyewo"
coffee,1850,1,2362,1459,5.839,True,"produce.—there has been a steady trade in sugar during the week, chiefly in madras and mauritius. in coffee little doing. rice without alteration. tea slightly dearer. saltpetre, ss. to 6s. per cwt. l"
coffee,1850,1,2362,1463,5.8472,True,"yesterday's markets london pro duce.—sugar the sales so far have gone very languidly, and the tone of the market is decidedly fiat. coffee plantation ceylon has sold steadily at about previous rates; "
coffee,1850,1,2362,1466,5.8513,True,"...t-may 25, sugar the public sale of mauritius is going off without spirit, and the market has a dull appearance. refined also dull. lumps, 51s to 535. coffee the large public sal( s"
coffee,1850,1,2362,1467,5.8519,True,"...s day. the public sales declared for to-morrow consist of:— sugar 250 hhda. west india 20,000 bags mauritius, 3,300 bags bengal, and 600 bags madras. coffee 200 casks and 1,000 bags. "
coffee,1850,1,2362,1470,5.8592,True,"london produce market june 2. sugar- fair business, but no advance; auctions declared for friday. coffee —derneed moderate for native ceylon at 42s t 0528; plantation sell readily at full prices. tea—"
coffee,1850,1,2362,1471,5.8598,True,"molasses 350 hhds cuba muscovado are repor 19s 3d per cw rum and coffee nothing has occurred tea we have a good busines a few hundred chest hands, at 9id per lb rick 800 bags have been taken at 9s 3d "
coffee,1850,1,2362,1474,5.865,True,"...day. the public sales declared for to-morrow consist of— sugar: 200 made. barbadoes, 2,300 bags msuritni., 10,600 bags bengal, and 2,500 bags madras. coffee 60 casks ceylon, 500 bag"
coffee,1850,1,2362,1483,5.8813,True,"liverpool produce market, oct. 1. suo.sit—steady business, at full prices. coffee —bo bags washed rio realised ms. per cwt. tea—market rather excited; a general disposition shown to do business in mos"
coffee,1850,1,2362,1492,5.9003,True,"...y. elsoaa.—the public sales of pecans and pernambuco. are progressing steadily at previous rates. the refined market is seedy, at yesterday's prices. coffee —the public sales of p"
coffee,1850,1,2362,1501,5.9134,True,"produce market. sugar.—foreign floating cargoes. are wanted. refilled; qrocery lumps brisk at 465,. to 48s. 6d. coffee plantation ceylon is. in demand, but the market for native is dull. tea is, unalt"
coffee,1850,1,2362,1511,5.9283,True,"mincing-lane.-this day. the public sales declared for to-morrow are-sugar: 300 mids. west india, 3,600 bags of blauritlus, and 2,000 begs bengal. coffee 60 casks j•0141c.11, and 160 casks ceylon. rice"
coffee,1850,1,2362,1513,5.9292,True,"second report. sugar —scarcely any bnsiness dons privately, anj parcels in public sales withdrawn. prices cannot be accurately given. coffee —l.l intation ceylon wanted. publie sales went at full rate"
coffee,1850,1,2362,1514,5.9313,True,"...: market._ july 13. sugar very firm, and the low brown descriptions are dearer. 2,550 bags mauritius sold low. .middling to fine brown 32i 6:1 to 37s coffee mark"
coffee,1850,1,2362,1516,5.9334,True,"london sugar the market has a firm appearance, and the pu"" sales are progressing steadily, refined grocery lump' s`"" to 558, coffee the large public sales are going off with°ut spirit tea remains stea"
coffee,1850,1,2362,1518,5.9342,True,"london produce market, jan. 3. sugar—west india firm. good demand. refined many purchases. coffee wanted. good inquiry. native ceylon 45. 6d. tea—many buyers of congou; ordinary sound, 10d. cotton—sai"
coffee,1850,1,2362,1525,5.9401,True,"...ces by the tyne report that the crisis has passed lightly over rio de janeiro, three houses were obliged to suspend payment, owing to heavy losses in coffee— schroder ss co., elvers &"
coffee,1850,1,2362,1526,5.9458,True,"lon da sugar.—the market has opened with a firm appearance, and the large public sales are progressing steadily. refined is firm. grocery lump coffee also has a st tea: the new arrival;of green are on"
coffee,1850,1,2362,1531,5.9538,True,"... 605 270 25 16100 & 3190 brlfi produce market. sugar foreign quiet, and rather cheaper. refine d—; home dealers cautious brown lumps, 445. 6d. to 40. coffee dull dative ceylon, 465. to 47s.—te"
coffee,1850,1,2362,1533,5.9558,True,"...lic tales are advertised for to-morrow sugar 500 hhds west india, 15,500 bags mauritius, 2,000 bags bengal, 1,600 bags madras, and 3,500 bags penang. coffee 120 casks plantati"
coffee,1850,1,2362,1537,5.9668,True,"...sales are advertised for to•morraw: sugar 600 hogsbeade wut india. 16,600 bap mauritius, 2.000 bags siegal, 1,609, bogs mediu, and 3.600 baps penang. coffee "
coffee,1850,1,2362,1538,5.9677,True,"svatn— lower, and india 1002 quiet; low coffee auctions w tea-f saltpe' tallov the ati steady, aa changed.' descripteo articles re sugar. 310 las: cwt ri:m rice.— rapes the rlt are cons 6000 ball"
coffee,1850,1,2362,1541,5.9756,True,"commercial and markets. mincing lane.—this day. coffee.—there has appeared more disposition to buy • good ordinary native ceylon, and about 1,000 bags are re- ported sold since friday, chiefly at 30s."
coffee,1850,1,2362,1548,5.9843,True,"...rket. —finn 21. the following public sales are advertised for to-morrow, viz. :—sugar 150 hhds demerara, 8,000 bags mauritius, and 3,000 bags madras. coffee 1,000 bags native ceylon, "
coffee,1850,1,2362,1551,5.9931,True,"london produce market, oct. 10. &gun quiet. inferior easier. refined dealt in cautiously. coffee —little doing. rates unaltered. tea inactive, but held for full prices. rice dull. cotton not cheaper, "
coffee,1850,1,2362,1560,6.0043,True,"london sugar the public sales are going off steadily, g 656. prices. refined in good demand. grocery lumps, 539t° coffee remains steady. tea the public sales are progressing heavily. the rum prices ar"
coffee,1850,1,2362,1563,6.0112,True,"rio de janeiro. the chambers were still sitting, and much sittig' faction was felt at the terms of the new loan. the coffee crop was an average oae, and of good quality. the coffee market has been act"
