word,decade,cluster,cluster_size,rank_in_cluster,distance_to_centroid,target_word_visible,snippet
coffee,1890,2,2198,616,5.5025,True,"p • nothing' steadies the nervfo:4 and clears the brain strong oup of symington's,' edinburgh coffee essence. in bottles froni,all grocers. 1,:11114 p),,i 60i confectioner), sind _tqffi. roffiggt „.,t"
coffee,1890,2,2198,617,5.5037,True,"gedde's dandelion coffee the best and cheapest ever offered to the public. sold by all grocers and drt4gists, in canister lod., and is. bd. eaala. wholesa:e i,yy d. geddes aw..."
coffee,1890,2,2198,618,5.5042,True,"... dowder powder • in the world. :wrammeawaivaosereiwiiin•it :•.,' the smoothness, delicacy and urifor- mity of flavour have made symington.. edinburgh coffee essence a table favourite "
coffee,1890,2,2198,619,5.5052,True,terrific slaughter of big profits. by purehzaing lipton's coffee you save about half-a-dozen different middlemen's profits. and get your coffee direct from the planter. lipton's • delicious oriental b
coffee,1890,2,2198,620,5.5071,True,"edinburgh coffee essence makes delicious coffee in a moment. no trouble, no waste. in small and large bottles, from all grocers. guaranteed pure. (mena coluticct all ..."
coffee,1890,2,2198,622,5.51,True,"a rab i pasha,. ex-minister of war from egypt,. writing from ceylon, says.ahout litton's coffee having visited a number. of your estates, and having bad daily opportunities of tasting the coffee grown"
coffee,1890,2,2198,623,5.5105,True,"to all lovers of pure coffee, i offer the richest and best that money can buy, direct from the plantations at is. 6d.per lb. no higher price. an indisputable fact. it is well kno..."
coffee,1890,2,2198,624,5.5108,True,"the coffee pot pure coffee. 'or 115:eakfl,'; 707: ..7.2.1:117..' for stj true aroma, 'me flavour, fragrant. digestive, refreshing, exhilarating rr.:t. corrrr, t..."
coffee,1890,2,2198,625,5.5119,True,"fruit coffee. a west hartlepool luxury. mr george hall, grocer, stockton street, west hartley. 01, has hit upon a blend of coffee which is pronounced to be of a m..."
coffee,1890,2,2198,627,5.5152,True,"terrific slaughter of bic profits. by purchasing lipton's coffee you save about half- a-dozen dliderent middlemen's profits, and get your coffee direct from the vlanter. lipton's delicious oriental bl"
coffee,1890,2,2198,629,5.5164,True,"the smoothnseo, ddioacy and unifor- • mity of flavour have made symington's edinbargh coffee essence • table • favourite with these who cannot take the ordinary coffee. 6 .."
coffee,1890,2,2198,630,5.5165,True,fruit coffee. a west hartlepool luxury. -- 3111:21valti:priloril'htrctiti uspotnenkt4a niaesntrdeeei isaffce whlch is pronounced to be of a most delicious flavour...
coffee,1890,2,2198,631,5.5166,True,"terrific slaughter of bic profits. by purchasing lipton's coffee you save about half- a-dozen dliderent middlemen's profits, and get your coffee direct from the vlanter. lipton's delicious oriental bl"
coffee,1890,2,2198,632,5.5167,True,terrific slaughter of big profits. by purehzaing lipton's coffee you save about half-a-dozen different middlemen's profits. and get your coffee direct from the planter. lipton's • delicious oriental b
coffee,1890,2,2198,633,5.5187,True,"an excellent breakfast drink. fruit coffee (registered). a blend of coffee whleb s prononneed to be ot a moil delicious flavour, and wholesome, stimulating, and nouriddag. routed by patemt noo..."
coffee,1890,2,2198,634,5.5208,True,"how to 31 ak e coffee. a short time ago there was a discussioa in some of the papers on how to make tea."" there is quite as much need of light and leading in the matter ot..."
coffee,1890,2,2198,635,5.5211,True,"an excellent breakfast drink. fruit coffee (registered). a blend of coffee which is pronounced to be of a moot delicious flavour, and wholesome, stimulating, and nourishing. wasted by patent p..."
coffee,1890,2,2198,637,5.5219,True,"an excellent breakfast drink. fruit coffee (roistered) a blend of coffee which i, pronounced to btb.of most delicious flavour, and wholesome, stimulating, and naprialting. rouied by pritent (...."
coffee,1890,2,2198,638,5.5223,True,"terrific slaughter. op big profits. by purchasing lipton's coffee you save about half- a-do-:rn different middlemen's profits, ouch get your coffee direet from the planter. l 1 delicious ""oriental' bl"
coffee,1890,2,2198,641,5.5238,True,symington'sdinburgh coffee essences are noted for thci:. rich and delicious flavour. sold in small and large betticz 1;4 grocers in every town. 0 -4 cvevzvzvey-tre.e...wm.rz/t....
coffee,1890,2,2198,642,5.5238,True,"fruit coffee. a west hartlepool luxury. mr george ball, grocer, stockton street, west ilartlepi 01, has hit upon a blend of coffee which is pronounced to he of a ..."
coffee,1890,2,2198,643,5.5244,True,"delicious blends of finest coffee and chicory 10d., is., and is. 2d. per lb. pure coffee, richest and best, per s. 6d. lb. no new moe. coffee essences lipton's essence of coffee is ma..."
coffee,1890,2,2198,648,5.5261,True,"coffee essence. delicious coffee at one farthing per cup, prepared in two seconds. arsoli7tely pure. no coffee grounds quality totally eclipses that of all ..."
coffee,1890,2,2198,651,5.5274,True,"v .1. ..',., i :, •. • coffee real coffee this time, true aroma and fine flavour. fragrant refreshing and and digestive. exhilarating. something new in the coffee pot. an absolute..."
coffee,1890,2,2198,652,5.5288,True,".cuents. [roe aenoun an facellent lreaufast prim 11.0 it coffee (regiitered). a ht,,rnfof coffee v.1.41,:11 is prouotiiice4 to be of• inc* delicious flavour._ and erholesoinet stiundsting. awl nourish"
coffee,1890,2,2198,653,5.5308,True,for remainder of local nora see page never be without a botth symingtcris edinburgh coffee essence in the house. al grocers sell it. it makes delicious co iev a moment. anthon f bell & n. the lancaste
coffee,1890,2,2198,655,5.531,True,lancaster. pt.op le niv 11 0 cannot tun ordinary coffie .:4113 drink symington's edinburgh coffee essences
coffee,1890,2,2198,656,5.5329,True,"an excellent breakfast drink. fruit coffee (registered). a blend ot coffee which is pronounced to he ot a mgst delicious flavour, and wholesome, stivnulating, and nourishing. roasted by patent..."
coffee,1890,2,2198,657,5.5342,True,"symington's. edinbutpr coffee enence l: makes delicious coffee in a moment. no trouble, no waste. in small and large bottles, from all grocers. guaranteed puri!. 100"
coffee,1890,2,2198,661,5.5366,True,"sypiongto ns edinburgii coffee essence makes delicious coffee in a moment. no trouble, no waste. in small and large bottles, from all grocers. quaranteed pure. envelopes 2s, per 15..."
coffee,1890,2,2198,662,5.5369,True,grateful-comforting. cocoa for breakfast and supper. the careful process by which symington's edinburgh coffee essence is made eliminates all un- pleasant properties. anyone can drink it. from grocers
coffee,1890,2,2198,664,5.5414,True,"coffee and how to make it. chemically speaking, coffee consists of a volatile aromatic oil, to which its flavour is owing; the stimulant alkaloid, caffeine;..."
coffee,1890,2,2198,665,5.5452,True,"an excellent breakfast drink. fruit coffee (registered). a blend of coffee which is pronounced to be of s most delicious flavour, and wholesome, stimulating, and nourishing. boasted 14 patent ..."
coffee,1890,2,2198,666,5.5452,True,"eddes dandelion coffee _ the best and cheapest ever offered to the public. sold by all grocers and druggists, in canister 5d., 10d., and is. bd. each. wholesa:e by j.. gedd..."
coffee,1890,2,2198,667,5.5464,True,"impoutant hitherto i have been selling in the ceylon and mondon, alarkets.thousands of bushels of coffee of my own vowing, i have now decided to. dispose of thio coffee, direet, to the consumers, at m"
coffee,1890,2,2198,668,5.5465,True,"faimpexp•o•000000.0'•ip • • 4,000 • a,* ~ owing to the special process, symington 's edinburgh coffee •: essences produce no heartburn •"" or biliousness. cheap, strong (?) o c!, o pure. small and larg"
coffee,1890,2,2198,669,5.5465,True,"s i ‘4, in/a3:w syroington's edinburgh coffee essences are noted for their rich and delicious flavour. sold in small and large bottles by grocers in every town. r-.4\./i4wvwvitirivitretilb"
coffee,1890,2,2198,671,5.5466,True,"adulteration of coffes. james phillips. grocer, penygraig, wa.4 chaiged with selling coffee adulterated to an un- usual extent. it was understood that this was a test case. pdr rowlands, market harbor"
coffee,1890,2,2198,673,5.548,True,"terrific slaughter of bic profits. by purchasing lipton's coffee you save about half- a-dozen dliderent middlemen's profits, and get your coffee direct from the vlanter. lipton's delicious oriental bl"
coffee,1890,2,2198,676,5.5497,True,"fruit coffee. a west hartlepool luxury. ivr ceorge hall, grocer, stockton street, west liartleneol, has hit upon a blend of coffee which is pronounced to be of a ..."
coffee,1890,2,2198,677,5.5498,True,"largest sale hi the world. coffee! coffee! lipton's delicious blends of finest coffee and chicory 108., is., and is. 2d. per lb. pure coffee, richest and best, per 18. 6d. lb. so webe..."
coffee,1890,2,2198,678,5.55,True,"viitoooeiseilloolose 00000000 00,,5p 0) t its purity, strength, ant cheap- *) ness make symington's edinburgh coffee essence a universal sold by all grocers and storekeepers. 74 (e, 000000000000000 04"
coffee,1890,2,2198,679,5.5504,True,"th lose who cannot take ordinary coffee can drink symington's edinburgh coffee essence with comfort and pleasure. in bottles from all grocers. ae:arls' r 4 'l*k; 40, • i p t d, 1 p n • :1? ..."
coffee,1890,2,2198,680,5.5505,True,2 .• trade announcements. 1 • • the cry is still they come. an excellent breakfast drink. guaranteed fruit coffee by the best 14 1 a n-r- ci la (registered). a 'mend of coffee which is pronounced to b
coffee,1890,2,2198,681,5.5515,True,mrs. roesc male mixture symington's ildinsurom coffee essence makes degleiems mem 1.. anatrut no irelublih in sari and imp whim ewe grocers. aaaaaaaaa 0 pusiii.
coffee,1890,2,2198,683,5.5538,True,"health and lioliday hints. coffee. beg to testify that good coffee, well prepared and unadulterated, is, next to tea, one of the most healthful of all drinks, and may be used with im-..."
coffee,1890,2,2198,684,5.5539,True,"for bile, liver, acidity, indigestion, &c. ithose who cannot take ordinary coffee can drink symington's edinburgh coffee essence with comfort and pleasure. in bott'es from all grocers. ovvvvvvo vswsio"
coffee,1890,2,2198,685,5.5541,True,symin gto n's edinburgh coffee essence r•••••• illelichms coffee i. • rn•••••t. no trouble. no ~so. is smell owl kars• betties. 'mo 111 orill•onlh
coffee,1890,2,2198,687,5.557,True,"fruit coffee. a west hartlepool luxury. ltr r george hall, grocer, ▪ stockton-street, west hartlepool, has hit upon • blend of coffee which is pronounced to be of..."
coffee,1890,2,2198,688,5.5594,True,"fruit coffee. a wirt hartlepool luxury. r george hall, grocer, stocjdou-street, west honiepool, has hit spoil • wood of coffee which is pronounced to be of • mod ..."
coffee,1890,2,2198,689,5.5594,True,"pure the finest quality finest costa rica or east indian finest mysore mixed with a portion of chicory, the quality of the above guaranteed. coffee in perfection. coffee, whole or ground. • 2/- pim le"
coffee,1890,2,2198,690,5.5595,True,"ge d des'b dandelion coffee the best and cheapest ever offered to the public. sold by all grocers and druggists, in canister 5d.. icd.. and is. 8d each. wholesale hv i grubem & ..."
coffee,1890,2,2198,691,5.5603,True,"largest sale hi the world. coffee! coffee! lipton's delicious blends of finest coffee and chicory 108., is., and is. 2d. per lb. pure coffee, richest and best, per 18. 6d. lb. so webe..."
coffee,1890,2,2198,692,5.5604,True,"symington's edinburg* coffee essence maas deficidas (oros in i assinent— ns tierils. li. wait,. in tonal, and largo yank% treat in oman. lons."
coffee,1890,2,2198,693,5.563,True,"free tin of liiiisieue swiss coffee tasteakt bent post paid app. appliestka 6 the swiss coffee co., m. restellmr** iftwato mal"
coffee,1890,2,2198,694,5.5652,True,"fruit coffee. a west hartlepool luxury. mr george ball, grocer, stockton street, west ilartlepi 01, has hit upon a blend of coffee which is pronounced to he of a ..."
coffee,1890,2,2198,695,5.567,True,"...s!-.? ences can be used .11 pleasure arr.l comfort by base wbn can- not drink the _ _ ordinary cue; whilbt tboa, win cofff.e and chi- c y ""nesee pure coffee essence s svaletul beverare.--clicasis 1;1"
coffee,1890,2,2198,696,5.5672,True,"atuto to noustvotbto a cup of 0001) coffee. or course no well-regulated housewife buys the triply of family coffee in the state whi:th is knoww •' ground."" oround coffee may sometimes be nices..."
coffee,1890,2,2198,697,5.5703,True,"the finest coffee procurable at is el.: shoat is. 4d. -i'ecial christmas blend indian and china tea, is. 10d. per lb. 31bs. for .58. 3d. ne strong liquor: will be foun..."
coffee,1890,2,2198,698,5.5713,True,zr; never be without a bottle of ti ci`f4 cymington'seilltiburgh coffee r 0; -essence in the house. an grocers sell it. it makes de- licious coffee in a moment. oteoseaosemageseceaseael
coffee,1890,2,2198,699,5.5719,True,"terrific slaughter of bic profits. by purchasing lipton's coffee you save about half- a-dozen dliderent middlemen's profits, and get your coffee direct from the vlanter. lipton's delicious oriental bl"
coffee,1890,2,2198,700,5.5729,True,"lipton in trtp, coffee trade. important notice. • hitherto i have been selling in the ceylon and london markets thousands of bushels of coffee of my own growing. i have now..."
coffee,1890,2,2198,701,5.5737,True,"edd:e.s dandelion coffee the best and cheapest ever offered to the public. bold by all grocers and druggists, in °muster 5d., 10d., arid is. bd. each. wholesale by j. gbddes ..."
coffee,1890,2,2198,702,5.5787,True,"essences ^e, be :tie • lesole,re ,oe'dort r liv.l3l{ -0121 .1604. ullo mu' .4 cid. itimmoc• yort coffee easence crateful illeversiga peptic's ose our dandelion coffee essence. h roy urocers thbaiioiio"
coffee,1890,2,2198,703,5.5795,True,gmlel in? rattan. by messrs. branch cl- leete. lipton in the coffee tr ade. important notice. hitherto i have bren selling in the ceylon and london markets thousands of bushels of coffee of my own gro
coffee,1890,2,2198,704,5.5808,True,"scientific noteiv nothwithstanding the reduction of the duly on coffee, and the fact that the best coffee is sold in great britain cheaper than anywhere in europe, it is steadily falling, ..ys the bri"
coffee,1890,2,2198,705,5.5824,True,"now open lipton's great tea, coffee, and provision market, at 59 lynn street, west hartlepool • these premises, which have been specially reconstructed and magnificently fitted up as a ..."
coffee,1890,2,2198,707,5.5831,True,",fooockroooc-eg the careful process by whico 0 symington's edinburclt coffee g essence is made eliminates all un- `(.3 pleasant properties. anyore can g drink it. from grocers every-olvere. r, 78 0 7-"
coffee,1890,2,2198,708,5.5837,True,"use marshalvs flour. beet value in the hartlepools, lynn st. brunswick st. fruit coffee. a west hartlepool luxury. mr george hall, grocer, stockton street, west hartleprol, has hit upon a blend of cof"
coffee,1890,2,2198,709,5.5849,True,fruit coffee. a west hartlepool luxury. -- 3111:21valti:priloril'htrctiti uspotnenkt4a niaesntrdeeei isaffce whlch is pronounced to be of a most delicious flavour...
coffee,1890,2,2198,710,5.5861,True,"lipton- in the coffeetrad,e.. important notice. hitherto l have been selling in therceylon and london markets thousands of bushels of coffee of my own growing. i have now ..."
coffee,1890,2,2198,711,5.5866,True,"fruit coffee. a west hartlepool luxury. me george hall, grocer, 1,1. iltocktonetreet, welt hartlepool, has hit up= • blend of coffee erhichis prom:mooed to be of ..."
coffee,1890,2,2198,712,5.587,True,"* ** plan adopted in many french households is to make extremely strong black coffee in the ordi- nary way. this is kept in a corked or stoppered bottle, and keeps good for a considerable time. when t"
coffee,1890,2,2198,713,5.5874,True,6 reakftet is mien spelled by the poorness of the coffee. it *an be made any strength by using symington's edinburgh coffee essence. 77
coffee,1890,2,2198,714,5.5876,True,"... the prices :- 10d., in., and is. 2d. per lb. these magnificent blends can only be obtained from lipton's markets and agencies. to all lovers of pure coffee, i offer the richest and best that mone"
coffee,1890,2,2198,716,5.5919,True,"lipton's great tea, coffee, and provision market, at 59, lynn street, west hartlepool. these premises, which have been specially reconstructed and magnificently fitted up as a ..."
coffee,1890,2,2198,717,5.5927,True,the most hutrmous cocoa. s grateful-comfortavo. cocoa for ereaktast and supper. those who cannot take ordinary coffee can drink symington's edinburgh coffee essence with comfort and pleasure. in bottl
coffee,1890,2,2198,718,5.5934,True,"important to advertisers. =nle'°-- *yid' crlo shipping and emigration. paditers and dicobators, people who cannot use ordinary coffee can drink symington's edinburgh coffee essences with comfort and p"
coffee,1890,2,2198,719,5.5936,True,"miscellaneous. cioffee and its effects—as an /aide of diet fruit coffee (registered) is wholesome, stimulating and nourishing. dr. paris remarks that coffee, if taken after a meal, is not found to cau"
coffee,1890,2,2198,721,5.5952,True,"a7.7.""117, aetromite. iiisedver- ad masi& yoset roar. a- wilt, mercurial or bening ooratiound• frurr coffee. a w est hartlepool luxury. air george hall, grocer, litocklanatreet, west hartlepool, has h"
coffee,1890,2,2198,722,5.5966,True,"... vegetable ingredients. for bile, liver, acidity, indigestion, &pc. free c*rom mercury. those who cannot take ordinary 1 sypain g t kit n s edinburgh coffee can d"
coffee,1890,2,2198,723,5.5986,True,"symington's edinburgh coffee essences are noted for their $ rich and delicious flavour. sold p in small and. large bottles by iesgrocers in eery town stet,4ol/11,1evivitet"
coffee,1890,2,2198,725,5.5987,True,"coffee essence makes delicious coffee in a moment. no trouble, no waste. in small and i.7.rge bottles, from all grocers. guaranteed pure. 100"
coffee,1890,2,2198,727,5.5998,True,"k * **** * ,symington's edinburgh coffee ziszences are noted for their and delicious flavour. sold ill. midi and large bottles by. grocers •in every to ,n"
coffee,1890,2,2198,728,5.6014,True,"<wwwwv...annaaaaaaai quality is the important requisite which is placed first by the makers of symington's edinburgh coffee es- sence. makes a cup in a moment. the great remedy. 17% n >44l,ia 14 ra, °"
coffee,1890,2,2198,729,5.6033,True,"e i-- who are • reztaapimneetaseettals,,,,,-'-- 5 the finest coffee essence that. 09 money can buy is symhigten's edin- burgh gaffe° essence. makes a cup in a moment. from grocers through- ~ gout the "
coffee,1890,2,2198,730,5.6035,True,"vinegar. purity and quality guaranteed. estab. over 250 years. soutuwark, london. coffee. coffee. refreshing at all times. lipton's delicious blends of finest coffee and chicory 10d., is., and is 2d p"
coffee,1890,2,2198,731,5.6036,True,"all that can blend. of coffee and chicory (for those id."" infer dismal! propartiots of chicory with cego)."
coffee,1890,2,2198,733,5.6051,True,"miscellaneous. cioffee and its effects—as an /aide of diet fruit coffee (registered) is wholesome, stimulating and nourishing. dr. paris remarks that coffee, if taken after a meal, is not found to cau"
coffee,1890,2,2198,734,5.6052,True,"lipton in the cotere trada. important notice. hitherto ',hare- been selling in the ceylon and lomb(' markets thousands of bu.shels of coffee of my own gro7sing i have now decided to dispose of this co"
coffee,1890,2,2198,735,5.6053,True,"fruit coffee. a west hartlepool luxury. mr george hall, grocer, stockton street, west hartlepcol, has hit upon a blend of coffee which is pronounced to be of a mo..."
coffee,1890,2,2198,738,5.611,True,"for bile, liver, acidity, indigestion, ez.c. thosewho cannot tdke ordinary coffee can drink symington's 1 edinburgh coffee essence with comfort and pleasure. in bottles from all grocers. c*aowt•wietok"
coffee,1890,2,2198,739,5.6117,True,"suatiovoir- 'elpful fr.: c*, nt rig4f.noft hs.n be toed with plemure valor ..iakt thane who uhl our coffee end chi- cory kleansce tr;tl fin ci our pore coffee frpcikip a grftlettil iterell2p chron.c d"
coffee,1890,2,2198,741,5.6129,True,"edinburgh coffee essences are the tjeading brand of the world and are noted for their delicate flavour, delicious aroma, and delightful strength. their other virtues ..."
coffee,1890,2,2198,742,5.614,True,"...eak stomach mpaired digestion; disordered liver. and female ailments. 240 0•04+00qm-0040.2.15,00 00.00041 0 satisfactory alike to guest i and host is coffee made with 1 symington's edin"
coffee,1890,2,2198,743,5.6153,True,"* ** plan adopted in many french households is to make extremely strong black coffee in the ordi- nary way. this is kept in a corked or stoppered bottle, and keeps good for a considerable time. when t"
coffee,1890,2,2198,744,5.6159,True,"idimetant notice. hitherto i have been selling in the ceylon and loudon mankets thousands of %she's of coffee of my own growing, i have row decided to dispose of this &fide, direct to tie consumers, a"
coffee,1890,2,2198,745,5.6163,True,"wilson's french coffee • • an unsolicited testimonial from the city analysist. messrs. wilson and son have been favoured with the following letter from dr t. h. walker, fel..."
coffee,1890,2,2198,747,5.6206,True,"adulterated coffee at runcoen. on monday, at runcorn police court, walter collier, grocer, church-st., was summoned lor selling half a lb. of coffee, which was not of t..."
coffee,1890,2,2198,749,5.6225,True,"fruit coffee. a west hartlepool luxury. mr george hall grocer, steektonetzwet, west harzlepool, has hit upon • blend of coffee which is pronounced to be of a meet..."
coffee,1890,2,2198,752,5.6261,True,".000000ndoo3o0oo,c0000,c i: owing to the special process, symington's edinburgh coffee z essences produce no heartburn c •or biliousness. cheap, strong, '- .?? pure. small and largo bottles. g from al"
coffee,1890,2,2198,754,5.6268,True,"lipton in trtp, coffee trade. important notice. • hitherto i have been selling in the ceylon and london markets thousands of bushels of coffee of my own growing. i have now..."
coffee,1890,2,2198,755,5.6268,True,"ii""a_a@*,**t.4ao*@-00.0.40.0000.0 z owing to the special process, 8 •• symington's edinburgh coffee g essences produce no heartburn c •• or b.liousness. cheap, strong, 1 pure. small and large bottles."
coffee,1890,2,2198,757,5.6284,True,"cuban coffee-making._ the most delicious coffee obtainable is to be found in cuba, and the secret lies in the peculiar way it is made. it is prepared by first hal..."
coffee,1890,2,2198,758,5.63,True,"09-.1000000.00000009c0.00.c0c have you tried symington's s e edinburgh dandelion coffee essence? c it is much used by persons of weak or feeble digestion. from all grocers. s 73 le"" *.e0.6000000:'"
coffee,1890,2,2198,759,5.6306,True,"fine flavour. diazawattee coffee which is the highest grade of coffee obtainable, acknowledge its superiority, and as it is now rapidly making its way into every part of the country,..."
coffee,1890,2,2198,760,5.631,True,"vinegar. purity and quality guaranteed. estab. over 250 years. soutuwark, london. coffee. coffee. refreshing at all times. lipton's delicious blends of finest coffee and chicory 10d., is., and is 2d p"
coffee,1890,2,2198,763,5.6333,True,"... powder iii aewpve,lirid. oritiwitriganzwarratigiranwrot 6 the smoothness, define/ and unifor- 6 i° mity of flavour have made symington's 6 edinburgh coffee essence a table fa"
coffee,1890,2,2198,764,5.6339,True,"fdinpurgh coffee essence makes delaious coffee /n a moment. no trooble, no waste. in small and large bottles, from all grocers. • 100 rymostes stork, for errant yam h..."
coffee,1890,2,2198,765,5.6345,True,"an excellent breakfast drink. fruit coffee (registfitui) a blend of ooffee which is pronounced to be of a most delicious flavour, and wholesome, stimulating, and nourishing. fi.e.isted l.) pa ..."
coffee,1890,2,2198,766,5.6362,True,gossip mu women. the best and easiest way of making good coffee is to buy the coffee in berries and grind it your- self. place a sufficient quantity of the ground coffee (according to the size of the 
coffee,1890,2,2198,768,5.6383,True,"lo grcunds in symin,iton's edinburgh coffee essence. always of one standard tivality. pure and strong. from crccers ourywhcre. 72 it t!ie ini versal remedy. coughs colds! asthma bronchitis! bla..."
coffee,1890,2,2198,769,5.6383,True,"edd.es dandelion coffee the beet and cheapest ever offered lo the public. sold by all grocers and druggists, in canister m., 10d., and is. bd. each. wholesa:e by j. geddes a..."
coffee,1890,2,2198,770,5.6395,True,"lipton's delicious oriental blends. finest coffee and chicory, 100, 1., and is 2o per lb. pure coffee!! richest and best. is 6:. per 1.13. no molina piz."
coffee,1890,2,2198,771,5.6396,True,"a awattee coffee mething new in the coffee pot. an absolutely pure coffee.trpitlta why has english coffee become ,so undrinkable in recent years? for the simple reaso..."
coffee,1890,2,2198,772,5.6412,True,"fruit coffee. a west hartlepool luxury. mr george hall, grocer, stockton street, west hartley. 01, has hit upon a blend of coffee which is pronounced to be of a m..."
coffee,1890,2,2198,774,5.6421,True,"the coffee pot pure coffee. 'or 115:eakfl,'; 707: ..7.2.1:117..' for stj true aroma, 'me flavour, fragrant. digestive, refreshing, exhilarating rr.:t. corrrr, t..."
