word,decade,cluster,cluster_size,rank_in_cluster,distance_to_centroid,target_word_visible,snippet
coffee,1900,2,380,106,4.9954,True,"...maul tea awl meetiat the sixth annual tea party and entertain- ment in connection with the blackpool branch of the y.m.c.a., were held at the station coffee palace on wednesday even"
coffee,1900,2,380,108,4.9987,True,"middleton the usual fortnightly meeting of the mutual cot- ton class took place on monday night in the coffee palace, old hall-street, middleton. mr. charles howarth presided. mr. ben robinson (the le"
coffee,1900,2,380,114,5.0349,True,ieiiddle'i'on. the fortnightly meeting of the mutual cotton glass was held ou thursday week in the coffee palace. middleton. mr. ben robinson occupied the chair. the proceedings were of an °nen charac
coffee,1900,2,380,115,5.0419,True,"warrington. arpley cricket club. the animal cueetmig ,4f the arpley cricket club w&9 held at the british workman's coffee rooms, bridge-street, on friday evening. a satisfactory report and financial s"
coffee,1900,2,380,118,5.0552,True,"liberal women. lllackpeel associatioa's *dist the &anal meeting of the blackpool romen's liberal association was held at the station coffee palace, last night, a large gathering of ladies attending. m"
coffee,1900,2,380,121,5.0715,True,"little borough. weavers' meeting.—a shop meeting was held on thursday evening week in the coffee house, shore, called by the weavers' association, with the view of improving the organisation of the di"
coffee,1900,2,380,122,5.0735,True,"...ivrit sten. sheep woh ny 1 n 4.; legislati4n ing of the lancastet of the a meet laticahire farmer,' ae-ociation was held on saturday. the maiket hall coffee tavern. • ,re,e present mess"
coffee,1900,2,380,123,5.0805,True,"—:o: we wish mrs. harriet davies, late of foehriw, now at the victoria coffee tavern, rhymney, every success. —:o: it is rumoured that the band is to rise again. well, lam sure there are plenty of you"
coffee,1900,2,380,128,5.1229,True,"... the annual meeting. the founia annual business snostlag of the blackpool youug m.. christian ass* ciathou, wss held ou thursday last, in tho statioa coffee palace.. -- mr. lemuel jo"
coffee,1900,2,380,131,5.1561,True,...t tea. satiated special road for motorists. the blackpool company-house keepers' association held their annual tea and en- tertainment in the station coffee palace on wednesday e
coffee,1900,2,380,133,5.1612,True,"...on. complaints of seem. worrying. vigorous action. proposed tax on imported flour. a meeting of the council waa held on satur- day in the market hall coffee room-, 1.1•11e"
coffee,1900,2,380,137,5.1701,True,"middleton. the weekly meeting took place last thursday week in the coffee palace. mr. charles lancashire pre- sided. mr. joseph oldham, a member of the ess, gave a 'lecture on ""platt's banking-off and"
coffee,1900,2,380,138,5.1933,True,"...i3. lie. stephemon.. half-way house. 131ackpool. wrote giving the corporation nix months wiliee to rimove the urinal in the roar of and adjoining the coffee tavern, meardengate, haslingden. the s"
coffee,1900,2,380,139,5.1942,True,"... drawors' a szoziation. tea party and dance. on saturday the members of the above aesecia• con, to the number of about fifty, assembled at mr. simms' coffee rooms, marke"
coffee,1900,2,380,140,5.1962,True,... llackpell charity's appeal for help. the annual tea and meeting in connection with the blackpool rescue and preventive home were held at the station coffee palace last evening. the
coffee,1900,2,380,142,5.2228,True,"...will, meet to eonsidur the budget ou wednesday week. last nirr,ht, the quarterly inecting of the cc-inc tradesnwaf.s association was held at the come coffee tavern. the trawde"
coffee,1900,2,380,144,5.2288,True,"_ scene in a restaurant. thomas davison (21), signalman on board bedford, at chatham, was charged with asqault, and with refusing to quit :wallaby's coffee howe, linthorpe-road.—the evident showed tha"
coffee,1900,2,380,145,5.2448,True,...e and district weavers' absociation. the quarterly meeting of littleborongh members of the rochdale and district weavers' association was held in the coffee ho
coffee,1900,2,380,147,5.2534,True,(author's copyright). note.—the lancaster g-foup resume their weekly meetings next tuesday at the market street coffee tavern at seven o'clock. a welcome will be extended to al in sympathy with the mo
coffee,1900,2,380,151,5.2695,True,"church assoc lat ton al.dcrur. will be delivered in tlie coffee tavern, corn liarket,tieet, entitled .tlle royal deelaratiom: a safeguard of eng- land', civil, social, and re liberty,"" on lionday, dec"
coffee,1900,2,380,152,5.2748,True,"public meeting. in the e.ning, • well ettended meeting was held in the station coffee palacio. the rey. n. g. jeffrey ...merl, and he was eupported by the revs. t. h. ethell, w. ev.a. and j. cont.. an"
coffee,1900,2,380,153,5.275,True,"...'s samoa. ""a moral stock-takiat"" the young men's christian association, blackpool, held their last service of the old year, on sunday, in the station coffee palace."
coffee,1900,2,380,156,5.3148,True,...s oommeoned ita winter programme in rigammi wiliam the sixth annual public tea and meeting will be held tomorrow afternoon and evening at the station coffee palace. • larg
coffee,1900,2,380,157,5.3318,True,"simultaneous draughts playing. there was a good muster, of the members of rich- mond's draughts club at the coffee rooms, bridge- street, last thursday evening to meet mr. f. dunne, who had engaged to"
coffee,1900,2,380,158,5.34,True,"...s to the blackpool tramwey employes' ""social,"" • tea sod entertainment to the children of the tramway men will be siren this even- ing in the station coffee pal"
coffee,1900,2,380,162,5.3754,True,"the sheep dipping seder. a protest. meeting of lancaster farmers. at the market liall coffee tavern, on saturday a largely-attended meeting with the lancaster breach of the laneaehire farmers ameriati"
coffee,1900,2,380,163,5.3838,True,"..410.4- the annual meoluage ot the blackpool rescue and pioviiimivo rome are being held tomorrow evening at the station coffee palace, hounds uhl in the afternoon there will be a oak of work, to be o"
coffee,1900,2,380,165,5.4055,True,"warrington. arpley cricket club. the anuual meting 4f tne arpley cricket clul). was held at the british workman's coffee looms, bridge-st:eet, on friday evening. a atisfactory report and financial sta"
coffee,1900,2,380,168,5.4213,True,"...sermon. ""a moral stock-taking."" the young men' 2, chrivian association. blackpool, held their last service of the old year, on suuday, in the station coffee pal"
coffee,1900,2,380,169,5.4215,True,"middleton. the weekly meeting was held last thursday night in the coffee palace. mr. benjamin robinson was in the chair. mr. a. m. ashcroft should have given a lecture on ""wirding and flyer frames."" b"
coffee,1900,2,380,174,5.4961,True,"...on's elport. mom,. sreed, danger, and dust. a meeting of the lancaster branch of the lon.thilure eamon.' asaciation was hell at the guru market-onite coffee tavern,"
coffee,1900,2,380,179,5.5282,True,"pontlottyn news. death. an event occurred on friday last which has cast quite a gloom through district. on the previous morning mrs. j. lewis, emlyn coffee tavern, jour- neyed as far as cardiff infirm"
coffee,1900,2,380,181,5.5309,True,"...on. joining the amalgamation. the quarterly meeting of the wigan and district cardroom operatives and ring spinners' associa. tion was held at simms' coffee rooms, ma"
coffee,1900,2,380,186,5.5516,True,"...cue home. annul business ileetiat the annual general bumn• ems meeting of the blackpool rescue and preventive hoene was held on monday in the station coffee palace, hounds hill. lins. j. j"
coffee,1900,2,380,187,5.5665,True,".-tit***- a rummage and variety sale in connection with the blackpool branch of the y.m.c.a. will take place in the station coffee palace, next monday and tuesday. mrs. reid, of ""ravenswood,"" lytham-r"
coffee,1900,2,380,188,5.5914,True,"iviii take plat* et the station coffee palace. hill wednesday, november 27th, 1907. a sale oy work _ _ will be ;nom zed by mrs. 11. s. robeatei. chair to he taken by mrs. t. i)onnelly. tea..."
coffee,1900,2,380,189,5.5943,True,"padiiiam. new society.—a meeting of the cabinet- makers of the town was held on monday evening at the coffee rooms, when it was decided to form a branch of the amalgamation. death.—mr. alfred hibbert-"
coffee,1900,2,380,195,5.677,True,"middleton. the weekly meeting of the cotton class was held in the coffee palace, middleton, on thursday week. mr. b. robinson presided. mr. cartwright, of the soudan mill, gave a lecture on ""winding."""
coffee,1900,2,380,199,5.6975,True,...lo.—last wednesday evening the quarterly meeting of the littleborough branch of the rochdale and district weavers' association was held in the pahlic coffee l
coffee,1900,2,380,202,5.726,True,"blackpool ulc.a. annul meetiag last niikt. the members and friends of the blackpool y.m.c.a.. gathered in goodly numbers be the station coffee pekoe, last night, when the annual tea and meeting were h"
coffee,1900,2,380,205,5.7642,True,"middleton. the fortnightly meeting of the cotton class yr"" held in the coffee palace, middleton, on monde! night, mr. benjamin robinson in the chair. 31c. walter bailey, of ashton, delivered a lecture"
coffee,1900,2,380,208,5.7831,True,...way dangers. the pamis takes oil his hat. the blackpool branch of the amalgamated society of railway genuses held to enjoy• able axial in the station coffee palace on friday evening. when soma int
coffee,1900,2,380,209,5.7931,True,"middleton. the weekly meeting was held in the coffee palace on tuesday night. mr. b. robinson presided over a fair attendance. mr. joseph oldham was the lecturer, and he took for his subject ""platt's "
coffee,1900,2,380,214,5.8547,True,"-tsb y. 1141 a. successful rummage sale. a enormsful varirty and rumouige oale was held ou friday, is the sista. coffee palace. its contortion with the blackpool branch of the a.m.c.a. the object of t"
coffee,1900,2,380,219,5.8803,True,"aiiddle""ra7 the weekl y meeting was held on thursday week in the coffee palau°. middleton, mr. lion robin- son presided. an interesting lecture was delivered by mr. h. mcdougal on ""roller setting and "
coffee,1900,2,380,225,5.9491,True,"...ial direct west india th e skinningrove beach mystery. mail service. verdict' of ""wilful murder.' trial trip of tile fort royal. oa tuesday at ""tim's coffee house"" hotel, 'ulm successful inmigu"
coffee,1900,2,380,228,5.9893,True,...n(inued.) anecdotio of :swim—a cary 111 tota or swift'. first entry into one of the hauntsof the %two which we may take to have been the st.. oames's coffee house. those who frequented he plac
coffee,1900,2,380,231,6.0046,True,... local young ladies who have worked po beld9uldy to endow a out at the victoria hospital. the sale of work held on wednesdey afternoon at the station coffee palace 
coffee,1900,2,380,235,6.0267,True,".... blackpool's growing debt. mr. john smith, the ratepayers' elective auditor, gay, his third annual public report on municipal matters at the station coffee "
coffee,1900,2,380,236,6.0361,True,"alston's classes, (under new 11anagibizet) thomas's coffee rooms, lieds road, nilson. ""complete commercial education."" opening lecture (free), to-night, friday, at 7-30. by f. j. dawdry, i.p.s. hot/om"
coffee,1900,2,380,238,6.0491,True,"ityalligis :at -0431,fesi. name would be added. mr. h. l beckwith supported and said that they had been thinking of purchasing a building near a coffee house. it would bold about 300 men, and the cost"
coffee,1900,2,380,242,6.0985,True,"...yoptißis. his mess* fee the mew year. the bev. j. s. balmer was the speaker at the lanteni service, organised by the y.m.c.a, and held at the station coffee p"
coffee,1900,2,380,247,6.1612,True,"a carver's death. george hopkinson who was employed es a carver at the coffee palace, central beach, died suddenly on the premiaes on sunday. annie webster, the cook, who resides at the restaurant, st"
coffee,1900,2,380,248,6.1628,True,"can you kee' a secret? the story of an early morning meeting at a coffee stall in sloane-equars, and tho making there of an app,intrnent that tit as only too well kept by one party to the transaction."
coffee,1900,2,380,249,6.1729,True,"for the prceeoution was that the prisoner went into the coffee palaee and asked an 'attendant to buy two razors, and beeau,e she refused he -picked up the bread loaf i (produced) arid rushed out of th"
coffee,1900,2,380,250,6.1785,True,"a carver's death. george hopkinson who was employed es a carver at the coffee palace, central beach, died suddenly on the premiaes on sunday. annie webster, the cook, who resides at the restaurant, st"
coffee,1900,2,380,256,6.2368,True,"*-10041-• the annual sale of work in aid of the en dowment of the ""children's cot"" at the blackpool hospital will take place at the station coffee palace on wednesday, february 27111. miss may hickson"
coffee,1900,2,380,259,6.2426,True,"can you kee' a secret? the story of an early morning meeting at a coffee stall in sloane-equars, and tho making there of an app,intrnent that tit as only too well kept by one party to the transaction."
coffee,1900,2,380,265,6.3539,True,"for the prceeoution was that the prisoner went into the coffee palaee and asked an 'attendant to buy two razors, and beeau,e she refused he -picked up the bread loaf i (produced) arid rushed out of th"
coffee,1900,2,380,266,6.3629,True,"bisioric cragedles of condon er. by w. w. hutchings. to the very spot! the next day harri- son met a gentlenan at a coffee house in salisbury-court,%nd him he told that he had just come to town from k"
coffee,1900,2,380,270,6.391,True,"...miming or ted association, the annual meeting of the lan,aster branch of the law...bal.° farmer.' aseociatiou was held on saturday at thd market rail coffee tavern, mr. g. ga"
coffee,1900,2,380,272,6.3984,True,"eyrursions. znition. ,*easide .4partments the ""globe"" coffee tavern, sheep- street ""cavendish tavern, near railway station: and sackville-street"" tavern, skipton. cyclists, tourists, picnic parties, &"
coffee,1900,2,380,273,6.3986,True,"market cross coffee tavern (c t c market place, beverley. the noted remnant wrr-ehnise. s. exley, 26, toll 24vel, beverley. speciality dres: skir:s a,dtaouses. barker al..."
coffee,1900,2,380,274,6.4091,True,"market cross coffee tavern .0 t market place, beverley. the noted remnant warehouse. s. exley, 26, toll gavel, beverlev. speciality: lathes' press skirts and dio use;."
coffee,1900,2,380,275,6.4125,True,"stoidt and eavntrg. /tire globe coffee tavern, -11- sheep street ""cavendish"" tav- ern, near_railway station; and ""sack- ville street"" tavern, skipton. or:piste, tourists, nettle parties, &..."
coffee,1900,2,380,276,6.4231,True,"market cross coffee tavern (c.t.e), market place, beverley. .1( 26, toll gavel, beverlev. speciality ladies' dress skirts ar,d dlauses. the noted remnant warehouse, s. e..."
coffee,1900,2,380,277,6.4344,True,"w. rutherford, market cross coffee tavern tc•re). market place. beverley."
coffee,1900,2,380,282,6.4608,True,blackpool rescue howl an xnjoyarlp benpvit concrrt. a fairly large audience aseembled at the slagle. coffee nisei. hounds hui. on itaturday evening. eke an enjoyable con- cert yea given b- mr it h rea
coffee,1900,2,380,287,6.525,True,"men's keit'iiigii at the statics coffee palace. on &today afternoon, ovot 110 men root i, the station coffee pelson at the men's m•kwir. the efeekeir eta. kr. w. k. potte, of ilardhorn; and..."
coffee,1900,2,380,292,6.5874,True,"flaßkker cross coffee tavern niaikzt place., beverley. the noted remnant wyoerman. s. exley, 26, toll gavel, beverley. _specirlily ladies' dress skirts and dlousti j. w. m..."
coffee,1900,2,380,295,6.6587,True,coffee tavern v. church streut libeirals. a billiard mateh took place on thersday evening in the market-street coffee tayerg roolll9 bet-p.l'4w teams repree...
coffee,1900,2,380,296,6.6646,True,"market cross coffee tavern ctc market place, be n erley."
coffee,1900,2,380,297,6.6817,True,"men's keit'iiigii at the statics coffee palace. on &today afternoon, ovot 110 men root i, the station coffee pelson at the men's m•kwir. the efeekeir eta. kr. w. k. potte, of ilardhorn; and..."
coffee,1900,2,380,304,6.8172,True,"...rabllbltids el oes ceek•ra. toe the put fourteen or fifteen yew. uwe has hen an annual etbilotion of the 1.1011 “lioreka"" gas cookers. m lb. inb pool coffee palau, by jobe wright tug eagle"
coffee,1900,2,380,307,6.8386,True,"coffee house commerce. thin influential association of merchants, ship- owners. underwriters, 140 ship and insurance brokers. was originally a more informal..."
coffee,1900,2,380,310,6.8776,True,"cktting i lunch. a sad-looking gentleman, like a sort of very-much- retired hamlet, with a painful expression of face, entered the coffee room of a oountry hotel the other day, holding in his hand a s"
coffee,1900,2,380,311,6.8924,True,—:o: the decoration work will be com- menced ere long and the coffee stall will be another innovation. —:o: the proprietors. have decided to plane the floor again in order to get the best possible sur
coffee,1900,2,380,313,6.9372,True,"...ter farmers. motors and motorists. the milk standard. ia well.at,ended meeting of lancaster and i•diaitrirt far ~,,, ra wllti held in the market hall coffee la"
coffee,1900,2,380,314,6.9616,True,"...on of the west kirby branch of the society closed with 121 mein...its, 23 emaciates, and 8 who took the pledge with- out joining the association. the coffee rtall at the corner o"
coffee,1900,2,380,315,6.99,True,"ninth mid the united local tobilcci, dea.leits' alti.txce.—cm xinob.. 'l.lll.lcco -eting of local tobaeo. monday afternoon a in. market-street coffee nit, was hold at the cori. n.ces of the above tave"
coffee,1900,2,380,320,7.1107,True,"market cross coffee tavern ctc. market place, beverley. tie noted remnant warehouse, s. exley, 26, toll gavel. beverley. speciality ladies' dress skirts aud dlouses. r: ..."
coffee,1900,2,380,327,7.3268,True,"chapter xxxv. margery's resolve. it was the following morning and in the coffee room of the hotel to which martin had taken joyce and her companion upon reaching wolverhampton, he was pacing to and fr"
coffee,1900,2,380,328,7.3331,True,"coffee house commerce. thin influential association of merchants, ship- owners. underwriters, 140 ship and insurance brokers. was originally a more informal..."
coffee,1900,2,380,332,7.4207,True,"market cross coffee tavern actc market place, beverley. ti noted remnant warehouse. s. exley, 26, toll gavel, beverley. speciality .2adies'press skirts arid diouses **b...."
coffee,1900,2,380,340,7.5859,True,coffee tavern v. church streut libeirals. a billiard mateh took place on thersday evening in the market-street coffee tayerg roolll9 bet-p.l'4w teams repree...
coffee,1900,2,380,341,7.5945,True,"...on of the west kirby branch of the society closed with 121 mein...its, 23 emaciates, and 8 who took the pledge with- out joining the association. the coffee rtall at the corner o"
coffee,1900,2,380,342,7.5955,True,coffee tavern v. church streut libeirals. a billiard mateh took place on thersday evening in the market-street coffee tayerg roolll9 bet-p.l'4w teams repree...
coffee,1900,2,380,343,7.6033,True,"slaithwaitm ilaiu-class tea, roa,tal coffee 1 3.--city tea co., coffee roosters, slaithwaite. football club —mei senior foothall club pro. noted an enjoyable ball at the willson saturda.s eveni..."
coffee,1900,2,380,344,7.6394,True,"male waitress. ""i am a waitress at a coffee shop,"" solemnly, declared a male witness at a spital- fields inquest on monday. silver at £l4 per ounce. a charles 11. plain porringer dated 1675 and..."
coffee,1900,2,380,347,7.7494,True,"...••it• by the kindness of mr. buddketone, the general manager of the winter gardens, gt meeting in connection with the men's ser- vices at the station coffee palace will bor hela on sunday afternoon "
coffee,1900,2,380,348,7.771,True,"northern weekly gazette. first english coffee-house. the earliest record f a coffee house in england dates back to the year 1650. it was then opened in the parish of st. peter, oxford, by a jew n..."
coffee,1900,2,380,350,7.8365,True,"300 years old coffee house. ""ye olde chapter coffee 'louse."" which for over three eenturies has occupied • site in. pater- noster row. is in the market. says the london c..."
coffee,1900,2,380,351,7.8484,True,"volociiiiiiiii 11:11 md o. om= midi. younio womir's christian asmociation. ws czurcks street, blackpool. sale of work will tai aaa at tka mation coffee palace. al so wekek. os wzdnicsdat, may 26d. 190"
coffee,1900,2,380,353,7.885,True,working i • home rule ogy) .—say ate.; 'ere eggs einell 6.5. manager of radical coffee shop) didn't know you manta :i toonell 'ens. i than& you voaallid west 'am try • halo of ow &alum rum then you'll
coffee,1900,2,380,355,7.9362,True,coffee tavern v. church streut libeirals. a billiard mateh took place on thersday evening in the market-street coffee tayerg roolll9 bet-p.l'4w teams repree...
coffee,1900,2,380,356,7.9714,True,coffee tavern company. criticini by shareholders. not up-to-date. c2tering for working classes 'unprofitable. the annual meeting of the shareholders of the ...
coffee,1900,2,380,360,8.0654,True,--:o: coffee house dividends are down. that seems to be the outstanding feature of the rezent meeting of the coffee tavern com- pany's sharcholders. to tell the t...
coffee,1900,2,380,361,8.0655,True,--:o: coffee house dividends are down. that seems to be the outstanding feature of the rezent meeting of the coffee tavern com- pany's sharcholders. to tell the t...
coffee,1900,2,380,365,8.1485,True,"slaithwaite kiffia.ciass tu,2,' frea %meted cuffee tea co., coffee ho:viterd, slaithwaite. ziox baxo ot hot.—a baud of hope ha recently been formed in connection with the zidu liaptiet sunday school, "
coffee,1900,2,380,366,8.15,True,"woodside coffee hut to the editor of the birrenkead news. sir,—ln your issue of the 4th inst, a cus- tomer complains that on four oce.asmns lately the above hut was ..."
coffee,1900,2,380,370,8.2163,True,"herald abic bodies washed ashore. on saturday afternoon, at coffee house hotel, skineingroec, mr t. it /i. titubbs, deputy-conater, held all illque•st on the body of an unknown man which had been wash"
coffee,1900,2,380,373,8.4804,True,"coffee house commerce. thin influential association of merchants, ship- owners. underwriters, 140 ship and insurance brokers. was originally a more informal..."
coffee,1900,2,380,376,8.6489,True,"...estion to mr. hanbury tee price o 1 mile. st liffrlno of ,lancabrir f.l ft niers' .vssocution. a meetingri the council %. et, 'mid tu the market hall coffee tnvern, on sat"
coffee,1900,2,380,379,9.1825,True,"bishops speech in a coffee house. 'fhe dishop-disigne.to of london, dr. win- nington-ingreun, in addreesing a meeting of working men at a coftce palace in whitechapel known as ..."
coffee,1900,3,724,42,5.4162,True,"...esentation. mr gilson, who has been statibumaster at. hartlepool fcr seven yea. has been presented by his colleagues with a hand- some silver tea and coffee service, on hie leaving to take up a simi"
coffee,1900,3,724,46,5.4495,True,"rishton. long service.—on saturday the work- people at victoria mill held a tea party and social, when a solid tea and coffee service was presented to mr. harry smith, the head carder, who has been em"
coffee,1900,3,724,60,5.5113,True,ne wby. pitementation.—the tenants of mr. vyner's yorkshire estate at newby nd amkrigg have presented mr. r. j. h utehmson with a silver tea and coffee service as a mark of their esteetn on his appoin
coffee,1900,3,724,62,5.5234,True,"... hadlow cottage, wi. listen, has been presented by the day and sunday school teachers of the neston na- tional schools with • handsome silver tea and coffee servi"
coffee,1900,3,724,75,5.6019,True,"* * one sentence of honest praise bestowed at the right time is worth a whole volley i of scolding. * * when putting away the silver tea or coffee pot which is not in use every day, lay a little stick"
coffee,1900,3,724,93,5.7037,True,"mr w. glover. mr w. glover, who was recently made the recipient of some valuable silver plate in the shape of a tea and coffee service and silver tray, on the occa- sion of his retirement from his pro"
coffee,1900,3,724,94,5.7082,True,"loans for labor amounts at low rate& £1 15a—just forfeited, a vary bamboo= tea sad coffee service; float silver plate, beautifully. hand warr.red; bonettly worth at £1 156,—v7.6irdadsomeze..of the ver"
coffee,1900,3,724,102,5.7659,True,"...'s works. toe melte.. of albany's present was 'lo volumes of kipling's work, and princess christian's preseet 1•116 a fihe qulell anne silver tea and coffee service. fiona princess louts. duche"
coffee,1900,3,724,108,5.7926,True,"briercliffe. haggate band of hope. the weekly meetings of the newsion in connection with the above were opened on monday, when a bun and coffee feast was provided. after which a miscellaneous entertai"
coffee,1900,3,724,110,5.798,True,"...sentation to councillor gilmour. on thursday evening, at the wellington hotel, earlestown, councillor w gilmour was the recipient of a silver tea and coffee service. subscribed for by his constitue"
coffee,1900,3,724,112,5.8139,True,"...esentation to councillor gilmour. on thursday evening, at the wellington hotel, earlestown, councillor w gilmour was ne recipient of a silver tea and coffee service, subscribed for by his constituen"
coffee,1900,3,724,114,5.8196,True,"the presents, herald. roonk's absir; mrs madan (lond(n), dia- mond and pearl pendant and tea and coffee service and kettle; tlhe mimes sisson (har- rogate), afternoon tea cloth; dr. and mrs e. m. swan"
