word,decade,cluster,cluster_size,rank_in_cluster,distance_to_centroid,target_word_visible,snippet
coffee,1900,0,1322,644,5.9488,True,"cask your grocer for ir symington:s r -00frf e the purest. the cheapest esst-til and the best 01, makes coffee of &heins flavour and strength. tllo symoi tigiota eddi fem ale ailments • aiaai 41.0 mar"
coffee,1900,0,1322,645,5.9501,True,"arrival of new coffees. our finest new crop coffeo at italod is. giving great satisfaction, and we are offering rare value in various growths, ground or in the bur ry at i..."
coffee,1900,0,1322,646,5.9522,True,"g eddes dandelion coffee the beet and cbeapest ever offered to the pnb sold by all tirwers and druggists. in ()snide:, 5d.. md., and is. bd. each.' wholesale by j. geddes a.w..."
coffee,1900,0,1322,647,5.9535,True,"from san paulo (brazil) every tin bearing the official seal and guarantee of purity. pure coffee stands apart from all other coffees, possessjpg beneficial properties unique and unexcelled. to add any"
coffee,1900,0,1322,649,5.9651,True,"edinburgh coffee essence every woman should send two stamps for our 32-page illustrated uoo`f., containing valuable information how all irregularities ao.i obstructio..."
coffee,1900,0,1322,655,5.9716,True,"durable. unshrinkable. ymington s coffee essence no other fssencecan make such a delicious, 9' refreshin beverage clark's world-famed blood itl ixture is ft most guaranteed cure for all bloo..."
coffee,1900,0,1322,656,5.9717,True,"law ccident insurance society limited m) office: 215, strand, london. there is as much difference in the quality of coffee, as of tea. _ symington's is made from the finest coffee grown and represents"
coffee,1900,0,1322,657,5.973,True,"syminctows edinburgh coffee essences make coffee equal to that prepared direct from coffee beans: s 14 or 33 stamps. crane court, fleet-street. london. e.c. li.. ,parbdisu for— ..."
coffee,1900,0,1322,658,5.9761,True,"...ad office: 215, strand, london. branch office: caledonian buildings, pilgrim-street, newcastie-on-tyne. there is as much difference in the quality of coffee, a"
coffee,1900,0,1322,659,5.9772,True,"o, :4. • r • • • • av.; • ••• • ills 0 trzy nothing steadies the nerves 1 and clears the brain lilcd, acc strong cup of symi.ngtoit's edinburgh coffee ess.9nce, in bottles from all grocers. 82 the new"
coffee,1900,0,1322,660,5.9783,True,highest 11ottoufts liptons coffee & cocoa were awarded the grand prize (thix is the highest honor obtalmthle). lovers of perfect coffee and cocoa will find liptons unequalled for exce...
coffee,1900,0,1322,661,5.9794,True,"slaithwaite. pare coffee in perfection. refreshing and ntimulating. fresh roasted and ground daily. einest quality, is. bd. per lb. try a sample, a; lb. sd.—city tea co., sla..."
coffee,1900,0,1322,662,5.9796,True,"cpcp,:,--srififtr6tll6-6 trelvectirnitf >t, nothing steadies the nerves land clears the brain lik, a strong cup of' symington's edinburgh coffee ess3ncee id bottles from all grocers. • 82 _____ the ne"
coffee,1900,0,1322,664,5.984,True,"ed burgh coffee essence makes delicious coffee in a moment. nu trouole, no waste. in small :.•.•nd large bottfrs, from all grocers. cuaranteed pure, 10e watch & chai..."
coffee,1900,0,1322,665,5.986,True,"there is as much difference in the quality of coffee, as of tea. symington's is made from the finest coffee grown and represents the acme of purity strength, and flavour. refuse all imitations. free t"
coffee,1900,0,1322,666,5.9862,True,"eddes dandelion coffee na the best and cheapest ever offered to the pubiii. sold by all grocers and druggists, in clanistea bd., 10d., and is. bd. each. whoiesaie by j. ged..."
coffee,1900,0,1322,667,5.9876,True,"edinburgh coffee essence ladies don""r csperiment with uselesa remed.es. send stall:wed address for free sample of my treatment. amazingly effective. i am a skilled sp..."
coffee,1900,0,1322,668,5.9905,True,"a notable free cift 3 i ho. of le valery's reno, berry coffee roasted on the continental s stem which has made the cafes of paris and vienna so famous, sent car- nage paid on receipt of 411- together "
coffee,1900,0,1322,669,5.9914,True,"fr'nrmnf =mu-isi)- incll=r ic 1 nothing steadies the nerves and clears the brain lik2, a, strong cup of symington's edinburgh coffee esssnce, in bottles from all grocers. 82 tub new flotnol4 rismedy. "
coffee,1900,0,1322,670,5.9935,True,"piddess dandelion coffee the best and cheapest ever offered to the pnblll. sold by all grocers and druggists,t 9anistes 6d.. 10d., and is. bd. each. wholesa:e by j. geddes an..."
coffee,1900,0,1322,672,5.9955,True,"o.4kbblooduure covnel the purchase of the coffee that ,always pleases family, or guests symington coffee c 54 nee marvellous discovery. experts are deceived the pearl necklaces are unbreakable, they..."
coffee,1900,0,1322,674,5.9975,True,"ymington s coffee essence no- ofher4 fssence can make such a delicious, 9' refreshin g beverage' one box of clarke's b 41 pills is warranted to cure, in either sex, al..."
coffee,1900,0,1322,675,5.9977,True,".. coultsell the purchase of the coffee • thai always please•s family or guests a 9 51#11nington coffee es.*erice _ t5....-f ihibw. ...... t • aird 1. \ t ''.., • ,• richly fraaran ..., :s ..."
coffee,1900,0,1322,676,6.0014,True,symingtons eoinburgh h „ i coffee essences sold everywhere
coffee,1900,0,1322,677,6.004,True,"i ""owl symincton's coffee 1 essence .11 zl, .11 ,774' zse • • • g. aurroitittivs, monfitorivu wewrilfra .bickerstaff's for excellence of qoality in fl 9 u r. • thi warehouse. ..."
coffee,1900,0,1322,679,6.0111,True,"has no equal. for purity., strength, and frogroace, its nght at the top. • ask your orocer for °camp"" coffee and take no other. ••• 'mop' oak. vorpm. psiammal ..relos walla _ ;wail"
coffee,1900,0,1322,680,6.0112,True,"coffee by post direct from the market at 1/6 per lb. sold roasted only, not ground in 41b. packets for _ _ _ ea. bi, carriage paid green tree coffee s a ble..."
coffee,1900,0,1322,682,6.0148,True,"remember fazenda the coffee la ith a government goarantee. ,:-_ ..._ki.,-,t1:.::',1v,;;;:,...3.'.3.3-si-.::: ~. remember if fazenda s•''4* ,"" w..-i,,ria. • tim official seal & g..."
coffee,1900,0,1322,683,6.0165,True,"nrimear /blac ia lead ""yaiw-aos cask you r croccr for ir m i ngton 5 _ _ ""arnmoußtnte r coffee ""c 4 -q-9r the purest. e. nce the cheapest and the bey liab makes coffee of delicious rlavcur and streng-"
coffee,1900,0,1322,684,6.0191,True,"counsel the purchase of the coffee that always pleases family or guests symington )ff cottee acme .., 5...4 '. .., ~. p a r e 6: richly frag rant-.--•---,:-.:,;17..:',:- i nvigoraring ..."
coffee,1900,0,1322,685,6.0277,True,"essences paradise makv-1 coffee equal to that prepared direct from coffee beans. • i i • it 'ia •:4,4 1114 ,11 tplal without tree r e a r"
coffee,1900,0,1322,686,6.0284,True,"---- counsd the purchase of the coffee that al ways please, farni i y or guests '''l ..,e.: 51, mal n tonip s _ coffee esi r.,...; .. ....q\l a yltri '.. • • ~ .""- • ence richly fragran, p..."
coffee,1900,0,1322,687,6.0284,True,"• covessei the purchase of the coffee thal always pleases family or cs uesitos symington coffee ego pa 1 ence 7k, 6.4 4 • y r rag ran re & oratina"
coffee,1900,0,1322,690,6.0325,True,"...441 sn"" remember fazenda the offical seal & guarantee of cbe stale of sail paulo (brazil) appear on every tin cf cof-6-,"" 4 114 wa this pure fragrant coffee comes direct"
coffee,1900,0,1322,692,6.0386,True,syminctows edinburgh coffee essences make coffee equal to that prepared direct .fram coffee beans.
coffee,1900,0,1322,695,6.0441,True,"... .l a f._ davit, ftils. n.. fs and la fectval. 4.: cbmat, stwl stoma at la lid and i per bei p.a.vvvv‘savvoikeri..-- • those who cannot tlke orcflnry coffee can drink symington's edinburgh coffee "
coffee,1900,0,1322,697,6.0474,True,"imms if -6- lf -6•- -rc zs o o 6 crtcrrlstz mr) to 1 nothing, steadies the nerves and clears the brain like a strong cup of symington's fs edinburgh coffee ess3nce: in bottles from all grocers. 8 2 p."
coffee,1900,0,1322,698,6.0489,True,"itrxr-cl7c-6-6-isb -c, 6 vic-c-61-6-1 o nothing steadies the nerves and clears the brain like_ a stronca; cup of symingtoit's edinburgh coffee ess3nce. in bottles .from all grocers. 82 zulq-sup-s ""7 t"
coffee,1900,0,1322,699,6.0499,True,"arrival of new coffees. ocr finest new crop coffee at is 101.1 is giving great satisfaction, and we are offering rare value in various growths, ground or in the berry at l..."
coffee,1900,0,1322,700,6.05,True,"eumatic pills. footballs given away weekly to users of ""mason's coffee essence 'for the six best stories or jokes written on postcard received bi • e us each week. address to-day-- :• newball & mason,"
coffee,1900,0,1322,702,6.0545,True,"do you cough? take keating's lozenges tins 134i° ou *'lt cough • cowlsel the purchase of the coffee that always pleases family, or guests synungton coffee 4*enee how to look twenty years younger in a "
coffee,1900,0,1322,704,6.056,True,"eddes dandelion coffee the beet and cheapest ever offered to the pnblio. sold by all grocers and druggists, in canister 54., 104., and is. bd. each. wholesale by j. geddes ..."
coffee,1900,0,1322,705,6.0582,True,"arrival of new coffees. our finest new crop coffee at is 10d is giving great satisfaction, and we are offering rare value in variou., growths, ground or in the berry at is..."
coffee,1900,0,1322,711,6.0657,True,"symington's edinburgh coffee essences make coffee equal to that prepared direct from coffee beans. 11••{1.- ia bdominal belts (ladies' and gents'), all sizes and prices. coltman'..."
coffee,1900,0,1322,713,6.0715,True,"remember fazenda the coffee la ith a government goarantee. ,:-_ ..._ki.,-,t1:.::',1v,;;;:,...3.'.3.3-si-.::: ~. remember if fazenda s•''4* ,"" w..-i,,ria. • tim official seal & g..."
coffee,1900,0,1322,714,6.0727,True,"coffee in perfection. roasted daily, ib..n 'iiie liost approved french prima ples 1/4, 1/6, 1/8, & rare old mocha, 2/-. establishzd 1872. t 296. h. bowling ..."
coffee,1900,0,1322,716,6.0751,True,"um-1 egssaiusastszsizzusus_u_sianiti nothing steadies the nerves and clears the brain lik2, a strong cup of symington's edinburgh coffee ess9nce, in bottles from all grocers. for the blood !s the life"
coffee,1900,0,1322,718,6.078,True,"coffee essence de from the finest coffee grown represents the acme of purity strength, and flavour. ma,"
coffee,1900,0,1322,719,6.0781,True,"fazenda pure coffee from san paulo (brazil) every tin bearing the official seal and guarantee of purity. t, pure coffee stands apart from ,:--r- all other coffees, posse..."
coffee,1900,0,1322,720,6.0787,True,"remember fazenda the coffee la ith a government goarantee. ,:-_ ..._ki.,-,t1:.::',1v,;;;:,...3.'.3.3-si-.::: ~. remember if fazenda s•''4* ,"" w..-i,,ria. • tim official seal & g..."
coffee,1900,0,1322,722,6.0848,True,"icoffee. coffee. coffee we may not be the tarmeat buyers of coffee but we ave,one of the larret buyers of really fine coffee in the country. and we have now ..."
coffee,1900,0,1322,723,6.0868,True,"coffee by post direct from the market at 1/6 per lb. sold roasted only, not ground in 41b. packets for _ _ _ ea. bi, carriage paid green tree coffee s a ble..."
coffee,1900,0,1322,724,6.0877,True,"symington's edinburgh loffee essence is made from the finest coffee grown and represents the acme of purity strength, and flavour. refuse all liviitations. weak, ailing men suffering from dctii- exhau"
coffee,1900,0,1322,726,6.0981,True,"slaithwait e. ardcakes of course you want the best? then try ours i—norman's, high class confection et* kiln hi 1, slaithwaite. pnre coffee in perfection. refreshing and stimulating. fresh roasted and"
coffee,1900,0,1322,727,6.0985,True,savo you tried synincton'ii edinburgh dudgeon coffee essonest it is much oil by persons of weak or folds cretins. from all lim% 73
coffee,1900,0,1322,728,6.0988,True,"coffee essence. the premier brand. sold by all grocers. rows famour complexion pills; aample post r. irving, 1. new heat-road, loudon faith tthelusdaanldes,..."
coffee,1900,0,1322,729,6.1004,True,"...441 sn"" remember fazenda the offical seal & guarantee of cbe stale of sail paulo (brazil) appear on every tin cf cof-6-,"" 4 114 wa this pure fragrant coffee comes direct"
coffee,1900,0,1322,731,6.1066,True,"coffee essence makes delicious coffee in a moment. no trouble, no waste. in small and ilrge bottles. from all grocers. guaranteed pure. 100 the new free the..."
coffee,1900,0,1322,732,6.108,True,ymington s coffee essence no other fssence can make such a delicious y- refreshino beverage clark's world-famed blood mixture is ft most guaranteed cure for all blood ...
coffee,1900,0,1322,733,6.1123,True,"symiincton's coffee essences make coffee equal to that prepared direct from coffee beans. for— indigestion. headache, elliodsness constipati i intaliia.ia to ladies. 1.4..."
coffee,1900,0,1322,735,6.1211,True,"o.4kbblooduure covnel the purchase of the coffee that ,always pleases family, or guests symington coffee c 54 nee marvellous discovery. experts are deceived the pearl necklaces are unbreakable, they..."
coffee,1900,0,1322,736,6.1223,True,ex] those who cannot take ordinary coffee can drink symington's edinburgh coffee essence with--' comfort and pleasure. in bottles from all grocers. 79 dr. de. roos' compound renal pills: re j...
coffee,1900,0,1322,737,6.1244,True,per lb. fresh roasted coffee 1/8 famil: orders solicited and delivered free of charge to any part of the
coffee,1900,0,1322,738,6.125,True,"remember fazenda the official seal & guarantee of the state of san paulo (brazil) appears on every tin of this pure fragrant coffee comes direct from the sunny fazendas or plantations of san paulo, wh"
coffee,1900,0,1322,739,6.1251,True,"""\l. 41, .)? fp. i•a o e s symington's coffee es e f a stimulant! a restorative! a correctives or refuse au. omers. mp --- ‘, c? atat, • %tom%) '"";•;17•01 ,1 ;:,-:::'iliffif- s •4 / ome '.•.`p` ...."
coffee,1900,0,1322,740,6.1261,True,"edinburgh coffee essence makes delicious coffee in a moment. no trouble, no waste. in small and large bottles, from all grocers. guaranteed pure, 10ct thic remiidy. t..."
coffee,1900,0,1322,741,6.1286,True,"...rroms-6151515-0111cciftitfrifm11 )<, nothing steadies the nerves 0 and clears the brain li z ook a 9, o 0 strong cup of symiiicton's k, '°. edinburgh coffee ess3nce, in 0 bottles from all grocer"
coffee,1900,0,1322,742,6.1314,True,"take keating's lozenges tins 13° • won't cou6h. counlsel • the purchase of the coffee that always pleases • fami i y or guests tv syrnington coffee es4ence il ,t richly frasran • -. pare & ""- 1 riviao"
coffee,1900,0,1322,743,6.1319,True,"9a (21 buck 1 x ""4/cer3 to rdyarqilellf.r i°c, lead i artor cia 1/se onzr 1:11,1271 som by oil chemists 6 rand medicine vendors syminctont coffee essence • pre ceer. pmmaw —gomm pam • oft, a stimulant"
coffee,1900,0,1322,744,6.1326,True,"coffee essence. the preirler brand. ss id by all grocers. rrallift; %mmus comple'cian pills, sample poet free. & irwin& 116., new ai...lt-road, landau. supe..."
coffee,1900,0,1322,750,6.1415,True,"and cocoa were awarded the grand prize (this is the highest honour obtainable). lovers of perfect coffee and cocoa will find lipton unequalled for excellence of quality an delicacy of flavor. lipton, "
coffee,1900,0,1322,752,6.1439,True,"syminctors ec:nburgh coff7---f ,n 1 esstri\ces make coffee equal to that prepared direct from coif:.%,d"
coffee,1900,0,1322,753,6.1455,True,"counsel the purchase of the coffee that always please' famill, or g ues;s (symington coffee"
coffee,1900,0,1322,754,6.1484,True,symington's coffee kessence a a 11711aulant i limitoaativi i a 001111•111taini vp i wifiaii ma. a
coffee,1900,0,1322,755,6.1506,True,"slaithwaite titbit i tee, 2,; fresh roasted coffee 14—city tea co., coffee roasters, slaithwaite. mtr.r. pasty.—the annual knife aul fork tea and social in connection with the employes of mr. joseph b"
coffee,1900,0,1322,756,6.1511,True,"eumatic pills. footballs given away weekly to users of ""mason's coffee essence 'for the six best stories or jokes written on postcard received bi • e us each week. address to-day-- :• newball & mason,"
coffee,1900,0,1322,757,6.1514,True,"gfootballs given away weekly to users of ""mason's coffee essence for the six best stories or jokes written on postcard received by us each week. address to-day-- newball & mason, nottingham. good! it'"
coffee,1900,0,1322,760,6.1543,True,"...ad office: 215, strand, london. branch office: caledonian buildings, pilgrim-street, newcastle-on-tyne. there is as much difference in the quality of coffee, a"
coffee,1900,0,1322,761,6.1554,True,"fazenda pure coffee from san paulo (brazil) every tin bearing the official seal and guarantee of purity. t, pure coffee stands apart from ,:--r- all other coffees, posse..."
coffee,1900,0,1322,762,6.1557,True,"arrival of new coffees. our finest new crop coffee at is 10d is giving great satisfaction, and we are offering rare value in variou., growths, ground or in the berry at is..."
coffee,1900,0,1322,763,6.1569,True,"sold everywhere, at wit 2'9, 4,8, and iv oe lung tonic wo., 1:747 for coughs, colds. bronchitis, asthma, x counsel the purchase of the coffee that. always pleases farnil or guests ynungton coffee e.s*"
coffee,1900,0,1322,764,6.1571,True,"ymincton's— ta coffee essence °andolion coif.. n.& chicory. ...„ 1 ..... ""::: •i 11:' ~.... ~. 1., ;1;'411' • :, t 4•..: ~...:,_ ri‘lsl. 4 ~ ~,,,i,... to• t '''' '''' •,1:..."
coffee,1900,0,1322,768,6.1612,True,"...441 sn"" remember fazenda the offical seal & guarantee of cbe stale of sail paulo (brazil) appear on every tin cf cof-6-,"" 4 114 wa this pure fragrant coffee comes direct"
coffee,1900,0,1322,769,6.1663,True,hargraves tobaccos. hargraves' cigars hargraves' cigarettes. manufactory swan-9111hw% manchrstbr. _ v no. eddess dandelion coffee the best and cheapest ever offert i to the publll. sold by all grocers
coffee,1900,0,1322,771,6.1673,True,"...441 sn"" remember fazenda the offical seal & guarantee of cbe stale of sail paulo (brazil) appear on every tin cf cof-6-,"" 4 114 wa this pure fragrant coffee comes direct"
coffee,1900,0,1322,776,6.1801,True,"a notable free gift lbfl. a lp valery's renowned whole-berry coffee roasted on the continental system which has made the cafes of paris and vienna so famous, sent car- r.age paid on receipt of 4/- tog"
coffee,1900,0,1322,777,6.1822,True,"eir...r?' cvittz.. 111 w w hen sr• 1.4‘ ai 1 •iir uuyinli '',l'..a coffee essence 1 .. sir say ti a `'.• • ,••• • • l :i.r. * • ;',,, ''''';'. 441 *"" "". pleasl. ..-' it,, and beware of inferior it ess"
coffee,1900,0,1322,778,6.1864,True,7u • _.......--• those who cannot take ordinary coffee can drink symington's edinburgh coffee essence with comfort and pleasure. in bottles from all grocers. dr. de. roos' compound renal pills: ia an°
coffee,1900,0,1322,780,6.188,True,"arrival of new coffees. ocr finest new crop coffee at is 101.1 is giving great satisfaction, and we are offering rare value in various growths, ground or in the berry at l..."
coffee,1900,0,1322,783,6.1987,True,"...tands out alone and unrivalled. the perfection of quality and value. and fragrant teas at 1/2 and 1/4 highest honours paris exhibition, 1900. liptons coffee & cocoa were awarded the grand prize"
coffee,1900,0,1322,785,6.205,True,"remember fazenda the coffee la ith a government goarantee. ,:-_ ..._ki.,-,t1:.::',1v,;;;:,...3.'.3.3-si-.::: ~. remember if fazenda s•''4* ,"" w..-i,,ria. • tim official seal & g..."
coffee,1900,0,1322,787,6.2171,True,symincton's edi n burgh coffee essences make coffee equal to that prepared direct from coffee beans.
coffee,1900,0,1322,788,6.2198,True,"""kw...a, c 1. i i covetsd the purchase of the coffee that .al ways pleases .frnly or guests msttx ton coffee"
coffee,1900,0,1322,789,6.2209,True,"symington's edinburgh coffee essences make coffee equal to that prepared direct from coffee beans. for indig esti on, eea dache, eiliotjsness, co nstipati invaluable to ladies. 8..."
coffee,1900,0,1322,790,6.2233,True,"'==',rl:,=my=9 bov4, mslr- "",51- tat',an key r swoetest ernaa,:#47 gte cakes& pastry. bi k•4o 'tho peet esam,h,"" ia tv,3 anlitirimp''res coffee essence 9 z pun. c.•••• osm/s.nan c.fee cl.ndev, a stimu"
coffee,1900,0,1322,791,6.2236,True,"liptons c lovers of perfect coffee and cocoa will find liptons unequalled for 7_,xx=i,w4c,w, ltd., tea, coffee, and cocoa planters, 3mlrjr_acbmw. chief offices: city road, london. loca..."
coffee,1900,0,1322,792,6.2286,True,"'camp' coffee has no equal. for purity, strength and fragrance, it's r4ght at the top. itais,ser • sr ""emer mho • 1 es seem paimmes ai. i 811•11 t.r 00f11. • imo l..."
coffee,1900,0,1322,794,6.2315,True,niiminm=mm•i=•iiii.oommiimm.ves for earls' nee. labour. ula moiny. sy m incto n's edinburgh coffee essences make calf.. equal to that prepared dlract r• drew cott. ill:nees. cycleft. cycles. if rec.' 
coffee,1900,0,1322,795,6.2339,True,"e din burgh coffee essence corns removed. -that limping stopped, not for • month. frift fur ever, if you use evergreen corn 91y, poet free, 7id. no cum your money retur..."
coffee,1900,0,1322,799,6.2383,True,symington's edi n burgh coffee essences make coffee equal to that prepared direct from coffee beans.
coffee,1900,0,1322,800,6.2418,True,pure coffee the official seal & guarantee of cbe state of san paulo (brazil) appears on every tin of this pure fragrant coffee comes direct from the sunny fazend...
coffee,1900,0,1322,801,6.2439,True,"symington's edi n burgh coffee essences make coffee equal to that prepared direct from coffee beans. for-- indigestion, kea dach e, eiliot)sness, con stii'ati( )n. invaluable to la..."
coffee,1900,0,1322,802,6.2492,True,"footballs given away weekly to users of ""mason's coffee essence"" for the six best stories or jokes written on postcard received hb us each week. address to-day— newball & mason, nottingham. good! it's"
coffee,1900,0,1322,803,6.2551,True,"eddes dandelion coffee the beet and cheapest ever offered to the pubiii. sold by all grocers and druggists, in oanistes 5d., 10d., and is. bd. each. wholcsa:e by j. geddes ..."
coffee,1900,0,1322,804,6.2552,True,"remember fazenda the coffee la ith a government goarantee. ,:-_ ..._ki.,-,t1:.::',1v,;;;:,...3.'.3.3-si-.::: ~. remember if fazenda s•''4* ,"" w..-i,,ria. • tim official seal & g..."
coffee,1900,0,1322,805,6.2585,True,symington's ed! n burgh coffee essences make coffee equal to that prepared direct from coffee beans:
coffee,1900,0,1322,806,6.266,True,"1 u 1 .„,.....,zi 4,5 nothing steadies the nerves and clears the brain lik2, strong cup of symington's edinburgh coffee essdnce. in bottles from all grocers. __ the new french remedy. therapion this s"
coffee,1900,0,1322,807,6.2681,True,7u • _.......--• those who cannot take ordinary coffee can drink symington's edinburgh coffee essence with comfort and pleasure. in bottles from all grocers. dr. de. roos' compound renal pills: ia an°
coffee,1900,0,1322,808,6.2705,True,"remember fazenda the official seal & guarantee of the state of san paulo (brazil) appears on every tin of this pure fragrant coffee comes direct from the sunny fazendas or plantations of san paulo, wh"
coffee,1900,0,1322,809,6.2719,True,"counsel the purchase of the coffee that always pleases famil)fr or guests symungton c ffee ob g.ence t.f0,... ...4.-k i _.... .., -.'..'nrl .-!`. ~.' • :'.l4r; .---. :-."",.. .3.• '-- i..."
coffee,1900,0,1322,810,6.2727,True,"1101110.4 e ^;-.2.r. _ e din bu rgii coffee essence advice to hair combings made up into tails, coils, etc. lo!. is 6d, 2oz. 2s 6d, 3oz. 3s. send thent to oolerldge, ladies hairdresser. stockto..."
coffee,1900,0,1322,812,6.2731,True,pure coffee the official seal & guarantee of cbe state of san paulo (brazil) appears on every tin of this pure fragrant coffee comes direct from the sunny fazend...
coffee,1900,0,1322,815,6.279,True,"...441 sn"" remember fazenda the offical seal & guarantee of cbe stale of sail paulo (brazil) appear on every tin cf cof-6-,"" 4 114 wa this pure fragrant coffee comes direct"
coffee,1900,0,1322,816,6.2802,True,"symington's coffee the purest, the (heapest es s and the best ‘: • 1 a ""ndlitigußgaitt makes coffee of dclic:ous flavour and strength. 1-10 s sym ington &co edinburgh&l..."
coffee,1900,0,1322,818,6.2809,True,"nothing steadies the nerves ot and clears the brain lik2„ strong cup of symington's edinburgh coffee ese.,mce in bottles from all grocers. 82 lejlsuusui2i/32.9.9.1 the new french remedy. the') this su"
coffee,1900,0,1322,819,6.2819,True,"n • syiviing- to tvinburgh i s coffee makes delicious coffee in a moment. no trouole, no waste. in small and large bottles, from all grocers. • eiskeintwees—iiuttio' watch & chain for one..."
coffee,1900,0,1322,821,6.2877,True,"...ticle post 7 stones, any wear. if not satisfied money returned. louis & richards. chancery lane safe deposit, london. • couiiisei the purchase of ihe'coffee tha-t always plea"
coffee,1900,0,1322,822,6.2879,True,"slaitiiwaite tait. 2/-; fresh roasted coffee 1, 8.-4. ity tea co., coffee roasters, slaithwaite. p.s.a.—under the auspiecs of the oung aleu's class in connection with the zion baptist sunday sch..."
coffee,1900,0,1322,823,6.2888,True,"edinburgh coffee essence. sprang novelties.—new washing dress materials, 4/d yard, carriage paid. bargain blouse lengths. is each. patterns free. biblett's wabehome. ..."
coffee,1900,0,1322,824,6.2913,True,"...441 sn"" remember fazenda the offical seal & guarantee of cbe stale of sail paulo (brazil) appear on every tin cf cof-6-,"" 4 114 wa this pure fragrant coffee comes direct"
