word,decade,cluster,cluster_size,rank_in_cluster,distance_to_centroid,target_word_visible,snippet
coffee,1890,4,980,949,7.293,True,"lipton lipton tea and coffee planter, ceylon. là ipton, the largest tea, coffee, and provision dealer in the world. • bole proprietor of the following celebrated tea and coffee e..."
coffee,1890,4,980,951,7.3081,True,"lipton's delicious oriental blends. finest coffee and chicory, no, is, liu, is 2o per lb, pure coffee!! richest and best. lo so pzr lb. no rion= pill 11. lipton, tea and coffee planter, ceylon. tea a..."
coffee,1890,4,980,952,7.3121,True,"high-olass chocolatic & confectionery at about half the prim ohara= by the trade. lipton, tpa. coffee and cocoa planter, ceylon. tea illzacnuarr it ekrzotu. artourrxrne to liza /warty till ql:flung. r"
coffee,1890,4,980,953,7.3176,True,"lipton, tea and coffee planter, ceylon. the largest tea, coffee, and provision dealer is tits world. moie prillit 101. nf the followitc.: celebrated teei and coffee agates ..."
coffee,1890,4,980,954,7.3178,True,"lipton lipton lipton lipton lipton lipton tea and coffee planter, ceylon. lipton, the largest tea, coffee, and provision dealer in the world. sole proprietor of the following celebrated tea and coffee"
coffee,1890,4,980,956,7.3293,True,"lipton lipton tea and coffee planter, ceylon. lipton, the largest tea, coffee, and provision dealer in the world. t3.-2e proprietor of the following celebrated tea and coffee est..."
coffee,1890,4,980,957,7.3297,True,"no higher price. lipton, tea and coffee planter, ceylon. the largest tea, coffee, and provision dealer in tuz world. hole proprietor of the following celebrated tea and coffee &wes in ceylo..."
coffee,1890,4,980,959,7.337,True,"'r _tehae rd andtea, c) coffee 3 planter,(ffei andceylo lip t 0 n9provision dealer in the world. 3, sole proprietor of the following celebrated tea and coffee estates in ceylon: da..."
coffee,1890,4,980,961,7.3511,True,"lipton lipton tea and coffee planter, ceylon. lipton, the largest tea, coffee, and provision dealer in the world. bole pmprietor of the following celebrated tea and coffee estate..."
coffee,1890,4,980,962,7.3545,True,"lipton lipton lipton lipton lipton lipton lipton lipton tea and coffee planter. ceylon. the largest tea, coffee, and provision deal. 'n the world. sole proprietor cf the following celebrated tea and c"
coffee,1890,4,980,965,7.4076,True,"special notice! downes' universal teas are reduced 2d. per lb. owing to the redaction in tea duty. 1/2,1/4, 1/8, 1/10, 2/. per lb. a trial bolioited. coffee—fresh roasted and ground daily on the premi"
coffee,1890,4,980,967,7.4308,True,"no higher price. lipto, tea and coffee planter, ceylon. the largest tea, coffee, and provision dealer in the world. sole proprietor a the following celebrated tea and coffee rstates in cey..."
coffee,1890,4,980,968,7.4822,True,"...crisp. the and assortment. loose and in tins, all sizes. lipton the largest provision dealer in the world. fancy cake and biscuit manufacturer. itea, coffee and cocoa planter, ceylon. fruit g"
coffee,1890,4,980,969,7.546,True,"tea and coffee planter, ceylon. the largest tea, coffee, and provision dealer in thi world. sole proprietor of the following celebrated tea and coffee estates in ce..."
coffee,1890,4,980,971,7.5686,True,"lipton, tea and coffee planter, ceylon. the lar3est tea, coffee, and provision dealer in vie world. tea and coffee shipp ng waroh.alse3: maddema mills, cinnamon gardens, co..."
coffee,1890,4,980,973,7.6931,True,"dealer in the wohid. tea and coffee shipp ng warehouses: maddema mills, cinnamon garden% colombo. ceyl, n °mee: upper chatham-street, colombo. indian mee and shipping warehouses 5, lyon..."
coffee,1890,4,980,974,7.7185,True,"special notice! downes' universal teas are reduced 2d. per lb. owing to the redaction in tea duty. 1/2,1/4, 1/8, 1/10, 2/- per lb. a trial soliciird. coffee—fresh roasted and ground daily on the premi"
coffee,1890,4,980,976,7.8184,True,"no higher price. lipton, ,lea andao coffee a planter.coff ee, and provision dealer in the world. bole proprietor of the following celebrated tea and coffee estates in ceylon dambatenne, laymas..."
coffee,1890,4,980,979,8.2119,True,"...dakin & corapy.,-i st. paci:3 ciitraciitard. london. z.c.. _• mullell iptimit hoven. 7.7. c.: enavresbvily avionow piccadill2 circus, w.. %. tea [ind coffee .; xl-au"
coffee,1890,5,699,9,4.5632,True,"1 /.,kleetro plated tea and coffee service, new / dealgn.-16, illatket-street."
coffee,1890,5,699,10,4.5743,True,"coleshill athletic festival. monday. one hundred yards' handicap.-ist prize, handsome electro tea and coffee service, value £5; 2nd, marble timepiece, £2; 3rd, electro double jam server, £l. 42 entrie"
coffee,1890,5,699,20,4.6895,True,"harpurhey and blackley. pnesentartox.—the weavers at the union mill presented henry greenwood with a grand silver tea and coffee service and a set of hand.painted jugs on friday, the 27th, on leaving "
coffee,1890,5,699,24,4.7229,True,"electro silver plated breakfast _ _ _ jrubts (as drawn). 1/11, to 15/6. ditto dini-ce; cruets, 2/11 to £3. electro silver teapots from 3/11,. tea and coffee services from 9/9 the set of 4 pieces. ladi"
coffee,1890,5,699,26,4.7273,True,"...orkpeople employed at victoria mill, eitubbins-lane, raw. bottom, have presented their manager, mr. henry tattersall, with a beautiful silver tea and coffee"
coffee,1890,5,699,32,4.7813,True,"...ronzes in great variety. choice designs—dr-mil-lie-in all the principal and best known paris factories, at remark- ably low prices. tea urns, tea and coffee sets, centre- piec"
coffee,1890,5,699,33,4.7814,True,"...d bronzes in great variety. choice designs drawn from all the principal and best known paris factories, at remark- ably low prices. tea urns, tea and coffee sets, centre- pieces,"
coffee,1890,5,699,37,4.7912,True,"69 & 71, church street, warrington. silver english lever, watch, by harris and son, just forfeited. 755. electro-platbd tea and coffee ser- vices, beet quality, quite new 60s. od. 955. ed."
coffee,1890,5,699,39,4.8042,True,"electro-plated tea and coffee ser- vices, be quality, quite new"
coffee,1890,5,699,41,4.8227,True,"one and a half mile bicycle handicap. find prim, tea and coffee set, with tray, value £lo 10s. ad. second prim, oak writing cam, £5 sa. ad. third prim, three-bottle spirit frame, value £.3 3s. od.—the"
coffee,1890,5,699,56,4.9051,True,"final heat. j. benson 1 b. wildman 2 j. h. mawsou 3 time, 3m. 3secs. 440 yards' flat race handicap.—first prize, silver-plated tea and coffee service second, calved oak aneroid barometer; third, inkst"
coffee,1890,5,699,60,4.9168,True,"has lingden. presentation.—mrs. wowley, of the duckworth clough mill, has been preselted by her workpeople with a tea and coffee service and an oak tray with silver mounts, as a token of their esteem "
coffee,1890,5,699,61,4.923,True,"op to date, published at 6s. £l.ooo worth of elaretßo-plated goods of the newest designs in tea and coffee services,'crnete, fish eaters, dessert knives, jam spoons, butlers' knives, etc are. doidge's"
coffee,1890,5,699,78,4.9866,True,"up to date, published at 6e. £l.ooo worth of electro-plated goods of the newest designs in tea and coffee services, cruets fish ,eaters, dessert knives, jam speohs, bataan knives, &c, ecc. doidge's fi"
coffee,1890,5,699,99,5.0372,True,"...lkr: j. whittam _ 1 j. p. milner 2 w. j. winder time, lltsetss. one mile bicycle race handicap (open). first ptize, silver-plated tea urn and tea and coffee service; second, cigar cabinet; thi"
coffee,1890,5,699,105,5.0661,True,"fancy crlnese and japaniu good tea and coffee sets, ornaments, albrms, 'writing cases, of.ni{s, station ery, and booklets, brushes, combs, baskets. wicker' chairs and tabus sponges, wash leathess..."
coffee,1890,5,699,115,5.1037,True,"4 extra special. late advertisements. l 1 1)..-ien solid srerl mit it) iv eli, 1 l..ll tea and coffee service, for sale. each artie'e hall.dnarked. coffee pot can be used as liot water jog, accept .21"
coffee,1890,5,699,116,5.1038,True,"warrington. silver english lever watch, by harris and son, just forfeited electro-plated tea and coffee ser- vices, beat quality, quite new silver english ()entre seconds stop watch, with all the late"
coffee,1890,5,699,120,5.1116,True,"...place, 14, silversmith, ripon. a large and choice selection of watches, clocks, and jewellery on' every description]. electro plate, cutlery, tea and coffee "
coffee,1890,5,699,121,5.1118,True,"your old spoons, forks, cruets, tea and coffee sete replated with pore siker, and • written guarantre of wear for ten years, i. dr•tel.• fewalay. j. & f. brown, electro, silver, nickel, 14 gold pl..."
coffee,1890,5,699,123,5.1126,True,...the committee appointed at the recent town's meeting to prepare a suitable wel- come to j. t. brown upon his return was held on monday evening at the coffee house. mr. harri
coffee,1890,5,699,124,5.1203,True,"...stores. a. ann ual clearance salm le now golno on from us february to february istli iiiutplus otocil of fancy ciilxfse and japanese i goods, tea and coffee sets, ornaments, albums, wri"
coffee,1890,5,699,138,5.1496,True,"warrington. silver english lever watch, by harris and son, jnst forfeited. blectro-plated tea. and coffee ser- vices, best quatity, quite new"
coffee,1890,5,699,141,5.1559,True,"list of the presents. mrs parry. piano clock and linen mrs w h perry, queen anne tea and coffee service mr and ms. owens, glassware and crockery captain and ars owens. fish slice and for mr and mrs a "
coffee,1890,5,699,144,5.1602,True,"200 yards (open) handicap flat race. first prize, silver-plated tea at.d coffee service, value £5: second, gent's silver keyless watch, value £2 third, gent's dres,icg case, value el. 27 entries. fir,"
coffee,1890,5,699,150,5.1775,True,"• itooimapi. a••••••••••-- artlasor. your old spoons, forks, cruets, tea and coffee seta replete,' with du. eikerand • written guarantee of wear for ten years. tu firstnlaw 'petite. j. & f. brown, eli"
coffee,1890,5,699,156,5.212,True,"win wi shall (wier at very much reduced price our murplus stock up fancy chins& japanebe goode!. tea and coffee sets. orsamen7s. album. writing cases. deyks, stationery, and di)oklei9, brushes. combs."
coffee,1890,5,699,160,5.2197,True,"warrington. silver english lever watch, by harris and son, just forfeited 755. f!lcl. electroplated tea and coffee sr- vices, best quality, quite new 6113.0 d. silver english centre seconds stop _ wat"
coffee,1890,5,699,162,5.2249,True,"james taylor, watchm k ripon. e je well eli a larue and choice selection of watches, clocks. and jewellery electro-plate, cuttlery. tea and coffee services, spoons, forks, tachauement. wedding, an sir"
coffee,1890,5,699,167,5.2343,True,"ifdactro-silvar sa. afternoon tea seta 12s. 6d. tea sod coffee service, 30e. hewertson's teaspoons, ht. si per fah doses. solid silver, 2s. 61, each. hewertsons dessert forks 3.6 d. hall doe. dessert "
coffee,1890,5,699,172,5.2516,True,"fancy chinese and japanhia goods, tea and coffee sets, ornamenti.4, albums, writing cases, drsks, station. eby, and bookietb, brushes, combs, baskets. wicker chairs and tabler. spong&s, wash leather..."
coffee,1890,5,699,181,5.2785,True,"warrington. silver english lever watch, by harris and son, just forfeited ilectro-plated tea and coffee ser- vices, best quality, quite new ilver english ()entre seconds stop watch, with all the lates"
coffee,1890,5,699,188,5.3007,True,"...minor. a meeting was held at the rectory house on monday loot, for the purpose of presenting mrs morgan, of bryncmh, with a beautiful set -of tea and coffee service, on the occasion of her "
coffee,1890,5,699,193,5.3108,True,"james taylor, a large and choice selection of watches, clocks. an i) jew el ler y, electro-plate, cutlery, tea and coffee services. spoons, forks, ace. engagement, w. dding, and birthday presents in g"
coffee,1890,5,699,194,5.3114,True,"0- mr and mrs westmorland—silver tea and coffee service mr and mrs parker—very handsome dinner &n ice, afternoon tea cloth, and silver tea service miss j. a. parker-011 painting miss robinson (hans..."
coffee,1890,5,699,199,5.3176,True,"fancy chinfse and japanesh goods. tea and' coffee sets, 1/324ambnts, albums, writing cases, desks, station- ery, and booklets, brushes, combs, baskets, wicker chairs and tabus. sponges, wash leathers..."
coffee,1890,5,699,209,5.3327,True,"jewellery, tea and coffee services, pickle, egg, liqueur, breakfast and table cruets; marmalade and butter cake and card saskeis, waiters, goblets and ‘,ups, toast decanters, ..."
coffee,1890,5,699,211,5.3376,True,"...ians, the most desireble house in town for every description of silver &electro-plated specialities they are now showing a superb assortment of tea & coffee services, tea pots, coffee"
coffee,1890,5,699,221,5.3691,True,"wedding & birthday presents the silver and electro-plate is of a very superior description, includes— ci ake baskets, salvers, tea and coffee kj services, kettles, teapots, egg frames, toast racks, je"
coffee,1890,5,699,226,5.3842,True,"electro-plated tea. and coffee ser- vices, best quality, quite new 6os. od. silver english ()entre seconds stop watch, with all the latest improvements 955. od. 9 carat gold albert..."
coffee,1890,5,699,230,5.3876,True,"laleston. esmi-wrioze.—recently mrs thomas, of the haregrove farm, near laleston, was presented with a beautiful tea and coffee service on the occasion of her marriage with mr jenkin henry, of newton."
coffee,1890,5,699,239,5.4064,True,"golden bee hive, 69 & 71, church street, warrington. silver english lever watch, by harris and son just forfeited electro-plated tea and coffee ser- vices, best quality, quite new silver english ()ent"
coffee,1890,5,699,240,5.4068,True,"warrington. silver english lever watch, by harris and son, just forfeited :lectro-plated tea and coffee s vices, best quality, quite new 755.6& 60s. oct. • /.44-f„ g aise ‘7,c•p""- • arr • • golden bee"
coffee,1890,5,699,244,5.4186,True,"758. 6d. electro-plated tea and coffee se.r vices, best quality, quite new silver english centre seconds stop- watch, with all the latest improvements 9 carat gold albert, curb, with seal,..."
coffee,1890,5,699,245,5.4253,True,special reduction of 5 to 25 per cent. 101 carr. 25 yet cod. zkotro-platel tea & coffee i'otii 25 „ do. spoons sod yorks 10 „ love mowers l5 cutlery 10 „ oas itoviii builders —sow. spodall bargains la
coffee,1890,5,699,254,5.4471,True,"...ians, the most desirable bonds in town for every description of silver &electro-plated specialities they are now showing a superb assortment of tea & coffee services, tea pots, coffee"
coffee,1890,5,699,264,5.4679,True,"james ta clor, watchmaker & jewei,leb, r i pon. a large and iiioice selection of watches. clooks. and jewellery, elegi ro.plate, cutlery, tea and coffee services. spoons, forks, to. engagemen wi i.)di"
coffee,1890,5,699,265,5.472,True,"warrington. silver english lever watch, by harris and son, just forfeited electroplated tea. and coffee ser- vices, best quality, quite new ....... 755. ecl. 60s. od. silver english centre seconds sto"
coffee,1890,5,699,267,5.4746,True,"_ th? report -- tea & coffee servi egg frames, emree dishes, fish carvers, dish covers, candlebra, cups & tankards, fish forxs, spoons & knives electro-plated silver, & gilt."
coffee,1890,5,699,268,5.4771,True,"two the 1 repty that hopedise respects- sad liquor frames, s toast racks, tea & coffee services. egg frames, oak., entree dishes, fish carvers, dish covers, candlebra, cups it tankards, fish fowls, sp"
coffee,1890,5,699,281,5.524,True,"brooches, from is 6d: break- fast cruets, from 4s 6d splendid dinner cruets, from is 6d electro-plated tea- pots, from 8s 6d. tea and coffee services, cake baskets, fruit baskets, biscuit boxes, jelly"
coffee,1890,5,699,283,5.5374,True,"brooches, from is 6d; break- i fast cruets, from 4s 6d splendid dinner cruets, from 14s 6d electro-plated tea- pots, from ss 6d. tea and coffee services, cake baskets, fruit baskets, biscuit boxes, je"
coffee,1890,5,699,287,5.5483,True,...metery inn bowling club. on monday last a main of bowls was played o the green of the cemetery inn club the chief prize being a silver plated tea and coffee service which was kindly prese
coffee,1890,5,699,291,5.5542,True,"james ta watchmaker & jeweller ripon. a large and (7hotoe set ection of watches, clocks, an i) jew ellery, electro-plate, cutlery, tea and coffee services, spoons, forks, glaa. engagement, tv! dding, "
coffee,1890,5,699,292,5.5574,True,"wedding & birthday presents the sll, ver and electro-plate is of a very superior description, includes— iake baskets, salvers, tea and coffee j services, kettles, teapots, egg frames, toast racks, jel"
coffee,1890,5,699,293,5.5575,True,"james taylo maker, & jeweller ripon. a large and )owe retection of watch: w atches, clocks, ani) jewellerys eleu 14,i. plate, cutlery, tea and coffee services, spoons, forks. ha. enuauemen w ddino, an"
coffee,1890,5,699,299,5.5852,True,"...bond & co., ltd. the lancashire tea warehouses 17. piccadilly, 29. mark street }manchester marriage of dr. braide. a presentation of a silver tea and coffee service, which had been subscribed "
coffee,1890,5,699,305,5.6018,True,"electro-plated tea. and coffee ser- vices, best quality, quite new silver english f3entre seconds stop watch, with all the latest improvements g carat gold albert, curb, with seal,..."
coffee,1890,5,699,308,5.6172,True,"...l,. 1881 -ames taylor, watchma.kreiiptot je weller a large and choice selection of watches, clocks. als11) jewellery electro-plate, cuttlery, tea awl coffee ser"
coffee,1890,5,699,309,5.6188,True,"...vited. james taylor, watchmaker & jeweller, ripon. a large and giloice selection of watches, clocks, ani) jewellery elec.& ro-plate, cutlery. tea sod coffee services. spoons, forks, 110. "
coffee,1890,5,699,311,5.6289,True,"marriage of dr. braide. a presentation of a silver tea and coffee service, which had been subscribed for by the members and officials of the warrington board of guardians, was reade to dr. braide, at "
coffee,1890,5,699,313,5.6397,True,"...861. james 'f/8,y1,011t watchmaker & jeweller ripon. a larue and choice selection of watches, clocks. and jewellery, electro-plate. cuttlery, tea and coffee services, spoons, forks, an. engage"
coffee,1890,5,699,314,5.6429,True,"warrington. silver english lever watch, by harris and son, just forfeite4 7isz electro-plated tea and coffee s vices, best quality, quite new _ _ silver english i)entre seconds stop watch, with all th"
coffee,1890,5,699,315,5.6461,True,"3rooke, bond & co., ltd. the lancashire tea. warehouses 17,29 k piccadilly, 29. manchester marriage of dr. braide. a presentation of a silver tea and coffee service, which had been subscribed for by t"
coffee,1890,5,699,322,5.6705,True,"...tuesday night,- 'sergeant-major hamilton. of the st. helens troop of the lancashire hussars yeomanry calvalry, was presented with a beautiful tea and coffee service, from the officers"
coffee,1890,5,699,328,5.6977,True,brynmenin. a wedding gift—on christmas evening mr robert l collier and his wife were the recipients of a valuable tea and coffee service as an acknow- ledgement of past services to the church and sund
coffee,1890,5,699,330,5.7032,True,"wedding & birthday presents the silveiz and electro-plate is of a very superior description, includes— 1 ake baskets, salvers, tea and coffee v) services, kettles, teapots, egg frames, toast racks, je"
coffee,1890,5,699,331,5.7279,True,"james taylor, watchmaker & jeweller it pon. a large and orokie selection op watches, clocks. and jewellery elegtro-plate, cutlery, tea soul coffee services. spoons, forks, ike. engagement, ivp ddino, "
coffee,1890,5,699,333,5.7307,True,"...failed, leaving watson first. watson afterwards made several good attempts at lift. 9in., but failed. sack race..—first prize, electro-plated tea and coffee service • second, e"
coffee,1890,5,699,334,5.7343,True,...metery inn bowling club. on monday last a main of bowls was played o the green of the cemetery inn club the chief prize being a silver plated tea and coffee service which was kindly prese
coffee,1890,5,699,343,5.7716,True,"the ertablisl watch. :mak. er & jeweller, ripon. a large and choice selection of watches._ clocks. an) jewellery, electro-plate, cutlery, tea and coffee services, spoons, forks, ko. engagement, weddin"
coffee,1890,5,699,348,5.7942,True,"...rsmith, 14, market place, ripon. a large and choice selection of watches, clocks, and jewellery of every description. electro plate, cutlery, tea and coffee "
coffee,1890,5,699,353,5.832,True,"electro-plated tea. and coffee see- vices, best quality, quite new silver english centre seconds stop watch. with all the latest improvements carat gold albert, curb, with seal, ha..."
coffee,1890,5,699,355,5.8385,True,"iii --, warrington. silver english lever watch, by harris and son jxast forfeited 7544 d. electro-plated tea. and coffee sdi- vices, best quality, quite new 608. od. silver english i)entre seconds sto"
coffee,1890,5,699,356,5.8454,True,"...e list of wedding presents. wedding presents numbered in all 225, and of them were of great iutrimie value. one of tad notable was a handsome tea and coffee err. a silver, supplied by elkington, of "
coffee,1890,5,699,358,5.8532,True,"warrington. silver english lever watch, by harris and son, just forfeited electro-plated tea. and coffee srlt- vices, best quality, quite new 6s. rd. silver english ()entre seconds stop watch. with al"
coffee,1890,5,699,370,5.9439,True,"...taining 18 paint st.erling silver hall marked handles; handaome coign coat £:25 iicciept 1. —auslajiamk, church street. (20lid stealing silver ma and coffee service, "
coffee,1890,5,699,377,6.0116,True,"... on thadei. on saturday night, in the raglan hotel, lir john bateman, foreman at the central marine engine works, was presented with a silver tea and coffee serv"
coffee,1890,5,699,379,6.0383,True,".... iburation. ablett and foyl, restaurateurs and caterers. 18, market-street. fob the beo.i. 6n. dinners. 1, shore road, morpeth dock. dituog. tea and coffee nooms. titrictly modem% pric"
coffee,1890,5,699,388,6.0871,True,"books, pamphlets, reports, overseers' lists, posters, handbills, tea and coffee papers, biscuit bags, business cards, memorial cards, &c., executed."
coffee,1890,5,699,389,6.0876,True,"• .. ablett and foyl, restaurateurs and caterers. 1l marsimstrbbt. 101 tall bisx as. dinniusel a, shore road. morpbtr door_ muss, tea and coffee boma miiotli *edemas rime. baerry-1/18, orange road. is"
coffee,1890,5,699,397,6.1085,True,"the queen's hotel (late nag's head), warrington. restaurant, luncheons, tea and coffee rooms, billiards. chops and steaks at any hour. drinks unsurpassed. schweprs, bass', guinnes', and t. jameson's. "
coffee,1890,5,699,401,6.1355,True,"home helps. to make use of empty cocoa and coffee tins. take any empty coffee tins and cover the out- side with glue. put some rice, tapioca, cork- -11;4, or anything suitable in a newspaper, and dis..."
coffee,1890,5,699,403,6.153,True,"household hints. especially in pies, irn: kept irea from me, ----- a tin kettle or coffee pot is easily cleaned i).being robbed with a woollen rag soaked in 'argil!: prossaanto• el salt added cloggede"
coffee,1890,5,699,404,6.154,True,"14: anteb—publit 419ffittat5. tontrar w. book for married women. the queen's hotel. (late nag's head), warrington. restaurant, luncheons, • tea and coffee rooms, billiards. chops and steaks at any hou"
coffee,1890,5,699,406,6.1757,True,"restaurant, luncheons, tea and coffee rooms, billiards. chops and steaks at any hour.. drinks unsurpassed. schwepp's, bass', guinnes', and t. jameson's. bedrooms, baths, and‘ stabling. cy..."
coffee,1890,5,699,407,6.1791,True,"i the queen's hotel. (late nag's head), w arrington. restaurant, luncheons, tea and coffee rooms, billiards. chops and steaks at any hour. drinks unsurpassed. schweit's, bass', guinnes', ,and t. james"
coffee,1890,5,699,408,6.187,True,"see windows for cheap dresses. the queen's hotel. (late sag's head), w arrington. restaurant, luncheons, _ tea and coffee rooms, billiards. chops and steaks at any hour. drinks unsurpassed. sch wepp's"
coffee,1890,5,699,415,6.2366,True,"blectro-plated tea and coffee s vices, best quality, quite new silver english r:entre seconds stop watch. with all the latest improvements §—car—at gold albert. curb, with seal, h..."
coffee,1890,5,699,418,6.2721,True,".3tdcur up auttuun. the queen's hotel, (late nag's head), warrington. restaurant, luncheons, tea and coffee rooms, billiards. chops and steaks at any hour. drinks unsurpassed. schwepp's, bass', guinne"
coffee,1890,5,699,423,6.3018,True,"e4;i all omr 4t very much reduced prices •i'ar..ue. -tol% of fancy chinese & apane!e (mmy% tia and coffee sets. drn a myym. a l bmw', waiting cabfr desks. stationsav„ an i. booklets, brushim. comi3.q."
coffee,1890,5,699,425,6.3114,True,"...ul. comforting. breakfast-supper. boiling water or milk. atirtioil. the queen's hotel. (late nag's head), w arrington. restaurant, luncheons, tea and coffee rooms, b"
coffee,1890,5,699,428,6.3135,True,"etterpress printing including ks, pamphlets, reports, balance sheets, legal forms, overseers' lists, invoices, circulars, handbills, tea and coffee papers, biscuit bags, business cards, memorial cards"
coffee,1890,5,699,431,6.3351,True,"tribute to a yorkshire cricketer. the lovers of cricket at ilriffield on friday last week presented a solid silver tea and coffee service to the yorkshire cricketer, j. t. brown, in recognition of the"
coffee,1890,5,699,432,6.3353,True,"...heart warrington. solemn opening, &inn)ay, october 6th. see bills. the queen's hotel. (late nag's head), w arrington. itestaurant, luncheons, tea and coffee rooms, billiards. "
