word,decade,cluster,cluster_size,rank_in_cluster,distance_to_centroid,target_word_visible,snippet
coffee,1900,1,1055,50,5.8282,True,"adulterated coffee. at the daresbury petty sessions, at stockton heath, on tuesday, thomas gleave, appleton, was summoned for selling coffee which was adulterated by th..."
coffee,1900,1,1055,51,5.8337,True,"...ll working men's club. children's; treat. over 500 members' children of the spring huh working men's club were entertained on satur- day afternoon to coffee and buns, etc. owing to the unsett"
coffee,1900,1,1055,54,5.853,True,"lketti ilettisff no. 1861. sat. registered at the post office as a newspaper. rda janu i spec!, 1:1 27, 1900. price one penny. pure coffees. whole or ground. strong coffee, 10d. and 1/-. good coffee, "
coffee,1900,1,1055,55,5.8541,True,"are hot drinks wholesome? at many of the west african settlements water is no scarce that at the hotels tea and coffee are practically unprocurable, lager boor or appollinaris being the only table bev"
coffee,1900,1,1055,56,5.8561,True,"x x x to lovers of a good cup of coffee it may be interesting to know that genuine roa.sted coffee, of no matter what quality, will not impart its colour to cold water, nor will the bean lo..."
coffee,1900,1,1055,62,5.88,True,"soilo northern weekly gazette. coffee-tea. two miners entered a restaurant in one tif our northern towns e. tihort time ago. the waiter asked one of them wt he would have. ""coffee,"" he re..."
coffee,1900,1,1055,63,5.889,True,"a valuable hint. in norway, where superb coffee is made. a bit of butter is added to the beans while thy are roasting in the covered showl used there for that purpose. in prank*, well, a piece of b..."
coffee,1900,1,1055,67,5.9109,True,"• • instea4 of tea or coffee? ..• n. one can afford to ignore the immortals. of proper food and think mr elm* • whim:of diet, yet thousands of people drink large quantities of te..."
coffee,1900,1,1055,69,5.9175,True,ciiaptee xviii. coffee and green ciiartrerse. the dinner may not be all that it ought to be; it may be too long or toe short; it may not be too well-cooked or too well-serv...
coffee,1900,1,1055,74,5.9352,True,"coffee in jay. although coffee is little used for break- fast in this country, it is very commonly drunk after dinner, a 'custom, says the lancet,"" which pe..."
coffee,1900,1,1055,79,5.9455,True,"scalded to death by coffee. mr. s. brighouse conducted an inquiry at the town hall,earlestown, on wednesday, into the circumstances surrounding the death ofwilfred wilson, the ..."
coffee,1900,1,1055,90,5.9775,True,"scalded to deata by coffee. mr. s. brighouse conducted an inquiry at the town hall,earlestown, on wednesday, into the circumstances surrounding the death of wilfred wilson, the..."
coffee,1900,1,1055,95,5.9982,True,"scalded to death by coffee. mr. s. brighouse conducted an inquiry at the town hall,earlestown, on wednesday, into the circumstances surrounding the death of wilfred wilson, the..."
coffee,1900,1,1055,97,6.0033,True,"stockton and ""titornaby herald. woman's world. coffee as medicine. the medical profession all unite in condemn- ing the use cif tea as a beverage, more .-..specially for women, on account of tlis inju"
coffee,1900,1,1055,104,6.0223,True,"...a church social gathering some time ago a number of deaf mutes were present. il.e- freshments were served during the evening, end in handing a cup of coffee to one o"
coffee,1900,1,1055,108,6.0304,True,"a new beverage. emerald isle. scene, inn. tourist: ""i say, waiter, do you call this coffee? i never tasted such stuff in my life.'' waiter: "".shure, and oi'm sorry yo don't fancy it. sir. ye see, as w"
coffee,1900,1,1055,109,6.0335,True,"coffee for breakfast. the kind of coffee to use, and whether to use chicory with it or not are points which the scribe may not decide. the beet flavour is u..."
coffee,1900,1,1055,111,6.0386,True,"coffee—oranges. i want to say a word about both. there is nothing much better than good coffee, nothing much worse than bad. you cannot say about coffee wha..."
coffee,1900,1,1055,112,6.0438,True,"new jersey law. a young man, 18 years old, was arraigned at arlington (new jersey) on a charm using more sugar in a oup of coffee than the jersey jaws allow. the complainant in the novel case was a re"
coffee,1900,1,1055,115,6.0476,True,"food and drink. a combination of beverage with food. coffee in itself contains no nourishment, we al know, but when two teaspoons of grape- nuts breakfast food are added to a cup of coffee or cocoa, a"
coffee,1900,1,1055,119,6.0566,True,"poisonous coffee. some doctyard workmen discovered some pieces of copper and lead in the brand of coffee supplied to them es ""a hygienic think,"" says reuter's toulon ..."
coffee,1900,1,1055,120,6.0568,True,"new jerusalem on monday afternoon the scholars of the new jerusalem school were served with coffee and buns. about 250 buns and oranges were distributed, sod the children were afterwards allowed to eo"
coffee,1900,1,1055,121,6.0579,True,"...eo tolstoy at home. ""at llonie with cocitt tolstot is the titlel of an interesting article in the january part of the new penny illaganc. the morning coffee was just being sened when"
coffee,1900,1,1055,128,6.0762,True,coffee and cocoa liptons were awarded the grand prize (this is the highest honour obtainable). lovers of perfect coffee and cocoa will find liptons unequall...
coffee,1900,1,1055,129,6.0783,True,"coffee and tea. both are to be praised in their way, but they must be good, and the best is undoubtedly the cheapest. speaking of coffee, a contemporary svl..."
coffee,1900,1,1055,130,6.0796,True,"poisonous effects of coffee. professor boltenstern, of berlin, has been de- nouncing the use of coffee before a congress of german doctors sitting at meran. according to the ger..."
coffee,1900,1,1055,132,6.0825,True,"...ivalled. also rich, pure, the penfection of quality and value. and fragrai nt teas at 1/2 and 1/96 1-lighest liontours ,ris exhibition, 1900. liptons coffee & cocoa we"
coffee,1900,1,1055,138,6.1057,True,"poisonous effects of coffee. professor boltenstern, of berlin, has been de- nouncing the use of coffee before a congress of german doctors sitting at meran. according to the ger..."
coffee,1900,1,1055,143,6.1091,True,"coffee smells a lot better nor id did when aw brought it in. aw think aw could sup a drop o' thad,"" he sed. ged a pot an' pod some o' this in,"" sed ned, bon..."
coffee,1900,1,1055,145,6.1108,True,"northern weekly gazette. first english coffee-house. the earliest record f a coffee house in england dates back to the year 1650. it was then opened in the parish of st. peter, oxford, by a jew n..."
coffee,1900,1,1055,146,6.1196,True,"coffee. it is singuhir that in this coin:try we clr'nk less and less coffee, whilst the oppoite leniency is so marked in ameriea. there. as in france, coffe..."
coffee,1900,1,1055,150,6.1243,True,"poisonous effects of coffee. professor boltenstern, of berlin, has been de- nouncing the use of coffee before a congress of german doctors sitting at moran. according to the ger..."
coffee,1900,1,1055,152,6.1259,True,"the mayor on vi that a eafe centre should be formed ai kept going in birkenhead, where rotol fek lows could make good friendships, where tea. and. coffee and nothing stronger was the rule, and where y"
coffee,1900,1,1055,157,6.1397,True,"stanhill u.m.f.c. the scholars of the united iletliodist school, stanhill, were regaled with coffee arid buns on mo.iday morning. and in the afternoon the usual tea-party and entertainment was held. t"
coffee,1900,1,1055,159,6.1415,True,mother's breakfast. md not relish food after cooking il the practice of going too long without food often leads to excessive indulgence in tea or coffee which plays havoc with the digestive and nervou
coffee,1900,1,1055,161,6.1449,True,"are hot drinks wholesome? at many of the west african settlements water is no scarce that at the hotels tea and coffee are practically unprocurable, lager boor or appollinaris being the only table bev"
coffee,1900,1,1055,165,6.1563,True,"_ ""al,ooo wrong."" tradesman victimised by assistant. the solicitor's desk in the porodgb polies court was lined with tins 01 tea and pack- ages of coffee on wednesday morning, when charges both of fel"
coffee,1900,1,1055,166,6.1567,True,"coffee in jay. although coffee is little used for break- fast in this country, it is very commonly drunk after dinner, a 'custom, says the lancet,"" which pe..."
coffee,1900,1,1055,167,6.1568,True,"... a church social gathering some time ago a number of deaf mutes were present. ite- freahments were served during the evening, and in handing a cup of coffee to ono of the guests "
coffee,1900,1,1055,168,6.1608,True,"how to prepare coffee. coffee, a useful stimulant for cold days, is often objected to, as it is supposed to be difficult to get it good. with ordinary care excellent coffe..."
coffee,1900,1,1055,169,6.1615,True,"lketti ilettisff no. 1861. sat. registered at the post office as a newspaper. rda janu i spec!, 1:1 27, 1900. price one penny. pure coffees. whole or ground. strong coffee, 10d. and 1/-. good coffee, "
coffee,1900,1,1055,171,6.1655,True,...ay not be all that it ought to be; it may be too long or too short; it may not be too well-cooked or too well-served; but if you have a cup of decent coffee and a glass of
coffee,1900,1,1055,173,6.1696,True,"adetter tted coffee. at the daresbury petty sessions, at stockton heath, on tuesday, thomas gleave, appleton. was summoned for selling coffee which was adulterated by th..."
coffee,1900,1,1055,175,6.1731,True,"...e. the arrangements at thi, place were al- mod carried out as intended. the scholars walked in procession from the •chool to the field, where bun and coffee were n:l.ved, and all scholars were pre"
coffee,1900,1,1055,176,6.1763,True,liptons coffee and cocoa were awarded the grand prize (this is the highest honour obtainable). lovers of perfect coffee and cocoa will find liptons unequalled for e...
coffee,1900,1,1055,177,6.1763,True,liptons coffee and cocoa were awarded the grand prize (this is the highest honour obtainable). lovers of perfect coffee and cocoa will find liptons unequalled for e...
coffee,1900,1,1055,180,6.1799,True,"out of cuffle mr t. clayhilie explained that mr dixon, of the golden cock, neasham, had failed to supply coffee to a gentleman sho had caned for it, and that it was merely an accident, bemuse they had"
coffee,1900,1,1055,181,6.1864,True,"a cup of coffee dt persia. the expression ""to give a cup of coffee"" has in persia a. somewhat ominous signifi- cance (says the ""leisure hour ""). this is due to the f..."
coffee,1900,1,1055,183,6.1886,True,"northern weekly gazette. minds women, doesn't lie in buns with coffee or tea at mid-day. there is more beauty in an underdone tender mutton chop. healthy exercise of all, kinds renders beauty permanen"
coffee,1900,1,1055,186,6.1936,True,liptons coffee and cocoa were awarded the grand prize (this is the highest honour obtainable% lovers of perfect coffee and cocoa will find. lipton unequalled ik exc...
coffee,1900,1,1055,187,6.1941,True,"a grocer's trials. a young lady employed by the west ham corporation called on edwin garland, a grocer, of 'plaistow. and asked for coffee. ""coffee, or chicory and coffee v? said garland, anxious to k"
coffee,1900,1,1055,188,6.1962,True,coffee and cocoa liptons were awarded the grand prize (this is the highest honour obtainable). lovers of perfect coffee and cocoa will find liptons unequall...
coffee,1900,1,1055,193,6.2182,True,"coffee—oranges. i want to say a word about both. there is nothing much better than good coffee, nothing much worse than bad. you cannot say about coffee wha..."
coffee,1900,1,1055,194,6.2183,True,".../ its. i hos. clarke, stationer and newsagent, ""examinee"" optic% 33, market street, barleistown. fancy stationery suitable for presents. i-1 parisian coffee essence. newest and best. bxeotly likb fr"
coffee,1900,1,1055,195,6.2195,True,"...ree. carriage paid on 500 lots credit 6d. per 100 extra. h. e. akr,ill, the holderness gun and cycle stores, beverley. hornsea oriental cafe. tea and coffee made to perfection. coffee and biscu"
coffee,1900,1,1055,196,6.2212,True,"... ordering fish for filleting, it is an economy to bay the whole fish, and have it filleted (a ei ple process) at home. the intemperate use of tea and coffee produces results as re"
coffee,1900,1,1055,197,6.2214,True,"coffee, if you ,:ait get it good, le •-• • • dr. love favours ge taking 01 cop of black coffee without arena or rla.-at sandwiched in liaiscon two g!ase, br..."
coffee,1900,1,1055,198,6.2216,True,"poisonous coffee. some doctyard workmen discovered some pieces of copper and lead in the brand of coffee supplied to them es ""a hygienic think,"" says reuter's toulon ..."
coffee,1900,1,1055,199,6.225,True,"ca pta in price. about ave hundred poor children were re- galed with coffee and buns, oranges, 6weets, etc. christmas hymns were sung and words of good cheer spoken by mr. j. taylor and others. there "
coffee,1900,1,1055,202,6.2318,True,"brunak have you tried instead of tea or coffee? no one can afford to ignore the importance cf proper foci.? and &fill: or commit errors of di,t, yet thousands of people drink large quantities of t..."
coffee,1900,1,1055,208,6.2428,True,liptons coffee and cocoa were awarded the grand prize (this is the highest honour obtainable). lovers of perfect coffee and cocoa will find lipton s unequalled for ...
coffee,1900,1,1055,209,6.2429,True,"adulterated coffee. at the daresbury petty sessions, at stockton heath, i on tuesday, thomas dleave, appleton. was summoned for selling coffee which was adulterated by ..."
coffee,1900,1,1055,214,6.2487,True,"a pthe tea and coffee made to perfection. coffee and biscuit 2d. and3d. per cup. farrah's original harrogate toffee. tobacco, cigars, and cigareties. moseley's fine rich c..."
coffee,1900,1,1055,216,6.252,True,"brunak have you tried instead of tea or coffee? no one can afford to ignore the importance of pi-riser foa, and drink or centred' wars of diet, yet thousands of people drink large quantities of te..."
coffee,1900,1,1055,217,6.2525,True,"stockton and ""titornaby herald. woman's world. coffee as medicine. the medical profession all unite in condemn- ing the use cif tea as a beverage, more .-..specially for women, on account of tlis inju"
coffee,1900,1,1055,218,6.2591,True,"icoffee. coffee. coffee we may not be the tarmeat buyers of coffee but we ave,one of the larret buyers of really fine coffee in the country. and we have now ..."
coffee,1900,1,1055,221,6.2635,True,"coffee, if you ,:ait get it good, le •-• • • dr. love favours ge taking 01 cop of black coffee without arena or rla.-at sandwiched in liaiscon two g!ase, br..."
coffee,1900,1,1055,222,6.2643,True,"hornsea oriental cafe. tea and coffee made to perfection. coffee and biscuit 2d. andvd. per cup. farrar's original harrogate toffee. tobacco, cigars, and cigareties. moseley's fine rich c..."
coffee,1900,1,1055,226,6.2758,True,"adulterated coffee. at the daresbury petty sessions, at stockton heath, i on tuesday, thomas dleave, appleton. was summoned for selling coffee which was adulterated by ..."
coffee,1900,1,1055,227,6.2764,True,liptons coffee and cocoa were awarded the grand prize (this is the highest honour obtainable). lovers of perfect coffee and cocoa will find lipton's unequalled for ...
coffee,1900,1,1055,230,6.2816,True,...n items. treat to workhouse inmates. at the warrington workhouse the inmates will have an enjoyable time on coronation day. breakfast will consist of coffee and bread and butter di
coffee,1900,1,1055,231,6.2818,True,"adetter tted coffee. at the daresbury petty sessions, at stockton heath, on tuesday, thomas gleave, appleton. was summoned for selling coffee which was adulterated by th..."
coffee,1900,1,1055,233,6.284,True,"...by t. r. allinson. ex.l.r.p.c.. etc-, 4, spanish- place, london, w, always drink brun ak at breakfast, and at all other meal times. brunak looks like coffee. b"
coffee,1900,1,1055,235,6.2842,True,"8,-. 1' !, ii f..-: 44_ is 51'4 ::f-.-- 1;....-');;-• .- a. -‘_ a ~ ./- _.. have you tried instead of tea or coffee? no one can afford to ignore the importance a proper foo,' and drink ot commit error"
coffee,1900,1,1055,237,6.2864,True,"...ge"" (vide daily press) that several employers in the cation trade are endeavour. big to cope with the scarcity of labour in the !nibs by offering hot coffee, e"
coffee,1900,1,1055,242,6.2916,True,"coffee: from plantation to cup. by robert collier. dt drink coinforteth the brain and heart and helpeth indigestion."" bacon. in the day when francis bacon w..."
coffee,1900,1,1055,245,6.299,True,"hornsea oriental cafe. tea and coffee made to perfection. coffee and biscuit 2d. and 3d. per cup. farrar's original harrogate toffee. tobacco, cigars, and cigareties. moseley's fine rich ..."
coffee,1900,1,1055,247,6.3045,True,"br nak have you tried instead of tea or coffee? no one can afford to ignore the importance of proper food and drink or commit errors of diet, yet thousands of people drihk large quantities of tea ..."
coffee,1900,1,1055,248,6.305,True,"no 1512 one penny account books, ticket books, examiner office, parisian coffee essence. ne vf est and bicst. exactly like fresh-made coffee. write for peer sample, or send le. for large bottle, coffe"
coffee,1900,1,1055,251,6.3083,True,"tea arm coffee made to perfection. moseley fine rich cream in 61 and 1/. jugs. farrar's original harrogate toffee. coffee aid biscuit 2d. and 3d. per cup tobacco, c..."
coffee,1900,1,1055,252,6.3115,True,"hornsea oriental cafe. tea and coffee made to perfection. coffee and biscuit 2d. and 3d. pc: cup. farrah's original harrogate toffee. tobacco, cigars, and cigareties. moseley's fine rich ..."
coffee,1900,1,1055,256,6.3154,True,"brunak have you tried instead of tea or coffee? no one cad afford to ignore the importance of proper food and drink or commit errors of diet, yet thousands of people drink large quantities of tea ..."
coffee,1900,1,1055,257,6.3156,True,"...ekly i gazette. chapter v. as the club tables were fully occu- pied we refrained during luncheon from any further allusion to the sub- ject. with our coffee and cigars, how- ever, we sought"
coffee,1900,1,1055,265,6.3232,True,"hornsea oriental cafe. tea and coffee made to perfection. coffee lim biscuit 2d. andidd. per cup. farrah's original harrogate toffee. tobacco, cigars, and cigareties, moseley's fine rich ..."
coffee,1900,1,1055,272,6.3461,True,"1 tea and coffee made to perfection. coffee and biscuit 2d. andi3d. per cup. farrah's original harrogate toffee. tobacco, cigars, and cigaiieties. moseley's fine rich..."
coffee,1900,1,1055,273,6.3522,True,"...ng amongst women. when women bring out the cards during the afternoon, scamper over dressing for dinner, and hurry back to the tables, and have their coffee end liqueurs and cigarettes served du"
coffee,1900,1,1055,274,6.3535,True,"coffee & chicory. loose, 10d., 1/-, and 1/8 per lb. coffee and chicory, in tins, 10d. and 1/- per lb. specialite blend of coffee and chicory, 1/6. 14 oz. fi..."
coffee,1900,1,1055,275,6.3557,True,"coffee for breakfast. the kind of coffee to use, and whether to use chicory with it or not are points which the scribe may not decide. the beet flavour is u..."
coffee,1900,1,1055,276,6.3562,True,"a grocer's trials. a young lady employed by the west ham corporation called on edwin garland, a grocer, of plaistow, and asked for coffee. ""coffee, or chicory and coffee ?"" said garland, anxious to ke"
coffee,1900,1,1055,277,6.3573,True,"adulterated coffee. at the daresbury petty sessions, at stockton heath, on tuesday, thomas gleave, appleton, was summoned for selling coffee which was adulterated by th..."
coffee,1900,1,1055,279,6.3584,True,"coffee—oranges. i want to say a word about both. there is nothing much better than good coffee, nothing much worse than bad. you cannot say about coffee wha..."
coffee,1900,1,1055,280,6.3586,True,... items. treat to workhouse inmates. at the warrington workhouse the inmates will have an enjoyable time on coronation day. breakfast will consist ckf coffee and bread and butter; 
coffee,1900,1,1055,281,6.3593,True,liptons coffee and cocoa were awarded the grand prize (this is the highest honour obtainable). lovers of perfect coffee and cocoa itu find lipton unequalled for exc...
coffee,1900,1,1055,285,6.3633,True,"...k and a drink to enjoy! parker's sea. breeze"" tea. only ls. bd. per lb. market place and eastgate, hornsea. opened this season leary's oriental cafe. coffee and tea in perfection. rich crea"
coffee,1900,1,1055,286,6.3642,True,"...nk and a drink to enjoy! pa er's sea. breeze"" tea. only is. bd. per lb. market place and eastgate, nornsea. opened this season leary's oriental cafe. coffee and tea in perfection. rich cream"
coffee,1900,1,1055,289,6.3674,True,"brunak instead of tea or coffee? no one can afford to ignore the importance of proper food and drink or commit errors of dict, yet thousands of people drink large quantities of tea ..."
coffee,1900,1,1055,290,6.3676,True,liptons coffee and cocoa were awarded the grand prize (this is the highest honour obtainable). lovers of perfect coffee and cocoa will find limns unequalled for exc...
coffee,1900,1,1055,291,6.3676,True,"the best tea in the world at the price is davy's is. 4d4 and the best of all coffee at the money is 1 davy's is.l )a. davy & sons, ltd.l 40, fargatc, &21, haymarket,sh effi el d., new year happiness i"
coffee,1900,1,1055,293,6.3677,True,opened this season leary's oriental cafe. coffee and tea in perfection. rich cream ices. chops and steaks to order. luncheons and teas provided. afternoon teas a speciality. a comfortable room to le...
coffee,1900,1,1055,296,6.3703,True,"the sports. after the procession buns and coffee was served and sulxsequently the sports took place in a field near monkholme. the of- ficial,. were as follows: committee messrs. t. veevers (chairma..."
coffee,1900,1,1055,303,6.3768,True,"adulterated coffee. at the daresbury petty sessions, at stockton heath, on tuesday, thomas gleave, appleton, was summoned for selling coffee which was adulterated by th..."
coffee,1900,1,1055,304,6.3772,True,"the -paint = is dry. leary's oriental cafe. coffee and tea in perfection. rich cream ices. chops and steaks to order. luncheons and teas provided. afternoon teas a speciality. queen's street, witherns"
coffee,1900,1,1055,305,6.3779,True,"miliosumou brunak instead of tea or coffee? no one can afford to ignore the importance of proper foo and drink or commit errors of diet, vet thousands of people drink large quantities of •ea a..."
coffee,1900,1,1055,306,6.3792,True,"coffee and tea. both are to be praised in their way, but they must be good, and the best is undoubtedly the cheapest. speaking of coffee, a contemporary svl..."
coffee,1900,1,1055,307,6.381,True,"...d a. drink to enjoy! parker's sea. breeze"" tea. only is. ss. per lb. market place and eastgate, hornsea. ed this season tropen leary's oriental cafe. coffee and tea in perfection. ric"
coffee,1900,1,1055,308,6.3811,True,"coffee in jay. although coffee is little used for break- fast in this country, it is very commonly drunk after dinner, a 'custom, says the lancet,"" which pe..."
coffee,1900,1,1055,310,6.3832,True,"suchard cocoa is better than te: and coffee; better for beak) and strength; you may mis the glow warmth heat fin of your old professing fries< but real enemy, tea or coffee at first; not long. ..."
coffee,1900,1,1055,312,6.3867,True,"...agrani stands out alone and unrivalled, the perfection of quality and value. it teas at 1/2 and 1/4 highest .h.onours paris exhibition, 1900. liptons coffee and cocoa we"
coffee,1900,1,1055,313,6.3876,True,(as given in evidence by the government analyst.) brunak is the cfally. harrnleps &12a coffee and tea are slow poisons leelthy drink. 1n ak is drunk daily by a lady over 104 years of age. every drop .
coffee,1900,1,1055,317,6.3928,True,"taliot wad. 'xmas chise6 at keeling's. as runs the proprietors poetically•worded advertiwnient, ""for coffee and teas, butter and ow, biscuits and cheese, hactin and ham,• there i. in, place to heat me"
coffee,1900,1,1055,321,6.4022,True,next for coffee! without its weekly rumours the man- chester royal exchange would be not nearly so interesting a place as its habitual frequenters now find it. the l...
coffee,1900,1,1055,324,6.4053,True,"chinese smuggling coffee. at the birkenhead police court, on tue* day, !before messrs. t. l. dodds and chris- topher newhouse, three chinamen named .loo sing, li swag, and lo..."
coffee,1900,1,1055,327,6.4099,True,"tea on the brain. --- pero that lurk in the cup that cheers."" ""tea—or coffee—on the brain,"" is the latest peril revealed by medical science, for at an inquest just held it was stated that these tvetot"
coffee,1900,1,1055,329,6.411,True,"...d a drink to enjoy! parker's sea breeze"" tea. only is. bd. per lb. market place and eastgate, hornsea. opened this season tr i leary's oriental cafe. coffee and tea in perfection. r"
coffee,1900,1,1055,335,6.4134,True,"a tip to topers. a traveller has made the observation that coffee-drinking people are very seldom given to drunkenness. in brazil, for instance, where coffee is grown extensively and all the inhabi- t"
coffee,1900,1,1055,338,6.4163,True,"[tdb end.] the king's coffee. the king is becoming an inevltahle coffee drinker. wherever he goes his egyptian coffee-maker, elmin abra- ham, follows with his little coffee-mill,..."
coffee,1900,1,1055,343,6.4212,True,...n items. treat to workhouse inmates. at the warrington workhouse the inmates will have an enjoyable time on coronation day. breakfast will consist of coffee and bread and butter; d
