word,decade,cluster,cluster_size,rank_in_cluster,distance_to_centroid,target_word_visible,snippet
coffee,1850,0,2611,8,6.0053,True,"palmer and co.'s tea and coffee warehouses, union-court, castle-street, next the bank of england, liverpool, where families and large consumers may now be supplied at wholesale prie..."
coffee,1850,0,2611,18,6.1375,True,"...buildings, vpnol, may, 1852. additional arrangements for a convenient and periodical—delivery of family parcels from the royal bank buildings tea and coffee warehouse to the suburbs of live"
coffee,1850,0,2611,24,6.2059,True,"...ldings, l'pcol, may, 1852. additional arrangements • for a convenient and periodical—delivery of family parcels from the royal bank buildings tea and coffee warehouse to the suburbs of l"
coffee,1850,0,2611,25,6.2073,True,"...k buildings, ihnol, may, 1852, additional arrangements for a convenient and periodical—delivery wiamily parcels from the royal bank buildings tea and coffee warehouse to the suburbs of liverp"
coffee,1850,0,2611,26,6.2113,True,"...buildings, l'pnol, may, 1852 additional arrangements for a convenient and periodical—delivery of family parcels from the royal bank buildings tea and coffee warehouse to the suburbs-of live"
coffee,1850,0,2611,32,6.2773,True,kotbels hydrostatic tea sad coffee ow ua make inotaitassovilt fres 1 i moon 11=ainus owl watiftew. swim olf paul um. int v. 555 *a aloft 'aims i &a 5155 ea in ea. woolw inewrionkbourni...
coffee,1850,0,2611,35,6.2817,True,"... during lent on mondays, wednesdays, and fridays, at morrish's, merchants' dining rooms, lancaster buildings. hopkeepers that would sell good tea and coffee"
coffee,1850,0,2611,44,6.3504,True,"q hopbeeper s that would sell good tea and coffee 74115 t 00 to j. mullins', 170, mill-street."
coffee,1850,0,2611,47,6.3612,True,"palmer and co.'s tea and coffee warehouses/ union-court, castle-street, next the bank of england, • liverpool, where families and large consumers may now be supplied at wholesale pr..."
coffee,1850,0,2611,58,6.3885,True,"john ronald, west india merchant. d avid tmomson, tea and coffee merchant, no. 1, union corner, glasgow, continues to supply the public with the very remy valli' in teas and coffees. the coffees fresh"
coffee,1850,0,2611,65,6.4134,True,"palmer and co.'s tea and coffee warehouses, union-court, castle-street, next the bank of england, liverpool, where families and large commoners may now be supplied at wholesale pric..."
coffee,1850,0,2611,66,6.4175,True,"ls. 4d is the finest in the trade, and not to be surpassed at any price. e. & r. heathoote, tea and coffee merchants, 16, elliot-street, liverpool, cl obegoto iln)formwthefr fnriendsaal thedpublcic, t"
coffee,1850,0,2611,71,6.4362,True,"the london tea and coffee warehouse, (wholesale and etail), 40, high street, stockton-on-tees."
coffee,1850,0,2611,74,6.4411,True,"hop keepers that would sell good tea and coffee must go to j. mijllins', 170, mill-street."
coffee,1850,0,2611,77,6.4515,True,"is. 4d. is th finest in the trade, and not to be surpassed at any price e•& r. heathcote, tea and coffee merchants,. 16, elliot-street, liverpool. charles willmer, whole sa le stationer. mach ine prin"
coffee,1850,0,2611,78,6.4555,True,"x 4,4 anteb. ahouse in the wholesale tea and coffee trade, requires a rf.presp.nt or the town trade. security will be indispen address, statin present and previous occupation, box \v 26, postoffice, i"
coffee,1850,0,2611,80,6.4572,True,"palmer and co.'s tea and coffee warehouses, union-court, castle-street, next the bank of england, liverpool, where families and large consumers may now be supplied at wholesale pric..."
coffee,1850,0,2611,83,6.4615,True,"palmer and co.'s tea and coffee warehouses, union-court, castle-street, next the bank of england, liverpool, where families and large consumers may now be supplied at wholesale pric..."
coffee,1850,0,2611,85,6.4669,True,"otsel's hydrostatic tea and coffee o\]+ oa mete inet4a t•neouiilt item 1 te imo of mmealled atu no.l beldame.. waft wi 1.411a1.1. uwd w *mo ymalle., the tit' wino x 7 be mmm w. w. weer..."
coffee,1850,0,2611,87,6.4713,True,"the london tea and coffee warehouse, (wholesale and retail), 40, high street, stockton-on-tees."
coffee,1850,0,2611,88,6.4723,True,hotbeli3 hydrostatic tea and coffee mob mi orbs instaitaniowily from 1 to 111.10 at solyabed mar awl boldilnen. mytbg w.-ilillt. uad by iwo ramlbs. tbs glim. i.oiidoii t wild at to. 110...
coffee,1850,0,2611,89,6.4725,True,"wholesale and retail tea and coffee merchant and grocer, 121, trongate, ind 21, jamaica street, glasgow. orders from the country, accompanied with a remit- tance, punctually attended to..."
coffee,1850,0,2611,91,6.4744,True,"shopkeepers that would sell good tea and coffee most go to j. mullins', 170, mill-street"
coffee,1850,0,2611,92,6.4761,True,"palmer and co.'s tea and coffee warehouses, union-court, castle-street, next the bank of england, liverpool, where families and large consumers may new be supplied at wholesale pric..."
coffee,1850,0,2611,93,6.4804,True,"palmer and co.'s tea and coffee warehouses, union-court, castle-street, next the bank of england, liverpool, where families and large consumers map now be supplied at wholesale pric..."
coffee,1850,0,2611,94,6.4834,True,"palmer and co.'s tea and coffee warehouses, union-court, castle-street, next the bank of england, liverpool, where families and large consumers may now be supplied at wholesale pric..."
coffee,1850,0,2611,101,6.4965,True,"palmer and co.'s tea and coffee warehouses, union-court, castle-street, next the bank of england, liverpool, where families and large consumers may now be supplied at wholesale palo..."
coffee,1850,0,2611,103,6.499,True,"palmer and. co.'s tea and coffee warehouses, union-court, castle-street, next the bank of england, liverpool, • where famflies and large consumers may now be supplied cavholesale pri..."
coffee,1850,0,2611,110,6.515,True,"palmer and c 0. tea and coffee dealers, union-court, castle-street, next the bank of england, liverpool. raw and refined sugars."
coffee,1850,0,2611,112,6.5197,True,"tea and coffee t_tellewell's ti ishin g 11_2 & 3, quadrant, 8001 j. if ul l ins', 170, mill-street & shooting"
coffee,1850,0,2611,114,6.5229,True,"palmer and co.'s tea and coffee warehouses, union-court, castle-btreet, next the bank of england, liverpool, where families and large consumers may now be :kpplied at wholesale pric..."
coffee,1850,0,2611,115,6.5236,True,"ls. 4d, is the finest in the trade, and not to be surpassed at any price. e. & r. lieatiicote, tea and coffee merchants, 16, elliot-street, liverpool. goodwin and c o. beg to inform their friends and "
coffee,1850,0,2611,116,6.5268,True,"l‘qtleh ~____cannot be surpassed by any house in the town teas and coffees, 4.lii 15t, p""lhants' luncheon-rooms, cafe, and it ab wine shade. 1 f above establishment has been opened °iii,. or the accom"
coffee,1850,0,2611,117,6.528,True,kotse:ii hydrostatic tea and coffee ran ma min 211711atillallan.tirralje n.m.. ale ora -1-ftyall .akit e et simee—air swerren.s. •i&lliala mom is. riredmims. ll m.p.g.'s.. •
coffee,1850,0,2611,118,6.5382,True,"wholesale and retail tea and coffee merchant and grocer, 121, trongate, and 21, jamaica street, glasgow. orders from the country, accompanied with a remit- tance, punctually attended to..."
coffee,1850,0,2611,122,6.5464,True,"partnership.—to wholesale tea but and coffee dealers.—the senior partner of a small, okl.est blished bu.iness being about to retire, the remaining ,ner is desirous of entering a firm of standing..."
coffee,1850,0,2611,123,6.5471,True,opkee p e r s that would sell good tea. and coffee
coffee,1850,0,2611,124,6.5492,True,"palmer and co.'s tea and coffee warehouses, union-court, castle-street, next the bank of england, liverpool, tvhere families and large consumers may now be supplied at wholesale pri..."
coffee,1850,0,2611,126,6.5543,True,"...y, t h tea trade. 6 lbs. of the best congou tea.—better tea for) £1 3 0 family use cannot be bad 6 lbs. of good breakfast tea 1 1 0 6 lbs. best mocha coffee 0 9 6 6 lbs. good co"
coffee,1850,0,2611,127,6.5554,True,"shopkeepers thdt would sell good tea and coffee must go to j. 3.iiillins', 170, mill-street, fish ordinaries on good friday, at the grand junction hotel, lime-street. ready at half-past one o'clock..."
coffee,1850,0,2611,131,6.5623,True,"french coffee and chocolate company. t apital, 30,0001., in shares of los each, paid in full. shareholders liable only for the amount of their shares."
coffee,1850,0,2611,132,6.5633,True,"palmer and co.'s tea. and coffee warehouses, us/01c- co ur 7 ca s tle-s tree t, next thf, bank of england, liverpool, where families and large consumers may sow be a'ispplied at whol..."
coffee,1850,0,2611,134,6.5685,True,"taylor and james, forwarding and cqj,mh)s'.sion agents, .a.--,t..iiirebarn-street coffee the dutch company's imports .... is. 4d. per lb excellent second quality families purchasing tea and coffee at "
coffee,1850,0,2611,139,6.5792,True,loyselii hydrostatic tea sad coffee urns rho ins? aaaaa doubly fon 1 by had of =amid inns mg brlyblom raft onn-nain. nod ann do olds& london tavais. saw • 'k:avia inammemtisrester.ool w...
coffee,1850,0,2611,141,6.5821,True,"to the inhabitants of cheshire. ______ sharpe and co., coffee dealers, 14, exchange-street east, liverpool, beg to apprise families and hotelkeepers that they have appointed mr. john cockcroft, of bir"
coffee,1850,0,2611,148,6.599,True,"a revolution in coffee and tea making, .cl. sawn eel • 0011.. 0.11•1411.4 armes aid n..ltirsaid pros 9 11ydroatatio sod omimov.47 471930011 a :4 d 8 at the zuw.. no. ill 00..."
coffee,1850,0,2611,155,6.6101,True,"palmer -and co.'s tea and coffee warehouses, union-court, castle-street,"
coffee,1850,0,2611,156,6.611,True,"tea and coffee must go to mullins', 170, mill-street. at any hour you caliiels?iree tsouutlied with anything you at the palatine dining rooms, 25, cable-stleet."
coffee,1850,0,2611,161,6.6156,True,"palmer and co.'s tea and coffee warehouses, union-court, castle-street,"
coffee,1850,0,2611,165,6.6245,True,"to the inhabitants of cheshire. _ sharpe and co., coffee dealers, 14, exchange•street east, liverpool, beg to apprise families and hotelkeepers that they have appointed mr. john cockcroft, of bir- ken"
coffee,1850,0,2611,177,6.6436,True,"wanted, by the advertiser, a situation as clerk, in a tea and coffee merchant's office unexceptionable references as to respectability can be given a moderate salary required. address alma, northern t"
coffee,1850,0,2611,178,6.6446,True,"ls. 4n, sth finest in the trade, and not to be surpassed at any price. e. & r. ii eat ii 0t e tea and coffee merchants, 16, elliot-street, liverp 00l, pickled west india limes t c. stivens & co. recom"
coffee,1850,0,2611,179,6.6563,True,"pa lmer and co., tea and coffee dealers. union-court, castle-street, next the bank of england, liverpool. raw and refined sugars."
coffee,1850,0,2611,181,6.6621,True,"tea and coffee merchant, and general grocer, r. t. iniellanby, respectfully informs his friends and the public of stockton. that he has received a large stock of sp..."
coffee,1850,0,2611,184,6.667,True,"to the inhabitants of cheshire. sharpe and co., coffee dealers, 14, exchange-street east, liverpool, beg to apprise families and •hotelkeepers that they have appointed mr. john cockcroft, of bir- kenh"
coffee,1850,0,2611,185,6.6671,True,"p almer and co.'s tea. and coffee warehouses, union-court, castle-street, next the bank of england, liverpool, where families and large consumers may now be supplied at wholesale pric..."
coffee,1850,0,2611,186,6.6677,True,"to the inhabitants of cheshire. shaiu'e and co., coffee dealers, 14, exchange-street east, liverpool, beg to apprise families and hotelkeepers that they have appointed mr. john cockcroft, of bir- kenh"
coffee,1850,0,2611,189,6.6706,True,"marylebone. ie corci williams stratton, the keeper of a coffee-stall at wharf- road, paddington, was charged with having sold spirits without having a license. brown, 299 d. deposed that on the previo"
coffee,1850,0,2611,191,6.6802,True,"...ring lent on mondays, ivednp.sdays, and fridays, at morrish's, merchants' dining rooms, lancaster buildings. shopkeepers that would sell good tea and coffee mullins', 170, aitli.-st"
coffee,1850,0,2611,194,6.6814,True,"...i n ec nisom cai butters genuini t a ru d ;est made; and mblie, we have to be had, in pound and half-pound canisters only, h doubleday & co., tea and coffee deale"
coffee,1850,0,2611,196,6.6856,True,"to the inhabitants of cheshire. sharpe and co., coffee dealers, it, exchange-street east, liverpool, beg to apprise families and hotelkeepers that they have appointed mr. john cockcroft, of bir- kenhe"
coffee,1850,0,2611,200,6.6873,True,"for at prices, for cash, that cannot fail to give general satisfaction. elbctro.-plated set, comprising tea and coffee po't, cream ewer and sugar basin from 70a od elnerao-plated or nicazi. silvica. t"
coffee,1850,0,2611,204,6.6917,True,"a. gne..kt sale of teas, coffees, and general groceries, will take place on thursday, april 16, and following days, at the london tea establishment, 115, dale street (corner of hatt..."
coffee,1850,0,2611,206,6.6945,True,"arefolution in coffee sad tea making., me it ii owl. vodoollof anon. mo 4 lo ilpaftell b piti,k,foratjo l flefl aproina 11111 tlio us k ada lsanka. o. cl. nil nov* of crom..."
coffee,1850,0,2611,212,6.7038,True,"arivolution la coffee and tea making, eimo fis se cing.. varlftiol amer na lli c„ pima li sit viloimitio pitkil2 i"" be 02""virritrsk,b.11"" .... rallorair iala, eamal /m.o. ..."
coffee,1850,0,2611,213,6.7055,True,"a.. great sale of teas, coffees, and general groceries, will take place on thursday, april 16, and following days, 0 the london tea establishment, 115, dale street (corner of hatto..."
coffee,1850,0,2611,221,6.7224,True,"ls. 4d. sth finest in the trade, and not to be surpassed at any price. e. & r. heathoote, tea and coffee merchants, 16, elliot-street, liverpool."
coffee,1850,0,2611,227,6.7257,True,"kotisilii hydrostatic tea and coffee 111117autaxiouilt bra i to i• ands wed earlds d.11a1.1. urd w iv* dr 01.11311 x x tamil,. sr sood at ts. il w warseren. w. /aux laid. wok /o. propsdi..."
coffee,1850,0,2611,228,6.7262,True,"any article to be had sing chest to contain the above, a &c., £2 15a. tea and coffee waiters, candlesticks, &c., al of re-plating done by the pa"
coffee,1850,0,2611,234,6.736,True,"genuine coffee. qpiarpe and company, 14, exchange-street no east, respectfully announce that, through the extensive and increasing demand for their coffee, they hav..."
coffee,1850,0,2611,236,6.7391,True,"tea and coffee warehouse, 51, great charlotte-street, liverpool. families purchasing te a at this i' establishment will have the benefit of the reduction of duty. s..."
coffee,1850,0,2611,239,6.7483,True,boyuli3 hydrostatic tea sad coffee mil ism 1117/011100sly ins i se 10.10 et =mgm wwwwl bolubwoft =wu on is-rali. used i. wm we glim. wiwi vitus ars kw as woonrairat kowwwww. wirdow. ai...
coffee,1850,0,2611,240,6.7488,True,"i'lectro-plated goode,. frederick clark begs leave to offer a very excellent stock of plated goods, consisting of tea and coffee services, from .es 10 0 sets of side dishes and covers, with moveable 8"
coffee,1850,0,2611,243,6.7516,True,"wholesale tea and coffee trade. aconcern in the above line •f business, situated in the best and most central part of the town, is to be disposed of by private treaty. the co..."
coffee,1850,0,2611,248,6.7605,True,"r. t. mellanby, tea and coffee merchant, and general grocer, pespectfully informs his friends nnd the public of stockton, that he has received a large stock of splendid teas, which..."
coffee,1850,0,2611,249,6.7622,True,"tea and coffee merchant, and general grocer, respectfully informs ids friends and _tit: the public of stockton, that he has received a large stock of splendid teas,..."
coffee,1850,0,2611,251,6.7677,True,allistellantous. coffee roasting at hog.—the reason why the flavour of ei ffee is so superior in france to that gene- rally put up with in england does not proceed from tue ...
coffee,1850,0,2611,258,6.7766,True,"the following licensed tea and coffee .1 dealers in liverpool were prosecuted on the 7th january, 1854, by order of the commissioners of inland revenue, and have paid the penalty set agai..."
coffee,1850,0,2611,261,6.7857,True,"parker-street rooms. remaining stock-in-trade of modern and fashionable electro silver-plated tea and coffee equipages, elegant hot-water kettles, handsome sets of castors, liqueur and spirit frames, "
coffee,1850,0,2611,296,6.826,True,"-ha rtlepool. presicntation.-011 friday last, a splendid sil- ver tea and coffee pot, and a lamp stand, were pre- sented to the rev 11. it. ridley, vicar of stranton, on tho occasion of his leaving th"
coffee,1850,0,2611,298,6.8269,True,chicory and coffee. mr. ilistie asked the secretary of the treasury whether there was any foundation for the report that it was the intention of her majesty's governmen...
coffee,1850,0,2611,301,6.8332,True,"opening of one of the most extensive tea an d coffee establishments in the kingdom. vey brothers respectfully announce their intention of opening, on friday next, the 16th premises recently erected on"
coffee,1850,0,2611,306,6.8373,True,"for electro-plated set, comprising tea and coffee tot, cream ewer and sugar basin from 70s od electro-plated or nickel silver tea spoons .•• •••.• • ••• ••• from 9s 6d per dozen. desert spoons and fo..."
coffee,1850,0,2611,307,6.8387,True,"groceries. 20 packages tea, in amid, a quantity of black and green, duty paid, 4 hap, native ceylon coffee in bond, a quantity raw and roasted coffee, duty paid, a quantity new currant, in cases and b"
coffee,1850,0,2611,309,6.8398,True,"_ tea and coffee warehouse, fife place, 117, west george street. coffees of the finest qualities, carefully selected, roasted on the most scientific principle, and gr..."
coffee,1850,0,2611,311,6.8413,True,"(late creasy), sale of furnish tea and coffee pot, cream ewer and sugar"
coffee,1850,0,2611,314,6.8452,True,"tea and coffee warehouse, 51, great charlotte-street, liverpool. families purchasing te a at this establishment will have the benefit of the reduction of duty. sand..."
coffee,1850,0,2611,330,6.8663,True,"bankrupts archibald hurst, manure manufacturer and wharfinger, bull head dock, rotherhithe. randal woollatt, tea and coffee dealer, fenchurch street, city. joshua gill, grocer, dewsbury, yorkshire. he"
coffee,1850,0,2611,331,6.8676,True,"articles, ev.,ry requisite for the table and sideboard, tea and coffee equlpa_es of the latest ta.hion, numerous ornamental articles in chased silver, spoons, forks, and ladles, of every pattern. plat"
coffee,1850,0,2611,332,6.8682,True,"wholesale, retail, and family tea and coffee esta-bltsiiment, on entering upon this new undertaking, the proprietors assure the public that n,a,effort will be spared to secure to the fullest ext..."
coffee,1850,0,2611,333,6.8705,True,"r. t. mf,i.i.anby, tea and coffee merchant, and general grocer, p espectfitlly informs his friends and t the public of stockton, that he has received a large stock of splendid teas, w..."
coffee,1850,0,2611,334,6.8739,True,"extensive public sale of gold and silver hunting watches, jewellery, silver plated goods, plated tea and coffee sets,"
coffee,1850,0,2611,339,6.8792,True,"coffee. willmer's railway and steam-boat guide is published on the first of each month, and is the only local guide for all conveyances out of and ~into liv..."
coffee,1850,0,2611,343,6.893,True,"riie sun, london, thursday evening, ma y 7, 1857. pared and manufactured to resemble coffee, and to serve as a smbstitute for coffee,, by which the defen- dant had incurred a penalty not exceeding 100"
coffee,1850,0,2611,348,6.8971,True,"[cincutiß.] royal bank buildings. liverpool, november, 1856. we have7selected—from the recent arrivals of ceylon and jamaica coffees—a large ywintity, which will be found superior to any imported for "
coffee,1850,0,2611,349,6.901,True,"electro-plated set, comprising tea and coffee pet, cream ewer and sugar basin from 70s od electro-plated or nickel silver tea spoons from 9s 6d per dozen. dessert spoons and forks from 16s od per..."
coffee,1850,0,2611,362,6.9228,True,"ironm ongery, general s, :etnawne,p....ttin set, eornppising tea and coffee pot,'cream ewer and saga'. basin _ei-bdtrd,p.lated or ntcriii,biidver tea spoone, _deporrt•43poons and forks. *taidle • ditt"
coffee,1850,0,2611,364,6.9276,True,"...s of glasgow and the west of scotland. we beg to intimate that we have opened the premises, nos. 146 & 148, trongate, in the wholesale & retail tea & coffee trade our business will be"
coffee,1850,0,2611,372,6.9394,True,"coffee and tea services, baskets, cruet frames, 444 """"3' article needful for luxury and comfort p. w .taxita • p',8 spoons and forks will be found the mosta..."
coffee,1850,0,2611,378,6.9431,True,allistellantous. coffee roasting at hog.—the reason why the flavour of ei ffee is so superior in france to that gene- rally put up with in england does not proceed from tue ...
coffee,1850,0,2611,379,6.9439,True,"thames. robbery of a bag of coffee in the london dock. —joseph. priestley, a carman, was brought before mr. selfe, charged with stealing 112 lbs. of coffee. last night potter, a police..."
coffee,1850,0,2611,388,6.9559,True,"coffee and tea services, baskets, cruet mames, and every article needful fdt luxury and comfort, f. w. p.'s spoons and fotlin will be found the most ad- van..."
coffee,1850,0,2611,390,6.9595,True,"_ tea and coffee warehouse, fife place, 117, west george street. coffees of the finest qualities, carefully selected, roasted on the most scientific principle, and gr..."
coffee,1850,0,2611,394,6.9636,True,"...swick shades. wine, spirits, ale, porter, &c soups, chops, steaks, &c. hanover-street, w. e. whitemaiv, pnoriusroß st. george's commercial dining and coffee-rooms. 33 and 34, otn haymarket, liverp"
coffee,1850,0,2611,410,6.9845,True,"flo, &e., and with glass ours, ha a eandlestic lnd coffee services, ch. monday next, and on t] .rmation ney ()fa, fish coy .y kettles and ladles, c norning church-street ad quarters, the electro plate"
coffee,1850,0,2611,412,6.9903,True,"fresiiment rooms the wo] classes, st. _ pen from half-past five o'cek morning till niue o'clock p.m. cup of coffee, large id. „ small „ tea, large 4• lid. small bread or 'biscuit butter do. do. basin "
coffee,1850,0,2611,420,6.9943,True,"coffee the dutch company's imports is. 4d. per lb. excellent second quality ls. 2d. „ families purchasing tea ,and coffee at hamilton and davies's are charg..."
coffee,1850,0,2611,421,6.9948,True,"mitted that a cup of coffee wa .. torrington, your made dffee garden, ceylon, some tin also by that splendid—l was goin nt, who rem; bacon, and do night, c to the tire lake once..."
coffee,1850,0,2611,422,6.9957,True,"for the: sale of at prices, for casill, that caunot fail to give general satisfaction, elrctro-plated set, comprising tea and coffee bat, cream ewer and sugar basin electilo-plated or nickel silver te"
coffee,1850,0,2611,423,6.9961,True,"...n-on-tees. on sale by private contract, amilner's patent fire resisting • hold flit safe, no. 41, with drawers and h. bb's lock a very superior large coffee mill. with fly wheel, made by a. sav"
coffee,1850,0,2611,424,6.9965,True,"_ tea and coffee warehouse, fife place, 117, west george street. coffees of the finest qualities, carefully selected, roasted on the most scientific principle, and gr..."
coffee,1850,0,2611,427,6.9989,True,"patent piano- ph harrison begs to inform i pl/tei e sale d tea ur t of three eo.rgi beet f ii i ,hat eaznot a and coffee pot, tea spoons builders' ira and most economical manufactory 4, st. lames's-pl"
coffee,1850,0,2611,439,7.01,True,"i g a. s thelargest stock. the fin est foreign brands the cheapest home-made. l. goldsmitit and co.'s, 4. st. george's crescent. coffee [circular.] royal bank buildings liverpool, november, 1856 we ha"
coffee,1850,0,2611,441,7.0123,True,"society of arts prize pattern. i: cm and saucers. 2 cake plates. i: coffee cc. i sugar sol i 1112.11 wast cl7ll i bowl. and samos. i milk jug. mates. 4 loo cum. tated te blooper, may 6ollmory, la low "
coffee,1850,0,2611,449,7.0172,True,"table services, dessert services, tea and coffee services, the newest in style, best in quality, and cheapest in price, can be had only at o'donnell's, 1 2 2, bold-street, cut glass manufacturer. cr..."
coffee,1850,0,2611,453,7.0208,True,"ls. 4d, is the finest in the trade, and not to be surpassed at any price. e. & r. liea thcote, tea and coffee merchants, 16, elliot-street, liverpool. re move the cause, and the effects will cease.—ac"
coffee,1850,0,2611,458,7.0292,True,"a large assortment of very euperior electra silver. plated goods, made by one of the first makers lb sheffierd, embracing tea and coffee sets, kettles to match, liquor frames, cruet frames, pickle fra"
coffee,1850,0,2611,474,7.0478,True,"opening of one of the most extensive tea an d coffee establishments in the kingdom. vey brothers respectfully announce their intention of opening, on friday next, the 16th premises recently erected on"
coffee,1850,0,2611,478,7.0508,True,"table services, dessert services, tea and coffee services, the newest in style, best in quality, and cheapest in price, can be had qm.y at o'donnell's, 1 2 2, bold.strebt, cut glass manufacturer. cr..."
coffee,1850,0,2611,481,7.052,True,"for the sale of furnishing ironmongery, at prices, for cash, that cannot fail to give general satisfaction. electro-plated set, comprising tea and coffee pot, cream ewer and sugar basin from 70s od el"
