word,decade,cluster,cluster_size,rank_in_cluster,distance_to_centroid,target_word_visible,snippet
tobacco,1840,0,466,1,4.8862,True,"sale of tobacco svuns y. jonas and others.—mr. martin and mr. tomlinson were for the plaintiff, and mr. watson and mr. hogging for the defendants. the plaintiff is a..."
tobacco,1840,0,466,4,5.237,True,"...ober 28, 1847. police.-yesterday. guildhall.—roiii3iiry by a shiitant.—d. evans, a carman in the employment of messrs. crofton and rippori, snuff and tobacco manufact"
tobacco,1840,0,466,8,5.4418,True,"itavannaii cigars.—a letter from the ilavanr.th informs us that the cultivation of tobacco is increaf,ing immensely in cuba, in consequence of the great demand for havannah cigars, whilst in many dist"
tobacco,1840,0,466,12,5.4953,True,"...ober 28, 1847. police.-yesterday. guildhall.—roiii3iiry by a shiitant.—d. evans, a carman in the employment of messrs. crofton and rippori, snuff and tobacco manufact"
tobacco,1840,0,466,13,5.4997,True,"tobacco ditties. dr. bowring rose to call the attention of the house to a return, no. 295, moved for by mr. hume, and ordered to be printed on the 11th may l..."
tobacco,1840,0,466,17,5.5211,True,"high duties-adulteration. the leeds mercury of last week contains an account of an extensive seizure of tobacco in that town, and of a conviction of the owners in a large penalty, on the ground that i"
tobacco,1840,0,466,18,5.5769,True,"itavannaii cigars.—a letter from the ilavanr.th informs us that the cultivation of tobacco is increaf,ing immensely in cuba, in consequence of the great demand for havannah cigars, whilst in many dist"
tobacco,1840,0,466,19,5.5895,True,"tobacco duties. dr. bowring rose to call the attention of the house to a return, no. 295, moved for by mr. hume, and ordered to be printed on the 11th may la..."
tobacco,1840,0,466,23,5.6615,True,"tobacco regulations bill. mr. t. i) un,;ombe presented a petition, signed by almost all the great manufacturers of tobacco in the port of london, against thi..."
tobacco,1840,0,466,25,5.6926,True,"itavannaii cigars.—a letter from the ilavanr.th informs us that the cultivation of tobacco is increaf,ing immensely in cuba, in consequence of the great demand for havannah cigars, whilst in many dist"
tobacco,1840,0,466,27,5.7027,True,"police intelligence. smuggling.--william holford, master of a flat, was on friday fined £loo, for having a large quantity of tobacco secreted in his vessel, but as he appeared to have been the victim "
tobacco,1840,0,466,36,5.8429,True,"to tobacco-manufacturers and others. to be sold, by private treaty, the stock-in- trade, fixtures, and goodwill of a capital and old-established trade in the ma..."
tobacco,1840,0,466,37,5.8462,True,"police intelligence. smuggling.--william holford, master of a flat, was on friday fined £loo, for having a large quantity of tobacco secreted in his vessel, but as he appeared to have been the victim "
tobacco,1840,0,466,39,5.8536,True,"sale of tobacco svuns y. jonas and others.—mr. martin and mr. tomlinson were for the plaintiff, and mr. watson and mr. hogging for the defendants. the plaintiff is a..."
tobacco,1840,0,466,40,5.8538,True,the tobacco trade-enormous extent of toitiggling. (from the globe.) if government be not positively impervious to the lm- sons derived from well-ascertained and ...
tobacco,1840,0,466,42,5.8552,True,"... da y evenning, court of excise-yesterday (swore the hon. captain percy, t. harrison, esq., and c. j. herries, esq.) extensive seizure of adulterated tobacco. george c"
tobacco,1840,0,466,44,5.8634,True,tobacco manufactorn at manilla our manilla correspondent informs us that he has just re- turned from a visit to the government manufacture of cigars in that ...
tobacco,1840,0,466,47,5.8803,True,tobacco (virginia) .. ••••• • • • all the articles to be exempted from the customs' duties. samples of the cocoa (not less than 21bs.) must be produced by th...
tobacco,1840,0,466,48,5.8961,True,"itavannaii cigars.—a letter from the ilavanr.th informs us that the cultivation of tobacco is increaf,ing immensely in cuba, in consequence of the great demand for havannah cigars, whilst in many dist"
tobacco,1840,0,466,51,5.9405,True,"thames. tobacco snuggling on board snft..—yesterday, thomas jackson, a seaman, belonging to the ship brothers, of goole, late from hamburgh, and now lying off pickle..."
tobacco,1840,0,466,52,5.9517,True,tobacco manufactory at manilla. our manilla correspondent informs us that he has just re- turned from a visit to the government manufacture of cigars in that...
tobacco,1840,0,466,54,5.9642,True,...d edition of the times of monday:— • • • the madrid gazette of the 9th contains three financial de- crees; the first sanctioning the rescision of the tobacco con
tobacco,1840,0,466,59,6.0375,True,"state. in consequence of the pressure of heavy excise duties, the artizan now paid as.much•for one pound of tobacco as would buy nine pounds, 'and: the .flame was applicable to a vast number of °flirt"
tobacco,1840,0,466,65,6.088,True,"tobacco trade. mr. hume moved for a select committee, to exa- mine into the present state of the tobacco trade, and to inquire what effects have been produce..."
tobacco,1840,0,466,66,6.0902,True,...d edition of the times of monday:— • • • the madrid gazette of the 9th contains three financial de- crees; the first sanctioning the rescision of the tobacco con
tobacco,1840,0,466,67,6.0936,True,"tobacco trade. mr. hume moved for a select committee, to exit. mine into the present state of the tobacco trade, and to inquire what effects have been produc..."
tobacco,1840,0,466,69,6.1194,True,the tobacco trade-enormous extent of toitiggling. (from the globe.) if government be not positively impervious to the lm- sons derived from well-ascertained and ...
tobacco,1840,0,466,70,6.1261,True,"...assaulting james m‘dermott on the 12th of september last, at norton canes, putting him in bodily fear, and stealing from his persen two sovereigns, a tobacco-box, and a small quantit"
tobacco,1840,0,466,76,6.1533,True,"...iddling quality, all sold at 2a. 2d. to 2.. 4d. very little else dent, as the trade decline purchasing es long as they hold any, and a little of this tobacco is now made to g"
tobacco,1840,0,466,79,6.2125,True,"seizure of tobacco. weymouth, dec. 3.—lnformation having been re- ceived here some short time ago, from the officers con- nected with the custom-house at guernsey, that..."
tobacco,1840,0,466,83,6.2274,True,"tobacco duties. a deputation of the associated manufacturers of tobacco, accompanied by dr. bowring, m.p., mr. henry berkeley, m.p., mr. g. h. w. heneage, m...."
tobacco,1840,0,466,85,6.2424,True,"revolt at malacassa. large seizure of tobacco at the custom house quay.—ors saturday afternoon an extensive seizure of smuggled tobacco was effected by mr. marsh, a landing-wailer of customs, on ..."
tobacco,1840,0,466,92,6.2716,True,"customs' sales.—delivery of tobacco.--the board of customs having had under their consideratio a communication from the commissioners of excise' suggesting, with a view to the greater s..."
tobacco,1840,0,466,93,6.2725,True,"no tobacco to be smoked in any market, 35. no tobacco, or other thing, shall be smoked in any mar- ket. and every person offending against this bye-law shall fo..."
tobacco,1840,0,466,94,6.2727,True,"tobacco duties. dr. bo wring presenied a petition from some of the most respectable tobacco dealers in the kingdom, which stated that it nas impossible to pr..."
tobacco,1840,0,466,95,6.2736,True,"thames. tobacco snuggling on board snft..—yesterday, thomas jackson, a seaman, belonging to the ship brothers, of goole, late from hamburgh, and now lying off pickle..."
tobacco,1840,0,466,96,6.2807,True,"7'o the editor of the sun. sin, —having observed i'rofessur muspratt's re- marks upon the rumoured adulteration of tobacco, of which i confess i know nothing more than that i am firmly convinced the m"
tobacco,1840,0,466,97,6.2813,True,"seizure of tobacco. weymouth, dec. 3.—lnformation having been re- ceived here some short time ago, from the officers con- nected with the custom-house at guernsey, that..."
tobacco,1840,0,466,99,6.2924,True,"revolt at malacassa. large seizure of tobacco at the custom house quay.—ors saturday afternoon an extensive seizure of smuggled tobacco was effected by mr. marsh, a landing-wailer of customs, on ..."
tobacco,1840,0,466,101,6.2996,True,"... smith. sir f: burdett gave notice of a motion for this day week to address her majesty, to erect a mo- nument to the memory of sir sydney smith. the tobacco bill. the chancellor"
tobacco,1840,0,466,102,6.3094,True,"police intelligence. mansion-house. the lord mayor—where was the tobacco found? officer—ln his hat and stockings. the prisoner—l never had a bit of tobacco before, my lord, and i never thought there w"
tobacco,1840,0,466,105,6.3184,True,"affairs of portugal. 1415130 n, july b.—with regard to the project of loan which wins one of the conditions on which the tobacco contract is to be auctioned, it would be very unjust for capitalists to"
tobacco,1840,0,466,108,6.3249,True,"no tobacco to be smoked in any market. 35. no tobacco, or other thing, shall be smoked in any mar- ket. and every person offending against this bye-law shall fo..."
tobacco,1840,0,466,111,6.3586,True,"affairs of portugal. 1415130 n, july b.—with regard to the project of loan which wins one of the conditions on which the tobacco contract is to be auctioned, it would be very unjust for capitalists to"
tobacco,1840,0,466,112,6.3603,True,"tobacco duties. mr. hawes wished to direct the attention of the chancellor of the exchequer to a recommendation which had been made, and to an expectation wh..."
tobacco,1840,0,466,113,6.3633,True,"...ose thew.. ___. step of this mawr° should be taken pro forma, and that the disolim&u should be taken on bringing up the report on monday neat. 181811 tobacco. mr. blewitt g"
tobacco,1840,0,466,114,6.3681,True,"tobacco trade. mr. hume moved for a select committee, to exa- mine into the present state of the tobacco trade, and to inquire what effects have been produce..."
tobacco,1840,0,466,116,6.3878,True,"the glow chronicle, wednesday, may 19., 1847. scotland. att'eniiiife seizure of smogglid tobacco.— el' ith on friday a very extensive seizure of smuggled tobacco in leaf was made on board a llama- bur"
tobacco,1840,0,466,117,6.3885,True,"seizure of tobacco. weymouth, dec. 3.—lnformation having been re- ceived here some short time ago, from the officers con- nected with the custom-house at guernsey, that..."
tobacco,1840,0,466,118,6.3885,True,"general miscellany. earl howe has been appointed deputy, grand master of the engli h freemasons, under the earl of zetland. john toplis. tobacconist, of london, was, on tnursday last, fined £3oo for h"
tobacco,1840,0,466,119,6.3898,True,"tobacco trade. mr. hume moved for a select committee, to exit. mine into the present state of the tobacco trade, and to inquire what effects have been produc..."
tobacco,1840,0,466,124,6.4078,True,"tobacco trade. mr. hume moved for a select committee, to exa- mine into the present state of the tobacco trade, and to inquire what effects have been produce..."
tobacco,1840,0,466,125,6.4132,True,"affairs of portugal. lesnon, july b.—with regard to the project of loan which forms one of the conditions on which the tobacco contract is to be auctioned, it would be very unjust for capitalists to p"
tobacco,1840,0,466,127,6.4244,True,"on a late sabbath day the rev. mr. after the usual service of inane being over, commenced addressing his very no. morons flock on the use of tobacco and snuff, threatening them with ""no absolution in "
tobacco,1840,0,466,128,6.4252,True,"tobacco trade. mr. hume moved for a select committee, to exit. mine into the present state of the tobacco trade, and to inquire what effects have been produc..."
tobacco,1840,0,466,130,6.4337,True,"lon don monday g no. 16,916. deputations to government -- the smuggling, and that the enterprise of the contraband trader had beea transferred to tobacco. the effect of the reduction of the duty on sp"
tobacco,1840,0,466,135,6.4555,True,"sale of tobacco svuns y. jonas and others.—mr. martin and mr. tomlinson were for the plaintiff, and mr. watson and mr. hogging for the defendants. the plaintiff is a..."
tobacco,1840,0,466,136,6.4559,True,"customs' sales.—delivery of tobacco.--the board of customs having had under their consideratio a communication from the commissioners of excise' suggesting, with a view to the greater s..."
tobacco,1840,0,466,137,6.4562,True,"....• 5o half of each in 3 weeks, and the re- rnainderin 3 weeks 30 afterwards. hall in a fortnight, •••••••• in a fortnight after- wards. the cocoa and tobacco to he exempte"
tobacco,1840,0,466,138,6.4571,True,"literary and scamvtiric. in one of the ancient chimney-pieces in cawdor castle there is a rude carving in stone of a fox smoking a tobacco-pipe, with the date 1510. as it is generally be- lieved that "
tobacco,1840,0,466,140,6.4613,True,"miscellaneous. deleterious influence of the excessive use of tobacco.—by a member of congress from the west, in the meridian of life, and of a very stout frame, i was some time since consulted. he tol"
tobacco,1840,0,466,141,6.4629,True,"the transit sheds. mr. ripley sqiil he was told the whole of the transit sheds were- likely soon to be occupied with tobacco. par- ties placed their tobacco there without passing the scales, and there"
tobacco,1840,0,466,147,6.4783,True,"affairs of portugal. lesnon, july b.—with regard to the project of loan which forms one of the conditions on which the tobacco contract is to be auctioned, it would be very unjust for capitalists to p"
tobacco,1840,0,466,148,6.4829,True,"... james dudley, a man of colour, and late steward in the new york packet-ship independence, was brought up, charged with having smuggled a quantity of tobacco, found on board"
tobacco,1840,0,466,151,6.5014,True,"bow-s1 i?ee7'. a tobacconist, of the name of bush, residing in high hol- born, was charged with having blb. 4oz. of smuggled-goods (tobacco and cigars) in his possession. mr...."
tobacco,1840,0,466,155,6.5235,True,"...london, • monday 4. • • no. 16,916. deputations to government the smuggling, and that the enterprise of the contraband trader had been transferred to tobacco. the"
tobacco,1840,0,466,156,6.5246,True,"... da y evenning, court of excise-yesterday (swore the hon. captain percy, t. harrison, esq., and c. j. herries, esq.) extensive seizure of adulterated tobacco. george c"
tobacco,1840,0,466,158,6.5409,True,...d edition of the times of monday:— • • • the madrid gazette of the 9th contains three financial de- crees; the first sanctioning the rescision of the tobacco con
tobacco,1840,0,466,161,6.5463,True,"...iddling quality, all sold at 2a. 2d. to 2.. 4d. very little else dent, as the trade decline purchasing es long as they hold any, and a little of this tobacco is now made to g"
tobacco,1840,0,466,164,6.5515,True,"tobacco duties. dr. bowrlng,(7lntiiriari;fth;tlon. member for montrose, postponed the motion of which that hon. member had given notice on the subject of the..."
tobacco,1840,0,466,165,6.5604,True,"sae party are acquainted, h i elucidation of bin sufficient to re” i of the tobacco fiscal system lye. last year which, ifoiven by any impost -ity and ten- dear u• 36 gallons, that leonv on the pot. w"
tobacco,1840,0,466,169,6.5863,True,"affairs of portugal. 1415130 n, july b.—with regard to the project of loan which wins one of the conditions on which the tobacco contract is to be auctioned, it would be very unjust for capitalists to"
tobacco,1840,0,466,171,6.5925,True,"tobacco. an account of the separate amount, in pounds weight, of leaf tobacco, upon which duty has been paid in england, scotland, and ireland, during the ye..."
tobacco,1840,0,466,172,6.5935,True,"the transit sheds. mr. ripley sai i he was told the whole of the transit sheds were likely soon to lie occupied.with tobacco. par- ties placed their tobacco there without passing the scales, and there"
tobacco,1840,0,466,173,6.5992,True,"tobacco to snuff and ----- manufacturers. • to be disposed of, in consequence of the death of the pro- prietor, the lease, machinery, fixtures, &c., of an ol..."
tobacco,1840,0,466,174,6.6024,True,"tun tobacco trade. the nne-oriectu price current of 30th september safe our last left the tobacco market in a quiet state, as holders were contending for some ad..."
tobacco,1840,0,466,175,6.614,True,...d edition of the times of monday:— • • • the madrid gazette of the 9th contains three financial de- crees; the first sanctioning the rescision of the tobacco con
tobacco,1840,0,466,180,6.6384,True,"the transit sheds. mr. ripley sqiil he was told the whole of the transit sheds were- likely soon to be occupied with tobacco. par- ties placed their tobacco there without passing the scales, and there"
tobacco,1840,0,466,185,6.6609,True,"tobacco regulations bill. mr. t. i) un,;ombe presented a petition, signed by almost all the great manufacturers of tobacco in the port of london, against thi..."
tobacco,1840,0,466,186,6.6638,True,"zette, oct. 15. 14. the tobacco trade. from the morning chronicle.) the minuted of evidenoe and proceedings of a committee of the house of commons on the tobacco trade, after long d..."
tobacco,1840,0,466,187,6.6668,True,"tobacco duties. a deputation of the associated manufacturers of tobacco, accompanied by dr. bowring, m.p., mr. henry berkeley, m.p., mr. g. h. w. heneage, m...."
tobacco,1840,0,466,188,6.6821,True,"... da y evenning, court of excise-yesterday (swore the hon. captain percy, t. harrison, esq., and c. j. herries, esq.) extensive seizure of adulterated tobacco. george c"
tobacco,1840,0,466,192,6.7049,True,"nd a great portion of his time in a recumbent position, and it was oni of tobacco and opium, in large quantities, th the use he cou it was required of him to commence his sermon. he would then rise, a"
tobacco,1840,0,466,193,6.7074,True,"...son, a waterman, belonging to the lower custom-house-stairs was brought before mr. ballantine, on a charge of smuggling 41bs. of foreign manufactured tobacco. the case"
tobacco,1840,0,466,194,6.7079,True,"discharoxd •• enur monde eh of melton to ring a merry peal in honour of their in urise, a. croon ._ an extensive seizure of tobacco was made in belfast on -s.nocence.—glamford mercury. associations ha"
tobacco,1840,0,466,195,6.7125,True,"genuine old liivannaii cigars!!! a k. gifford, tobacconist, bc.c., 121, 3le holborn-bill, grateful for the patronage hitherto con- ferred on him, respectfully announces he has constantly on sale the f"
tobacco,1840,0,466,197,6.7352,True,"tobacco ditties. dr. bowring rose to call the attention of the house to a return, no. 295, moved for by mr. hume, and ordered to be printed on the 11th may l..."
tobacco,1840,0,466,199,6.7481,True,"...neous. ""the storm and the conflict"" is continued with spirit in the new number of the metropolitan. the editor has contributed a paper on ""cigars and tobacco,"" in which he bestows unmeasured c"
tobacco,1840,0,466,200,6.7547,True,"affairs of portugal. 1415130 n, july b.—with regard to the project of loan which wins one of the conditions on which the tobacco contract is to be auctioned, it would be very unjust for capitalists to"
tobacco,1840,0,466,201,6.764,True,"tobacco duties. dr. bowring, on the part of the hon. member for montrose, postponed the motion of which that hon. member had given notice on the subject of t..."
tobacco,1840,0,466,204,6.7757,True,"...neo us. ""the storm and the conflict"" is continued with spirit in the new number of the metropolitan. the editor has contributed a paper on cigars and tobacco,"" in which he bestows unmeasured "
tobacco,1840,0,466,205,6.7784,True,"tobacco duties. mr. hawes wished to direct the attention of the chancellor of the exchequer to a recommendation which had been made, and to an expectation wh..."
tobacco,1840,0,466,206,6.7807,True,frauds in the tobacco trade. (from the newcastle journal.) the disastrous state of our financial affairs so clearly dis- played iu the luminous speech.of the earl of ripon...
tobacco,1840,0,466,208,6.7873,True,"house of commons.—tuesdat dr. bowring made a long spe-ch on the state of the tobacco -duties, in the course of which he pointed out the fraud, immorality, and crime of which they were pro inc- tive. t"
tobacco,1840,0,466,209,6.7895,True,"affairs of portugal. lesnon, july b.—with regard to the project of loan which forms one of the conditions on which the tobacco contract is to be auctioned, it would be very unjust for capitalists to p"
tobacco,1840,0,466,215,6.8041,True,"tobacco duties. mr. hawes wished to direct the attention of the chancellor of the exchequer to a recommendation which had been made, and to an expectation wh..."
tobacco,1840,0,466,216,6.8077,True,"tun tobacco trade. the nne-oriectu price current of 30th september safe our last left the tobacco market in a quiet state, as holders were contending for some ad..."
tobacco,1840,0,466,218,6.8303,True,"tobacco duties. dr. bo wring presenied a petition from some of the most respectable tobacco dealers in the kingdom, which stated that it nas impossible to pr..."
tobacco,1840,0,466,220,6.845,True,"the transit sheds. mr. ripley sai i he was told the whole of the transit sheds were likely soon to lie occupied.with tobacco. par- ties placed their tobacco there without passing the scales, and there"
tobacco,1840,0,466,222,6.8587,True,"tobacco duties. dr. bowring rose to call the attention of the house to a return, no. 295, moved for by mr. hume, and ordered to be printed on the 11th may la..."
tobacco,1840,0,466,223,6.859,True,"... james dudley, a man of colour, and late steward in the new york packet-ship independence, was brought up, charged with having smuggled a quantity of tobacco, found on board"
tobacco,1840,0,466,224,6.874,True,"police intelligence. mansion-house. the lord mayor—where was the tobacco found? officer—ln his hat and stockings. the prisoner—l never had a bit of tobacco before, my lord, and i never thought there w"
tobacco,1840,0,466,226,6.8767,True,"affairs of portugal. lesnon, july b.—with regard to the project of loan which forms one of the conditions on which the tobacco contract is to be auctioned, it would be very unjust for capitalists to p"
tobacco,1840,0,466,227,6.8774,True,"on a late sabbath day the rev. mr. after the usual service of inane being over, commenced addressing his very no. morons flock on the use of tobacco and snuff, threatening them with ""no absolution in "
tobacco,1840,0,466,228,6.8783,True,frauds in the tobacco trade. (from the newcastle journal.)
tobacco,1840,0,466,229,6.8791,True,"zette, oct. 15. 14. the tobacco trade. from the morning chronicle.) the minuted of evidenoe and proceedings of a committee of the house of commons on the tobacco trade, after long d..."
tobacco,1840,0,466,231,6.8946,True,"tobacco to snuff and ----- manufacturers. • to be disposed of, in consequence of the death of the pro- prietor, the lease, machinery, fixtures, &c., of an ol..."
tobacco,1840,0,466,233,6.9098,True,"contracts for cocoa, soap, and tobacco. department of the comptroller for victuallifig and transport lierrices, somerset-plae,e, may 4, 1848. the commissioners for executing the office of ..."
tobacco,1840,0,466,234,6.9257,True,"of each of us is really so trifling that almost the indigo.—we have no improvement to notice in th 3 ts wl3 s',ata i tleat the duty on the tobacco was poorest amongst us can double, treble, or quadrup"
tobacco,1840,0,466,249,6.9907,True,"miscellaneous. the cost of a hogshead of tobacco of 1,200 lbs. varies from £l4 to mb, while the duty alone is .2180. it is stated that an invention is about being carried into opera- tion to make bo..."
tobacco,1840,0,466,251,6.9939,True,"friday. on friday next, the 2(.1 june, at the brokers' office, 6, north john-street, about 100 hhds. virginia & kentucky leaf & stemmed tobacco 75 wiles cuba leaf tobacco, 1 case cigars, 1 case cheroo"
tobacco,1840,0,466,262,7.0532,True,"house of commons.—tuesdat dr. bowring made a long spe-ch on the state of the tobacco -duties, in the course of which he pointed out the fraud, immorality, and crime of which they were pro inc- tive. t"
tobacco,1840,0,466,268,7.1034,True,"on a late sabbath day the rev. mr. after the usual service of inane being over, commenced addressing his very no. morons flock on the use of tobacco and snuff, threatening them with ""no absolution in "
tobacco,1840,0,466,270,7.1204,True,"... da y evenning, court of excise-yesterday (swore the hon. captain percy, t. harrison, esq., and c. j. herries, esq.) extensive seizure of adulterated tobacco. george c"
tobacco,1840,0,466,272,7.1318,True,"... smith. sir f: burdett gave notice of a motion for this day week to address her majesty, to erect a mo- nument to the memory of sir sydney smith. the tobacco bill. the chancellor"
tobacco,1840,0,466,274,7.1375,True,"tobacco. mr. hume moved that the following gentlemen form the select committee on. tobacco :—mr. hume, the chancellor of the exchequer; mr. parker, mr.: vill..."
tobacco,1840,0,466,277,7.1583,True,"tobacco duties. dr. bowrlng,(7lntiiriari;fth;tlon. member for montrose, postponed the motion of which that hon. member had given notice on the subject of the..."
tobacco,1840,0,466,284,7.2003,True,"tobacco regulations bill. mr. t. i) un,;ombe presented a petition, signed by almost all the great manufacturers of tobacco in the port of london, against thi..."
tobacco,1840,0,466,285,7.2028,True,"...on friday next, he should move for the appointment of a select committee to inquire into and report upon certain railway bills now before parliament. tobacco duties. dr."
