word,decade,cluster,cluster_size,rank_in_cluster,distance_to_centroid,target_word_visible,snippet
cocoa,1870,1,957,548,4.6018,True,"lilviews cocoa sail iu, + n‘...,,.2.. i= ..••••••11k tb.. iliwazdim venzirs issuccg a cocoa sold •••11511/d 113..1. as o__ t_ ma* ma lama hers chocolat tohdit, plam..."
cocoa,1870,1,957,549,4.6038,True,"maravilla cocoa. the ...ereectiox of prepared cocoa. maravilla cocoa.---80-le-p-1170-p-rre-torb,-- taylor bros., london., the cocoa (or cacao) of maravilla is the tr..."
cocoa,1870,1,957,553,4.6109,True,"epps's cocoa.—"" naval and military gazette"" says :—""the nutritive qualities of cocoa over either those of tea or coffee are now so generally acknowledged that the..."
cocoa,1870,1,957,555,4.6149,True,"agency. tul nutritious cocoa food for 110ities awl carrle, acknowletlzed by all c,..newnere j, be nut ouly the beit but use wo.t teen wiled ever 'wt. ant 4 watical. those irtving..."
cocoa,1870,1,957,556,4.6156,True,"----__._....,,,......•-•••----• perties of well-selected cocoa breaxfast.—epps's cocoa.--geateful and con. owledge of the natural forting.—"" by a thorough kn ations of digestion and laws which govern "
cocoa,1870,1,957,563,4.6228,True,"...kie cocos, is id per lb illaravida owes% bratbaw, is id per lb dm heath obeeelalle, la ph 1. 11.1 per lb trm ided omon nate remted, 11111 mr trinidad cocoa pim i. "
cocoa,1870,1,957,564,4.6284,True,"maiatilla cocoa —hola-1,-ropristoria a rog i 0)(1000. toe cocoa ca cacao) cl liaravilla i. tbaohrama al lhomm. cocoa is ladir .4) south of al ar itowills imorvaared ..."
cocoa,1870,1,957,565,4.6296,True,"a visit to epps's cocoa mancrfactort.—through the kindness of messrs epps, i recently had an oppsui- tunity of seeing the many complicated and varied pro- cesses the cacao b..."
cocoa,1870,1,957,566,4.631,True,... of a kind not' evidence upon • systems. cm tion-showea vent for some the _ depending -.uot admitted by their _ medical profession are now ordains es cocoa essenc
cocoa,1870,1,957,576,4.6374,True,lf skier's cocoa sold in and lb. packets and in lib. tins. awarded medal at the vienna exhibition. beware of imitations. observe trade marks and real name.
cocoa,1870,1,957,579,4.6407,True,"yours truly, a lover of ri6ht. december 29th, 1876. thousands are unable to take cocoa beelot, the 'curb:ties commonly sold are mixed with stark. tinder the plea of rendering them while really making "
cocoa,1870,1,957,584,4.644,True,"epps's cocoa.—"" civilian"" says ""is the 17th century, before either tea or coffee had found their way into the english markets, chocolate was a favourite beve- rag..."
cocoa,1870,1,957,588,4.6467,True,"epps's 0000 a.—"" naval and military gazette"" says :—"" the nutritive qualities of cocoa over either those of tea or coffee are now so generally acknowledged that the steady increase shewn by official s"
cocoa,1870,1,957,589,4.6516,True,"maravilla cocoa, no reßnterlon 0 i prepared cocoa. maravi ll a coco a. sole proprietors, ta viam. rhos., london. the cocoa (or cacath of kiaravilla is the true thoub..."
cocoa,1870,1,957,592,4.6628,True,"maiatilla cocoa —hola-1,-ropristoria a rog i 0)(1000. toe cocoa ca cacao) cl liaravilla i. tbaohrama al lhomm. cocoa is ladir .4) south of al ar itowills imorvaared ..."
cocoa,1870,1,957,595,4.6668,True,pure soluble cocoa. vanhoijten's cocoa has- been introduced for some years as the only gyaranteed pure b‘doble cocoa. and by all who are now acquainted uith it it is ap...
cocoa,1870,1,957,596,4.6744,True,"the amateu}'s guide to howeopathic treatment—ooix 9d. hoireopathic cocoa is the best shilling.cocoa.spiti,_ _ tirrelus taraxacijm cocoa ill th,, b,:st cocoa for invalids, and a luxury for those in hea"
cocoa,1870,1,957,602,4.6837,True,"cocoa and coke. you people, probably, s• they gip their cup of coco.. or chocolate at home, or in 01110 • coffee nod cocoa taverne ""—the modern revivals of..."
cocoa,1870,1,957,605,4.6893,True,"no. 189, new series. ri irrell's homceopathic cocoa, is. per pound is monetumed by competent judges [to be the best i. cocoa sold in the potteries tir ll's tara xacum cocoa, is. ed. per pound is the b"
cocoa,1870,1,957,606,4.6907,True,"iiordieopathy. —tice—iiiiiroit's guide to homceopathic treatment—oniy 61 tirrell's homeopathic cocoa is the best shilling cocoa sold. cocoa is the best cocoa for invalids, and & luxury for those in he"
cocoa,1870,1,957,611,4.7086,True,"nontaiman's sweated pure cocoa 006coiatine. maiivauban% • reenomied 080004a1'1141. moarrowt"" try s sixpenny tin. ciitooolatini mont4vss4pb s.elute yolk v. -4311000tatine."
cocoa,1870,1,957,614,4.7144,True,"avillia cocoa. th perpect/on of prepared cocoa. jaaravilla cocoa.--sole proprietors, vt.cip rros,„ lannox the cocoa (or cacao) of maravilla is the true theoliroma ..."
cocoa,1870,1,957,615,4.7161,True,"trade bills discounted. john athirton. manager. ailbanilla. crocanoa for breax- the oloba bays— taylor baqtbirs. biaravilla cocoa lae achieved • thorough end super,edes (grimy other coool in din marke"
cocoa,1870,1,957,616,4.7186,True,"homteopathy, the amateur's guide to homeopathic treatment—oniy 6d. tirrell's homeopathic cocoa is the bebt shilling cocoa sold. tirrell's taraxacum cocoa is the best cocoa for invalids, and a luxury f"
cocoa,1870,1,957,619,4.7283,True,"‘1 alt a villa' coc a 0--. the perybction of prepared- cocoa. ti aravilla cocoa. for breakfast ltj- thet//obesays:—""tayloß brothers maravilla cocoa has achieved a thorough success, and supersedes ever"
cocoa,1870,1,957,621,4.7388,True,"40/' troops grim* defenedve of 1 fiom should be war, application iir 1•;ndon. us cocoa —.. flppi has provided pw=:.; _ a delicately flavoured bevenwre which may save. us many heavy doctors' bilis. h i"
cocoa,1870,1,957,622,4.7459,True,"cocoa ne perfection of preparcd cocoa mailavilla cocoa.-bede proprleterstaywß, london. ne coca (er caen)°, marseille le the tree ',tette nine 0 orb.. l•lnd..."
cocoa,1870,1,957,628,4.7571,True,"i'he cocoa cai e food com- .o- pant's nutrition cocoa real, for horses. cows, pi.., sheep, dogs, fowls, ke. 1,000 feedi.for 34. 500 feeds for 17s 250 (cods kr s..."
cocoa,1870,1,957,629,4.7573,True,"england at work. the cocoa tree: the ma.nufacture of cocoa and chocolate. fr um hand and heart, december 15th, 1876. we propose to do our best to furnish information to our rea..."
cocoa,1870,1,957,633,4.7688,True,"coooa as an economical food for cattle and horses. the morning advertiser, quoting from bell's life, ;tyly 4th, says: ""the nutritious cocoa ex- tract is the finest and cheapest cattle food in the mark"
cocoa,1870,1,957,635,4.7755,True,"england at work. the cocoa tree: the manufacture of cocoa and chocolate. from hanel awl heart, december 1518, 1876. 'we propose to do our best to tarnish information to our rea..."
cocoa,1870,1,957,636,4.7813,True,"p rl r rell's hom ceo patric cocoa, is. per pound is pronouoced by competeut judges 10 be the best is. cocoa sold in the potteries tie re ll's taraxacu:ni cocoa, is. 6d. per polind lit..."
cocoa,1870,1,957,637,4.7861,True,...d in i and peokets and in db. tine. awarded medal at the vienna ex ribition. bewared izaitationa. ober re trivia marks and real name. mums essence of cocoa sol
cocoa,1870,1,957,638,4.7867,True,england at work. the cocoa tree: the manufacture of cocoa and
cocoa,1870,1,957,640,4.7905,True,"p rl r rell's hom ceo patric cocoa, is. per pound is pronouoced by competeut judges 10 be the best is. cocoa sold in the potteries tie re ll's taraxacu:ni cocoa, is. 6d. per polind lit..."
cocoa,1870,1,957,645,4.8041,True,"marayilla cocoa. the rpßrecrion 0000, mabayilu cocoa—rolm proprirtori, taylor pros. lonnon. tm. cocoa (or cacao) of masavilla i. the true tbobrowe of la .v. know le ..."
cocoa,1870,1,957,648,4.8088,True,"p rl r rell's hom ceo patric cocoa, is. per pound is pronouoced by competeut judges 10 be the best is. cocoa sold in the potteries tie re ll's taraxacu:ni cocoa, is. 6d. per polind lit..."
cocoa,1870,1,957,651,4.8245,True,"ri iiire l l's hom geop a thic cocoa. is. per pound is pronounced by conspeteut iudgm to be the rest is. cocoa sold in the potteries. tir re ll's tarax'acum cocoa, 15. id. per pound ls t..."
cocoa,1870,1,957,652,4.8275,True,"• maravilla cocoa. its perycction ot piikpaimd cocoa. )1"" -lila ,illi a:cos.-80le proprietors, taylor blob lonnie. ere cocoa (or cacao) of liaravilla rid, trim bleobmm..."
cocoa,1870,1,957,656,4.8508,True,"england at work. the cocoa tree: the manufacture of cocoa and chocolate. from hanel awl heart, december 1518, 1876. 'we propose to do our best to tarnish information to our rea..."
cocoa,1870,1,957,661,4.87,True,"maravilla 0000 a. the pgarsanor a primo 0000 a. maravilla 0000a.--solc propristors, taylor bros. london. tel cocoa (ea cacao) of nar.avilla d the tame nacho:ma of lkinatta coosa la indigenous to south"
cocoa,1870,1,957,663,4.8717,True,"• maravilla cocoa. its perycction ot piikpaimd cocoa. )1"" -lila ,illi a:cos.-80le proprietors, taylor blob lonnie. ere cocoa (or cacao) of liaravilla rid, trim bleobmm..."
cocoa,1870,1,957,666,4.8869,True,"i 1 n[aiavilla cocoa. co.rrßrecnox of pritartj) cocoa. niaiutilla cocoa -410 lt protristors, taylor rico, 10,1,011. tb! cocoa (no cacao) el maratilla i. the ino thoobreae..."
cocoa,1870,1,957,668,4.8981,True,"-ii- tl.ousande are nrcibla to take cocoa because the wari oct colamouly sold are mixed with starch. under the plea of rendering them cot chic while really making them hersey, and indigestibl..."
cocoa,1870,1,957,669,4.8985,True,"cocoa and coke. you people, probably, s• they gip their cup of coco.. or chocolate at home, or in 01110 • coffee nod cocoa taverne ""—the modern revivals of..."
cocoa,1870,1,957,671,4.8993,True,"homteopathy, the amateur's guide to homeopathic treatment—oniy 6d. tirrell's homeopathic cocoa is the bebt shilling cocoa sold. tirrell's taraxacum cocoa is the best cocoa for invalids, and a luxury f"
cocoa,1870,1,957,672,4.9019,True,"casse. !.i1111)_ wiaravilla. cocoa. the perfection of pret cocoa 1‘.1741/11gla cocoa.—sotz proprietors, taylor bros., london. the cocoa. (or cacao) of maravilla is the trim theobronsa ..."
cocoa,1870,1,957,673,4.9031,True,"tibrell's- is the best shilling cocoa sold,—a trial prove its superiority over all others at the same price. save 30 per cent by acing the london lion tea company's extraordinary 2s. tea...."
cocoa,1870,1,957,678,4.9202,True,"raix„ [registered for abroad. one penny. beware or 001./ ffffff it. lea ..1 perrins, illea&vii.la cocoa th. pmumeen. et yliii,hip.9l3•l9/6. -i\i7cia-t-viegniwifa--- no.- • 1,110.1.:01.4."" tem cocoa or"
cocoa,1870,1,957,680,4.9349,True,"i reman, sir, • yours truly, thomas hu st thousands are unable to take cocoa because tl.e varieties commonly sold are mixed with starch, unler the plea of rendering them soluble while really malty; th"
cocoa,1870,1,957,683,4.9403,True,"bilhak.ii2i't.- cocoa. -i.iii,aiefiil. aim com- forting.—"" by a thorough knowledge a the nattin 1 laws whieh govern tle operations of digestion and nutrition, and by a car..."
cocoa,1870,1,957,684,4.9416,True,"england .at work. the cocoa tree: the manufacture of cocoa and chocolate. from hand and heart, december 15th, 187 g. we propose to do our beet to furnish informed ion to our rea..."
cocoa,1870,1,957,686,4.9481,True,"agency. -- • tmile nutritious cocoa food for rouses anti cattle aeksowledged by an summers t, be zi,t mly ito beef but the most ecouonde.al ever old. ag..nts wanted. thom having facilit..."
cocoa,1870,1,957,687,4.9538,True,"england .at work. the cocoa tree: the manufacture of cocoa and chocolate. from hand and heart, december 15th, 187 g. we propose to do our beet to furnish informed ion to our rea..."
cocoa,1870,1,957,688,4.9583,True,"...5th, 2575.—mr. fisher dear sir—l feel it a very great duty as well es pleasnre to bear testimony to the very great, efficiency 01 7010' bhaca vuesane cocoa emma abo"
cocoa,1870,1,957,689,4.9598,True,i li tt i r ni --.-- i i on: i i south durham and clevel menier's cocoa sold in and lb. packets and 11b. tins. awarded medal at the vienna exhibition. beware of imitations. i observe trade marks and r
cocoa,1870,1,957,694,4.9672,True,"maravilla cocoa. the paleatloo el pnwed coma. wraimia 0000a.-11ele preptlelorntatlos,ll4o;t, the cocoa (or new) of 11.,ravilla in the true meares. of • ••• • • ""trit..."
cocoa,1870,1,957,697,4.9713,True,"...stablished 1847.] vol. 25.—n0. 1567. ohocolat men ler breakfast. •j /mm., nv, iv,. c-100.,lat men ler luncheo3. 011••••1,... llla ma moal ai ilkierid cocoa &ulla and 1111. path- ina ...ed a"
cocoa,1870,1,957,699,4.9892,True,"maravilla cooda. lb* perfection ol pisparel cocoa. maravilla cocol—flole ',0ra1..., taylor, bra is., london. the cocoa for nese) of manville, the true theolwoms of monroe. cora indigetwou to ,uth anl..."
cocoa,1870,1,957,700,4.9902,True,"england at work. the cocoa tree: the ma.nufacture of cocoa and chocolate. fr um hand and heart, december 15th, 1876. we propose to do our best to furnish information to our rea..."
cocoa,1870,1,957,701,4.9984,True,"i 1 n[aiavilla cocoa. co.rrßrecnox of pritartj) cocoa. niaiutilla cocoa -410 lt protristors, taylor rico, 10,1,011. tb! cocoa (no cacao) el maratilla i. the ino thoobreae..."
cocoa,1870,1,957,703,5.0053,True,"mee cocoa cattle 1,0101.1 company's nutrition cocoa neal, for ii one.. con. pigs. ilben. dont, route. ile. moo mon for so 500 folds for 17.; iso inds toe 0.61...."
cocoa,1870,1,957,709,5.0279,True,"cocoa and coke. you people, probably, s• they gip their cup of coco.. or chocolate at home, or in 01110 • coffee nod cocoa taverne ""—the modern revivals of..."
cocoa,1870,1,957,720,5.0599,True,"0 liverpool cocoa-rooms. defence. an attack and at the social science congress, on thurston, mr. borsht lockhart read a paper on rooms: their bocial and topral influen..."
cocoa,1870,1,957,721,5.0647,True,"iiordieopathy. —tice—iiiiiroit's guide to homceopathic treatment—oniy 61 tirrell's homeopathic cocoa is the best shilling cocoa sold. cocoa is the best cocoa for invalids, and & luxury for those in he"
cocoa,1870,1,957,725,5.0753,True,"the cocoa movement at seatbe. fine commodious coco tea, and coffee rooms were opened thursd near seacombe ferry, on the road from seacombe to birkenhead, by mr..."
cocoa,1870,1,957,730,5.0845,True,"am and north york review. delivered is. id. per quarter in advance. unstamped is. 3d. „ „ credit. one penny. cocoa as an economical food for cattle and horses. the morning advertiser, quoting from bel"
cocoa,1870,1,957,731,5.0903,True,"oblereres;m*.ii;ol.''""""zz''''.ol nam. knows cocoa &li is i red ilbi.k awarded imdal lbw 4.icnixics 128encil et cocoa rai ip mit 11.41 b. aimilymid. _"
cocoa,1870,1,957,733,5.1105,True,"...stablished 1847.] vol. 25.—n0. 1567. ohocolat men ler breakfast. •j /mm., nv, iv,. c-100.,lat men ler luncheo3. 011••••1,... llla ma moal ai ilkierid cocoa &ulla and 1111. path- ina ...ed a"
cocoa,1870,1,957,734,5.1106,True,"oblereres;m*.ii;ol.''""""zz''''.ol nam. knows cocoa &li is i red ilbi.k awarded imdal lbw 4.icnixics 128encil et cocoa rai ip mit 11.41 b. aimilymid. _"
cocoa,1870,1,957,738,5.1167,True,"-oclcol=sai taylor bros., london. thz cocoa for cacao) of lif aravilla is the tram theoblerna of liutsfeles. taylor wicrinicas boring wand tho exelissirs *apply of this omni% a my', rovoa, ham ..."
cocoa,1870,1,957,739,5.1205,True,"iiordieopathy. —tice—iiiiiroit's guide to homceopathic treatment—oniy 61 tirrell's homeopathic cocoa is the best shilling cocoa sold. cocoa is the best cocoa for invalids, and & luxury for those in he"
cocoa,1870,1,957,742,5.1243,True,"opening of cocoa rooms at darlington. on satordae afternoon mr backhouse; m.p., attended at the new cocoa rooms at dariington, opened by mr lockhart, who has similar ..."
cocoa,1870,1,957,743,5.1262,True,"the cocoa movement at seatbe. fine commodious coco tea, and coffee rooms were opened thursd near seacombe ferry, on the road from seacombe to birkenhead, by mr..."
cocoa,1870,1,957,744,5.1357,True,"coooa as an economical food for cattle and horses. the morning advertiser, quoting from bell's life, ;tyly 4th, says: ""the nutritious cocoa ex- tract is the finest and cheapest cattle food in the mark"
cocoa,1870,1,957,752,5.1765,True,"the cocoa movement at seatbe. fine commodious coco tea, and coffee rooms were opened thursd near seacombe ferry, on the road from seacombe to birkenhead, by mr..."
cocoa,1870,1,957,756,5.1915,True,"hireavilts 0000 a. ilte prarsorios 0000 a. 0000,slz ramnitrou, tat wi tilt 111l0fl winos cocoa (oe cacao) of mara villa la the tree lbeebroree laroeur. coma la ...rep... to &las *merles whirth klestri"
cocoa,1870,1,957,759,5.2066,True,"epps's cocoa.—""aii the year round"" says :----ilaviti 4 now disposed .4 iancy let us stroll to holland-street, inackiri.n., to cocoa manufactory, where inay be stu..."
cocoa,1870,1,957,762,5.2233,True,"opening of cocoa rooms at darlington. on saturday afternoon mr boathouse, m.p. attended at the new cocoa rooms at darlington, opened by mr lockhart, who has similar e..."
cocoa,1870,1,957,768,5.2886,True,"cocoa and coke. you people, probably, s• they gip their cup of coco.. or chocolate at home, or in 01110 • coffee nod cocoa taverne ""—the modern revivals of..."
cocoa,1870,1,957,770,5.2972,True,"england at work. the cocoa tree: the manufacture of cocoa and chocolate. from hanel awl heart, december 1518, 1876. 'we propose to do our best to tarnish information to our rea..."
cocoa,1870,1,957,772,5.3171,True,"breakfast.— epps's cocoa. -- grateful and fortino:-:-."" by a thorough knowledge of the natural laws which govern ti e operations of digestion and nutrition, and by a careful ..."
cocoa,1870,1,957,774,5.3315,True,"...,/ imailind mum.. er itmnicil zmimizsion • t merii:11 for lcinchion. wm=3. [dal et. 'sou cililarll= •••••••• 1.1•••••• ma- ft. 111.0 amol illoa mime_ cocoa p. pock ani"
cocoa,1870,1,957,775,5.332,True,"nea tn. open da il y. that mat. !att., zs cocoa co:d. and ilaooto bath, 6d. on. ami"
cocoa,1870,1,957,776,5.3338,True,"maravilla cocoa, no reßnterlon 0 i prepared cocoa. maravi ll a coco a. sole proprietors, ta viam. rhos., london. the cocoa (or cacath of kiaravilla is the true thoub..."
cocoa,1870,1,957,778,5.3464,True,"the amateu}'s guide to howeopathic treatment—ooix 9d. hoireopathic cocoa is the best shilling.cocoa.spiti,_ _ tirrelus taraxacijm cocoa ill th,, b,:st cocoa for invalids, and a luxury for those in hea"
cocoa,1870,1,957,779,5.3469,True,"...day, march 1, 1874. • two butchers were fined £2o and £5 respectively at sheffield, on monday, for sending diseased mea to the market. manufacture of cocoa "
cocoa,1870,1,957,781,5.349,True,"england at work. the cocoa tree: the ma.nufacture of cocoa and chocolate. fr um hand and heart, december 15th, 1876. we propose to do our best to furnish information to our rea..."
cocoa,1870,1,957,782,5.3535,True,"england .at work. the cocoa tree: the manufacture of cocoa and chocolate. from hand and heart, december 15th, 187 g. we propose to do our beet to furnish informed ion to our rea..."
cocoa,1870,1,957,783,5.3537,True,"opening of cocoa rooms at darlington. on saturday afternoon mr boathouse, m.p. attended at the new cocoa rooms at darlington, opened by mr lockhart, who has similar e..."
cocoa,1870,1,957,788,5.3653,True,"opening of cocoa rooms at darlington. on satordae afternoon mr backhouse; m.p., attended at the new cocoa rooms at dariington, opened by mr lockhart, who has similar ..."
cocoa,1870,1,957,789,5.3739,True,"opening of cocoa rooms at darlington. on saturday afternoon mr boathouse, m.p. attended at the new cocoa rooms at darlington, opened by mr lockhart, who has similar e..."
cocoa,1870,1,957,790,5.3813,True,"maiatilla cocoa —hola-1,-ropristoria a rog i 0)(1000. toe cocoa ca cacao) cl liaravilla i. tbaohrama al lhomm. cocoa is ladir .4) south of al ar itowills imorvaared ..."
cocoa,1870,1,957,791,5.3829,True,"v. kaiuvilla 0000 a. primction of r1{721010 colva. maravilla cocot.—sole protrirtors, taylor bros. london. the cocoa (or cacao) t.i 11ainvilla la the on thenbroma of idiom°, c... iv intligenoto to sou"
cocoa,1870,1,957,793,5.3852,True,"mr. chamberlain and the gothenburg system. -...----- -- .- -.-----. 1 epps's cocoa.—some time since, in a scr,es of articles _ times says—u the gothenburg system, or in these coinmensofuntiloengfool w"
cocoa,1870,1,957,795,5.3898,True,"i'he cocoa cai e food com- .o- pant's nutrition cocoa real, for horses. cows, pi.., sheep, dogs, fowls, ke. 1,000 feedi.for 34. 500 feeds for 17s 250 (cods kr s..."
cocoa,1870,1,957,801,5.4227,True,"opening of the barrow cocoa and coffee house. _ _ on tuescfay, at noon, the cocoa and coffee- house which has been erected in dalton-road, near the king's arms hotel, was inaugu..."
cocoa,1870,1,957,802,5.4369,True,"opening of cocoa rooms at darlington. on satordae afternoon mr backhouse; m.p., attended at the new cocoa rooms at dariington, opened by mr lockhart, who has similar ..."
cocoa,1870,1,957,803,5.4385,True,england at work. the cocoa tree: the manufacture of cocoa and
cocoa,1870,1,957,808,5.4674,True,"the ny cocoa ur. clatk.k unnager of tits c ,s ttinho. k, ptool for el, .1 moo to keep open the 00004 it..mws 11.1 i tutu tielufk chrittate•lovroo,k, kikk iv e“tod..."
cocoa,1870,1,957,809,5.4797,True,lecture by mr. penderel brodhurst. cocoa as a sitbstittjte for beer. it is quite clear that one of the foremost public questions in the near future will be that of tem- perance. to whatever ...
cocoa,1870,1,957,810,5.4906,True,"maravilla cocoa. the ...ereectiox of prepared cocoa. maravilla cocoa.---80-le-p-1170-p-rre-torb,-- taylor bros., london., the cocoa (or cacao) of maravilla is the tr..."
cocoa,1870,1,957,818,5.5248,True,"opening of the barrow cocoa and coffee house. _ _ on tuescfay, at noon, the cocoa and coffee- house which has been erected in dalton-road, near the king's arms hotel, was inaugu..."
cocoa,1870,1,957,820,5.5448,True,"i, 1. montauban's uuaranteed pure cocoa chocolatine. montauban's economical chocolatine. montauban's try & sixpenny tin. chocolatine. montauban's see that you get it. chocolatine. cheap jew..."
cocoa,1870,1,957,822,5.5495,True,"...6d, 7d 5' tinned milk teas of the finest quality, well blended, is ls 6d, in bd, 2s, 23 63, 2. bd, 3s, 3s 4d coffee .................is, is 4d eppa'e cocoa 15 li reekitt's starch 4c"
cocoa,1870,1,957,823,5.5518,True,"opening of cocoa rooms at darlington. on satordae afternoon mr backhouse; m.p., attended at the new cocoa rooms at dariington, opened by mr lockhart, who has similar ..."
cocoa,1870,1,957,824,5.5668,True,"once um always used. the 0000 a oonddient poe horses and cattle. [nein highly nutritious food is s prows- .l lion from the cocoa bun, blooded with beelth giving suds, lierbe and roan'. known to pours "
cocoa,1870,1,957,829,5.5932,True,"(to be continued.) thousands are unable to take cocoa because the varieties commonly sold are mixed with starch, under the plea of rendering them soluble whit really making them thick, heavy, and indi"
cocoa,1870,1,957,831,5.6008,True,moment- bob 1171:ds awl l. nome ohocolat xxxi= rm. lunchbon. =dal aol t vienns eziiibi22ix. maw tat zak a r...a m [meco cocoa s.4d awl ilbi= a.m. 0. .••••1111. &fgt.!. brnzur ld s insenc 6 of c. >coa 
cocoa,1870,1,957,833,5.6049,True,"maravilla 0000 a. the pgarsanor a primo 0000 a. maravilla 0000a.--solc propristors, taylor bros. london. tel cocoa (ea cacao) of nar.avilla d the tame nacho:ma of lkinatta coosa la indigenous to south"
cocoa,1870,1,957,837,5.6284,True,"agency. tul nutritious cocoa food for 110ities awl carrle, acknowletlzed by all c,..newnere j, be nut ouly the beit but use wo.t teen wiled ever 'wt. ant 4 watical. those irtving..."
cocoa,1870,1,957,838,5.6305,True,"opening of cocoa rooms at darlington. on saturday afternoon mr boathouse, m.p. attended at the new cocoa rooms at darlington, opened by mr lockhart, who has similar e..."
cocoa,1870,1,957,841,5.6608,True,"...,/ imailind mum.. er itmnicil zmimizsion • t merii:11 for lcinchion. wm=3. [dal et. 'sou cililarll= •••••••• 1.1•••••• ma- ft. 111.0 amol illoa mime_ cocoa p. pock ani"
cocoa,1870,1,957,842,5.6672,True,"nrtritioi ti:rners i.iom(eoiathic cocoa ir. 11 -n. 1. 1. ci 1 lassa, luvrel. ltzt: de. hall sir philip is the xy1)1:4: j 3;"
cocoa,1870,1,957,844,5.684,True,"agency. -- • tmile nutritious cocoa food for rouses anti cattle aeksowledged by an summers t, be zi,t mly ito beef but the most ecouonde.al ever old. ag..nts wanted. thom having facilit..."
cocoa,1870,1,957,854,5.7627,True,"opening of the barrow cocoa and coffee house. _ _ on tuescfay, at noon, the cocoa and coffee- house which has been erected in dalton-road, near the king's arms hotel, was inaugu..."
cocoa,1870,1,957,857,5.8103,True,"opening of the barrow cocoa and coffee house. _ _ on tuescfay, at noon, the cocoa and coffee- house which has been erected in dalton-road, near the king's arms hotel, was inaugu..."
cocoa,1870,1,957,858,5.8147,True,"opening of cocoa boom at widnes. on wodossiley night a public meeting, to cob brat. the establiehment nod openieg of coca tuom. uhr whin., woe held to ths v amities 1..."
cocoa,1870,1,957,859,5.8267,True,"opening of the barrow cocoa and coffee house. _ _ on tuescfay, at noon, the cocoa and coffee- house which has been erected in dalton-road, near the king's arms hotel, was inaugu..."
cocoa,1870,1,957,860,5.8283,True,"tee cocoa nvt mat mailers. the assistance of all friends of working men are solicited on behalf of 300 men and boys out of work at messrs. kona and sons, cocoa..."
