word,decade,cluster,cluster_size,rank_in_cluster,distance_to_centroid,target_word_visible,snippet
cocoa,1910,0,406,1,3.9981,True,"welco for christmas save the the best drink john rothwell, the cocoa factory, golborne, lancs. is 41.°1 1 2 per 4lb. tin coupons. 7 •"
cocoa,1910,0,406,2,4.138,True,"eoeopt 9d. per -4-ib. pkt. john 1101 lwell, the cocoa factory, always 'tisk for- colborne, lancaehire. save the coupons for welco free gift • .r:..""611.1114a44,:-y.z""ait •-• • • • ^ • ,•. • • '' atti4"
cocoa,1910,0,406,3,4.1661,True,"-11 ti 1, to drink. john rothwell, the cocoa factory, golborne, lancs. :k the best drink you can best welcome your friends or speed the parting guest, giving them a nice hot cup by of • •. • • •..."
cocoa,1910,0,406,5,4.2042,True,"pure eeeott 9d. per -4-ib. pkt. john bothwell, the cocoa factory always risk for golborne, lancashire save the coupons for welco free gift .. -. ..... ""liimiieiiiiiiiiiiiii i i -- 1 i.. :. -• ~ ~ -. i"
cocoa,1910,0,406,6,4.2701,True,"the matron whose duties seem never to end, find welco cocoa an excellent friend. will 9, d. pei ilb. pkt, john rothwt it, the cocoa factory, go!borne, lancashire _,.<4,- _ 1......:7,1aw "";,--. :‘,''' "
cocoa,1910,0,406,7,4.2943,True,"huns. save sviiie coupons. • 61d. per j4lb. john rothwell, the cocoa factory, colborne, lancs."
cocoa,1910,0,406,8,4.2996,True,"84. d. john rothwell, the cocoa factory, colborne, lancashire."
cocoa,1910,0,406,10,4.3469,True,"6 111 'il t per4ivu you can best welcome your friends or speed the parting guest, by giving them a nice hot cup of to drink. john rothwell, the cocoa factory, colborne, lance. • • • • •:.. = • is • • "
cocoa,1910,0,406,11,4.3697,True,"pure co 9d. per *1 welco cocoa gives the glow that makes our girls admired s jonn rotemell, the cocoa factory, golborne, lance"
cocoa,1910,0,406,12,4.3967,True,"coc ;:', •:i: leaves is in yo childr happ fac 4•' tb,2 ilk 4. per 410. on. john rothwell. the cocoa factory, go'borne, lan- a traces n's -1.. ''''.' -: -.' • '.'• • ~ t • ..."": _ -,. ...' ~.i'. ', 4,."
cocoa,1910,0,406,13,4.4071,True,"british p c•c 4a always ask for cheapest and best. 7d. per lb. tin. save the coupons. john rothwell the cocoa factory, golborne, lanes, .-. • • 1 -111m1:7-::•-*i-vi:ip:w414-*sesig,4•:::,.,,i)2:i•n,:tr"
cocoa,1910,0,406,15,4.437,True,"we 4 'mf cocoa brings comfort and contentment at the fireside. john rothwell, the cocoa factory, golborne, lancs. iliamoidl"
cocoa,1910,0,406,17,4.4762,True,"british pure cocoa always ask for cheapest and best. 7d. per -4; lb. tin. save the coupons. john pothwell the cocoa factory. colborne. lanes .. • 4 • ,/ .' .. i • ,•, ...."
cocoa,1910,0,406,19,4.4828,True,"elt 4 cocoa efmgs cgmfort and contentment at the fireside. save the coupons. 6a. per db. tin. john rothwell, the cocoa factory, go'borne, lancs. 3 ......_.........."
cocoa,1910,0,406,20,4.521,True,"... the coupons. a dainty box bothwell's delicious butterfly olates given free in exchange for 18 tins of welco. oris taken from lb. john rotiiwell, the cocoa factory, c olborne, lan"
cocoa,1910,0,406,21,4.528,True,"co the very p of you happines built ur )icture thful y 1 • pure c coa natures body builde 0 id. 02 per 4 i ib. tin. john rothwell. the cocoa factory. golborne. lancs. ii every housewife her own ""food "
cocoa,1910,0,406,23,4.5364,True,"no advance a -11- d. in prices. p"" 41bg tin british cocoa. also in id. packets and 2oz. tins, 2!cl. always ask for welco and support hie industries. john bothwell, the cocoa factory, golborne, lancash"
cocoa,1910,0,406,24,4.5435,True,"0 cocoa b e l c wouldst thou conserve the bloom o' youth? the secret 's in three words forsooth:— drink welco cocoa.' john ilothwell, the cocoa factory, colb..."
cocoa,1910,0,406,25,4.5529,True,"--,,i,-,-. arutiftls-fil-fcimt..awsi4;w4:ol-kfr_vtgai.. itt;cii.g:t.,- i welcs cocoa's t one great mission is to keep folk i 1 in condition. john rothwell, the cocoa factory, golborne, lancashire. at "
cocoa,1910,0,406,26,4.5655,True,"t 14, still d. • ..re. • 'r ato cheapest and best. john rothwell, the cocoa factory, go!borne, lancs. the budget has imposed a tax el' d. per lb. extra duty on cocoa, but the same quality. per.ll 4 b."
cocoa,1910,0,406,27,4.5671,True,"110 arivance 4y. ""i'd i in prices. per 4113. ten british cocoa. also in id. packets and 2oz. tins, 21d. always ask for welco and support hone industries. john ilothwell, the cocoa factory, colborne, l"
cocoa,1910,0,406,29,4.5761,True,""". • )4 €. still cheapest and best. ichn rothwell, the cocoa factory, golhorn-e, lancs. the budget has imposed a tax cf ;d. per lb. extra duty on cocoa, but ig id. -4`- -2 per the same ,truality. • a "
cocoa,1910,0,406,30,4.5784,True,",y& c .""44 cocoa r • brings comfort and contentment at the fireside. john rothwell, the cocoa factory, golborne, lancs. ilasammill"
cocoa,1910,0,406,31,4.583,True,british ‘. ure cocoa always ask for cheapest and best. 7d. per -4 lb. tin. save the coupons. john rothwell the cocoa factory. golborne. lanes i 11 • • • • r .. r / • .. r...
cocoa,1910,0,406,32,4.5851,True,"co always a li briti pure c 9d. per -2:1 welco cocoa gives the glow that makes our girls admired s john itothwell, the cocoa factory, colborne, lancs icoa. b tin. a sk for 0, lifr' •s.' ''-4 ,•• 1 1,,"
cocoa,1910,0,406,33,4.5943,True,"1111 ?-;-:::.--7:s....--.',. .- -- • ....-,--a-2:-a, .' 4,......4..."" ~p,, :, -;---- -.::.,--7-7. welco cocoa breakfast ration, fits one for the day's vocation. 812 d. per 1- lb 4 a john rothwell, the"
cocoa,1910,0,406,34,4.5969,True,"in prices. british cocoa. d. 2 i per 41h. tin also in ild. packets and 2oz. tins, 2,1 d. always ask for welco and support lime industries. john bothwell, the cocoa factory, g..."
cocoa,1910,0,406,35,4.5997,True,"ip _ pure cocoa ""ig t and nl** piing. #. lkv.: 2' j. per 4 'john itothwell, the cocoa factory, go!borne, lanes lb. tin. ""as well for the body as the soul,"" it ist wh..."
cocoa,1910,0,406,39,4.6445,True,"send for other recipes free. ito rowntree(dept. a 1.51). (i)?r•vvvwi/... gc29@l the cocoa works, york. please send a./ i me the cinetna booklet containing i recipes for other chocolate dishes 1 and ca"
cocoa,1910,0,406,40,4.6548,True,"...ere is somethin; luite different from any preserve they've tasted before—elect-butta, the delicious chocolate preserve you make with rowntree's elect cocoa. elect-butta is just what the c"
cocoa,1910,0,406,41,4.656,True,"...lephone 122 ‘/y ctfc :.----- ---• 0 ke`e id oke *iiiire 1 •p• • ri i te=2l---- ~ _l__,wiu q u makes one large cupful of refreshing ""welco"" 9r a?- a 1 cocoa, welco c"
cocoa,1910,0,406,42,4.6586,True,"the most warming. invigorating, strenothenlng, nourishing. winter beverage le the cocoa charm' a ,rromo, co-so, or solitble). prepared by the k and s. c.w.s_„.. m the modf.t. wm/cs at litton. lbs ,-.4"
cocoa,1910,0,406,43,4.6726,True,"the best way .... .. ~,.. .. is the ~, $ • -.,,. lir, wag to make a delicious, invigorating cup of welco cocoa, place half a teaspoonful of welco into a break- fast cup, fill up with boiling water, st"
cocoa,1910,0,406,44,4.6733,True,"w gre e coup john rothwell, the cocoa •factory, golborne, lanes t reduction in price. loo 4.0. per 2"" *lb. tin. ritish pure cocoa. ve the coupons. a dainty box rothwell's delicious butter..."
cocoa,1910,0,406,45,4.6868,True,"""the nibs • the cocoa nibs. adventure na. 4. .. .r. .. ;.? 1 ;., s ...,..... k ...... & 1a z), ;if .cr...., „ ai10........... • :70„,-. 1. 'n i e..--;-----•-• • • • ----1...."
cocoa,1910,0,406,46,4.6905,True,"lli/ sailors' and your welcome tins of w elco cocoa arrived this morning, thank you very much; it is considered the best we have ever tasted."" [he soldiers do enjoy it so much; these ights one wants a"
cocoa,1910,0,406,47,4.6934,True,"tie most warming, divigorattng. strengthening. notlingusti, rl\ ter beverage is the cocoa charm; (bromo. 00-so. m soliible). prepared by the et. sad s. c.w.s., at the model voiles i lt-rox. • get a su"
cocoa,1910,0,406,48,4.7105,True,"...ernment in their lest teo budgets taxed foreign ohocofates to the extent of 3, to ss. in the pound. for the benefit of the radical proprietors of the cocoa trust press, which p"
cocoa,1910,0,406,51,4.7186,True,"0 cocoa c wouidst thou conserve the the secret 's in three word drin john rothwell, the cocoa factory, bloom o' youth? forsooth welco cocoa.' colborne, lancs..."
cocoa,1910,0,406,52,4.7435,True,"91area93waelge, —an think thet drinl id more enjoyable too! first thing in the morning, last g at night—""welco"" cocoa is always ""weicome."" re is no comparison between welco and other ks for quality, f"
cocoa,1910,0,406,53,4.7466,True,",ettnoei.leta94oo an think ther irinl d more enjoyable too! first thing in the morning, last g at night —""welco"" cocoa is always ""welcome."" re is no comparison between welco and other ks.for quality, "
cocoa,1910,0,406,54,4.7527,True,"welco cocoa flavour? fruity, like a good old wine! 81.2 d. per 1- lb 4 • john rothwell, the cocoa factory, go!borne, lancashire. _grocers. lib. boxes is. 6d., il..."
cocoa,1910,0,406,56,4.7616,True,"trenches. l„.l dear sir, yours, john rothwell, the cocoa factory, golborne. liquor and, munitions. areas scheduled _under state june 23rd, 1915. will you kindly send me one of your free gifts of choco"
cocoa,1910,0,406,57,4.7667,True,in york you have in the cocoa in- dustry an example of what a small tariff ('an do. it has improved the position of the industry without increasing the cost of the com- modity.-mr...
cocoa,1910,0,406,58,4.7745,True,"...to see how a trade liko that of brunner, mond and co. was anything else than a protected trade, considering the methods that were adopted. (a voice: ""cocoa,"" and laughter.) at, "
cocoa,1910,0,406,59,4.7754,True,"...re is something quite different from any preserve they've tasted before—elect-butta, the delicious chocolate preserve you make with rowntree's elect 'cocoa. elect-butta"
cocoa,1910,0,406,62,4.7918,True,"...ent out to france a welco mother ""i should feel obliged if you welco box of chocolates to gunner thos. r-, lord derby hos winwr( he enjoyed the welco cocoa w so much, i feel he would also e; save the"
cocoa,1910,0,406,63,4.7977,True,"co,a the cocoa nits, doentare no. 4. i a / al i f 1/ t' 1 \ • .. .00:. -:-.331 ''' .., .c.-- ~i, i i .1 1 --.---- --;71,0'. -..!-'-.------ .....,...r.:, -- -_- ......."
cocoa,1910,0,406,64,4.7993,True,"/150,000 for charity. i 1 the late mr j. s. fry's huge fqrtune. .£120,000 in death duties. the estate' of the at mr joseph storrs pry, the cocoa manufacturer and philan- thropist, of bristol, who died"
cocoa,1910,0,406,68,4.8222,True,"cheapest and best welco (pure cocoa) an excellent drink. welco is splendid for carrying out to work in the mines, in the mills, or at the workshops. welco may be kept hot for lengthy pe..."
cocoa,1910,0,406,70,4.8237,True,"coupons. for christmas save the john rothwell, the cocoa factory, golborne, lancs. the best drink is 411 2 per 4lb. tin one and it le an( do a in t hap: of c pros cal i and ti:dick spiri fo-rci thou m"
cocoa,1910,0,406,72,4.8293,True,"workersfind welco (pure cocoa) an excellent drink. welco is splendid for carrying out to work in the mines, in the mills, or at the workshops. welco may be kept hot for lengthy pe..."
cocoa,1910,0,406,73,4.8446,True,"the cocoa nib, adventure no. 1 -------,s.' -4. —""' '''.• ':; •e,:i i \kl\. ....-„-_. -..- .... =----_,,,,:______-- af-:. .__,.„.7„,e- ,--.• ''''... ---t'- ~. _..."
cocoa,1910,0,406,75,4.8651,True,"elect cocoa „ / tree gift casket, and the four as a help to start your collection for the casket, v 1 r 4, • fe 17oucners to start my collection. we will, if you..."
cocoa,1910,0,406,77,4.8659,True,"lielcs gfrifete so that welco (the celebrated cocoa) may become even more exten- sively known, messrs, rothwell, the manufac- turers, are giving in ex- change for 18 coupons taken from ib. tins (or eq"
cocoa,1910,0,406,78,4.8841,True,"...omlta=s====l=llsmln=mimon=wwwwiw3l gunner thos. r-, 7b, east ward, lord derby hospital, winwick, nr. warrington. save the cou john 11.othw, -ell, the cocoa factory, go'borne, lanes ri"
cocoa,1910,0,406,79,4.8877,True,"save the coupons for welco free gift of rothwell's delicious butterfly chocolates. john rothwell, the cocoa factory, go'borne, lancs. does well to stress, what i have repeatedly urged, that esperanto "
cocoa,1910,0,406,80,4.8907,True,"pa. save the co oi rothwell' i john roth' pons for welco free gift delicious butterfly chocolates. ell, the cocoa factory, golbornc, lancs. does well to stress, what i have repeatedly urged, that espe"
cocoa,1910,0,406,83,4.9175,True,"/ coupon t. rowntree 8 co.. u. dept. 340 a cocoa workz. tore. / please send me full partior / tars of how to get the rowir / tree gift casket, and the four as a help to start your collection for the..."
cocoa,1910,0,406,84,4.9189,True,"or 3 the cocoa nibs were glad to meet a sign-post on their way, the strangest sign post they had mct for many and many a day. oh. mr. sign-post, don't you find _lt ..."
cocoa,1910,0,406,87,4.9512,True,"lectontree:i ded cocoa ma.i a &3faat ã,k a meal mrs. lames, mrs. thos. law, mrs. law and miss nom law, mimes law, mr. and mrs. john longbottom, mr. john long worth, mr. a. ..."
cocoa,1910,0,406,88,4.9587,True,"the cocoa _nsba. itheetwee no. ""the cocoa nibs"" meet i. 41.0:0 (' i 41 16 • $ll ._ _ it i i i ._. • ~ v 16. 1‘.... a"
cocoa,1910,0,406,90,4.9868,True,"table talk. the world's tribute of interesting items of news. quaint and amusing. a use has been found for the cocoa shells which are a by-product of the chocolate industry in france, as fodder for ca"
cocoa,1910,0,406,92,5.0008,True,"table talk. the world's tribute of interesting items of news. quaint and amusing. a use has been', found for the cocoa shells which are a 4-product of the chocolate industry in france, as fodder for c"
cocoa,1910,0,406,93,5.0078,True,"...utts. their bread uite different from any preserve they've tasted before—elect-butta, the delicious chocolate preserve you make with rowntree's elect cocoa. elect-butta is just what the children will"
cocoa,1910,0,406,94,5.0168,True,"...ction cards. ebess— to rid. poetic sad stro.n!ti, centrated tbnt • i lb. ti, (ccatins _ grocer for • tin a collin•on'. toala) c ups. ask your ansoits cocoa collinson °nee 6,6 h i liewla clemtele. wi"
cocoa,1910,0,406,95,5.0173,True,"r • • • ••• 1 • • • r .1 the very f of you happines. built ut )icture thful pure cocoa. nature body build 81. d. per 41b. tin. john rothwell. the cocoa factory, golborne, lancs. ¼ every housewife her "
cocoa,1910,0,406,96,5.0281,True,"the cocoa nibs. adventure no. ''''''''-""""'""'""'""•• .------- ...., 1••••_.a. •-• ""-.'- l a • ty.i c-_-_--1_ i -.; •'.l. • -...-s • .. ___ •,• ~ .•1, i' •:.c-c k,..."
cocoa,1910,0,406,98,5.054,True,"table talk. the world's tribute of interesting items of news. quaint and amusing. a use has been found for the cocoa shells which are a by-product of the chocolate industry in france, as fodder for ca"
cocoa,1910,0,406,99,5.0672,True,"cocoa for 3 the cocoa nibs were glad to meet a sign-post on their way. the strangest sign post they had met for many and many a day, oh. mr. sign-post. _ d..."
cocoa,1910,0,406,100,5.0678,True,"gerilini health and strength possessing, i. s id. ind b 4 john rothwell, the cocoa factory, colborne, lancashire. wesley guild festival. successful services at bold street church. the annual festival "
cocoa,1910,0,406,101,5.0773,True,"save the coupons. the cocoa f. dory. sip it and see. •\e lancs. ----.------''' rammimiwimilal.° 11111111minimit_ 7/1 ii • ,\.•\\''svii ‘v; \ ij: \ owegll '0 s v\pef- \ •vsta! 45..."
cocoa,1910,0,406,104,5.0941,True,f pule bileaxilst wocoa i h. timm 40. the highest cocoa value.
cocoa,1910,0,406,107,5.1089,True,"lace-makiag awards. .asammt..mimiem.smilma ""the cocoa ibs"" hat house a duchess lived inside a hat. because she couldn t get a flat. and said she never felt the cold in spite of being rather old. she d"
cocoa,1910,0,406,109,5.1152,True,"thy -wmina. invagor ,tng. • iv i n ter beverage is the cocoa 'am charm' (bromo. co-so. or solcble). prepared by the e. and s. cio ft ir, the worits get wnpply now from ronr store, and ba merle for rou"
cocoa,1910,0,406,110,5.1174,True,"a cilp rewattee'i act cocoa snaa w a &.icalit d? 4, a meal"
cocoa,1910,0,406,113,5.1365,True,"genuine rolled gold spectacles, eye glasses, or rimless, throushout the world ""fry's of bristol- is known as the synonym for cocoa and choco- lat, in their purest anl most delicious forms. the history"
cocoa,1910,0,406,117,5.1875,True,"genuine rolled gold spectacles, eye glasses, or rimless, throushout the world ""fry's of bristol- is known as the synonym for cocoa and choco- lat, in their purest anl most delicious forms. the history"
cocoa,1910,0,406,119,5.1937,True,"-and more enjoyable too first thing in the morning, last hing at nighc—""welco"" cocoa is always ""welcome."" rhere is no comparison between welco and other irinks for quality, fragrance and sustenance an"
cocoa,1910,0,406,120,5.1963,True,"listen cocoa mk ,nture no. 4. i they met the wondrous talking well. an oracle, far-famed. 'let's put a riddle to it now!"" each cocoa nib exclaimed. ""what food is ..."
cocoa,1910,0,406,121,5.2012,True,"~. f, r 3 the cocoa nibs were glad lo meet a sign-post on their tvay, the strangest sign post they had mct for many and many a day. oh, mr. sign-post, don't you find it ..."
cocoa,1910,0,406,124,5.218,True,"cocoa manufactured in -4-• -:..i.z...... .... .4; .c.,-, :2,.- i' 3r "".-..' .....ito-1,4- .... -7::::-...- ._ ..• :re,. p.. ..,.. i,,,t.', ry a--- 1:..;---..."
cocoa,1910,0,406,127,5.227,True,"welco cocoa—drink sublime proves a boon in every clime! 8"". 2 per 3- ib4— al john rothwell, the cocoa factory, colborne, lancashire. tour blood is calling for he..."
cocoa,1910,0,406,131,5.2459,True,"run down? •• how is it. the cocoa nibs enquired. ""you neccr stop work and you don t get tired? because. said the clock. ""there s a man in town who winds me up when i get run iowa!"" th..."
cocoa,1910,0,406,135,5.2815,True,"&le cocoa mailed a &:iwa;isr 40 a wag tliaorel mecalliatews easy eit7iiiii boots cr a 1...a.-ur• 1114.41. ltnnrica, mi. ecclentun. r. oalinci street. blacepool..."
cocoa,1910,0,406,137,5.2931,True,"htcupsthornesalm ,6,0 r cocoa olmememi r h. samuel's every purchase you make at i i. sa mue!'s may be looked upon as a 1•13 t rit• meat, because you get amazing value and an unpar..."
cocoa,1910,0,406,141,5.3048,True,cteap ef rownfiga age cocoa maim a iftioraur 40 a meat *7+ i s ap ik.v.m.%\\
cocoa,1910,0,406,143,5.3182,True,"cheapest and best. john rothwell, the cocoa factory, golborne, lancs to maintain discipline, and win the scholars by personal love to themselves. we might say that the work of sunday school tea..."
cocoa,1910,0,406,146,5.3313,True,"proves a boon per *-lb. john rothwell, the cocoa factory, colborne, lancashire. love, fire and a cross. rev. p. meson and the need for sacrifice. again there was a good congregation at the popular s..."
cocoa,1910,0,406,147,5.3329,True,"axt cocoa nulled a &mar 4itt a meal „ .s • *4\ • • \\,,? • ‘. nvm4‘s\\‘‘ ••• s`q: e \\x:*.\\,,v,s‘‘'...l • 'ls'`\\z`7o ``.• •::xs • i.)_ ..., ....> wp. ga•.:47..."
cocoa,1910,0,406,149,5.3488,True,...the filled with rowntree's delicious chocolates and pastilles can easily be obtained if you save the vouchers to be found in tins of rowntree's elect cocoa. start drinking rowntree's cocoa
cocoa,1910,0,406,150,5.3508,True,"r rill a pine ftres !.7!•••••• coupon to rowntree ca.. u. dept. 437 a cocoa viorka. york. .1 please send me full particu- ,/ lars of how to get the rown- 1 144""4‘ • 1..... g..;,.., 4, itt 4101.0mtiimm"
cocoa,1910,0,406,153,5.3592,True,"the cocoa mbs. adventure no. 4. listen! they met the wondrous talking well, an oracle, far-famed. ""let's put a riddle to it now!"" each cocoa nib exclaimed. ""wh..."
cocoa,1910,0,406,155,5.3694,True,"cocoa pudding. boil two diessertspoonfuls of woos in a. pint of add half an ounce of white sugar, and a few drops of vtanilla. stir a tablespoonful of earn..."
cocoa,1910,0,406,156,5.3708,True,"rjit ,p pure vta 4 utuiiigt.• we also recommend rothwews grade be cocoa powder. guaranteed pure. 7,;d. per 41b. packet. john rothiirell, qoiborne, la ..... irish linen irisn ines lor costumes or suits"
cocoa,1910,0,406,157,5.3767,True,"elect cocoa ecclesfield. i !dors. and jessie awson, and masters eric land frank hobson d ;grand-children), pte. jos. thorpe hesley. patriotic cixt3.—at a meeting..."
cocoa,1910,0,406,159,5.3865,True,the seizure of cocoa. prize court's decision for the famous french airman's 70 claimants. 1 miles an hour for six hours. sir samuel evans in the prize court heard the cla...
cocoa,1910,0,406,161,5.424,True,"vat su&ess 't taitta the chocolate preserve made from elect -cocoa. send for othep -pes free. to rowntree 6. co., ltd. (dept. a 24; the cocoa ivorks, york. please send toe the cinema booklet con amins"
cocoa,1910,0,406,163,5.4347,True,"britis always as for c 0 pure c coa 9d. per tin. ""mother ha tried several cocoa; but finds none s good as welco.' e—. s—., liverpi jot.; 10711 well, the cocoa factory, goimorne, lancs. e the economic "
cocoa,1910,0,406,165,5.4608,True,4 i somi 664ak ehrt-butta ntade with goinnfrees elect cocoa
cocoa,1910,0,406,166,5.4618,True,"tie most w .1? ming. 'wpm or ate.% :then inc:. bourlsb !ng i \-fer beverage cocoa charm w'ath chark soluble,' bv p. .vl.l 51c w okt 01. model works lt-pox jewelled. dust and damp ptool s'lve""""els2/6 c"
cocoa,1910,0,406,171,5.4746,True,"eat viccess of lect `lkitta. i, the chocolate preserve made from elect cocoa. r 4 • thousands are making elea-butia—are you all over the country delighted housewives are writing us, heir praise of ele"
cocoa,1910,0,406,172,5.4805,True,"...ms offat3l-bsadsy. 4.30 pos. etkarow—saoday—rely oamatludas, 2nd. 4th, aad ilth floods's at 8 o'clock; 10.30 cal, maths.: 1.30 pa. swarm' victor (ray cocoa palmeri. zion owit, blo"
cocoa,1910,0,406,175,5.4927,True,"rofq, • sale cocoa make a tufaar 4370 a meat ks\ k • • ,:ssk a, \ d are qming the of the em to eider. nding inter- adler ustave been iersen g the 4 of .tonnm, at), id, ..."
cocoa,1910,0,406,181,5.572,True,all marcarine v- per lb. cocoa and cocoa butter under control. by new orders cocoa is brought under contra: at all 'stages of its manufacture anf 1w tirade sale. the powder is in t...
cocoa,1910,0,406,187,5.5968,True,"ik_ (91r the hot cocoa pattie ha a just made, as she said, to warm him up after his co:d ride on the car."" wel., you forgot something this morning."" ""i don't know why i sho..."
cocoa,1910,0,406,190,5.6146,True,ee cocoa dept. 179 c t. for nh lur free vouchers. alleged breach of the factory act. charge against a barnoldsw.l...n: manufacturer dismissed.. robinson brook...
cocoa,1910,0,406,191,5.6197,True,"...atest thing."" the latest thing in picture theatres hays tbe ""manchester g•arrlien""i rams to be waning photapaphs of tbe interiors of local ironsraetç cocoa factoriec sad mon. /atlas evening aoir"
cocoa,1910,0,406,192,5.6304,True,"too much light. a fine of 10s. was imposed upon mrs. ramp- son, manageress of the british workman tea !and cocoa rooms, horsemarket-street, at the 'borough court on tuesday, for contravening the light"
cocoa,1910,0,406,195,5.6516,True,"too much light. a fine of 10s. was imposed upon mrs_ lamp- oon, manageress of the british workman tea and cocoa rooms, horsemarket-street, at t.13.*3 boinugh courtnn tuesday, for contravening the ligh"
cocoa,1910,0,406,197,5.6677,True,"mr. taylor. cocoa double weiight essence, margarine 1/- i'- a meeting in support of the candidature' of mr e teylor sag@ held in the thodgate mission roe mcn tuesday n..."
cocoa,1910,0,406,198,5.6694,True,"letters to the editor. cocoa and pao==vln. to outo eorroa or tam gaismil sir,—during the repeat oloottoco the supporlsrs of the government ithrsekaa tanalatnill mufti over five f..."
cocoa,1910,0,406,201,5.7109,True,"whpoping pouch and kumasi chest troubles. cuied by. veno's cougil cure. 'ff cocoa caution, tyqymitdo,‘ te• uses ~ m each leak aid the paw bawl n learaft ears ids astetra)ll mi pheed las olograok nom a"
cocoa,1910,0,406,202,5.7142,True,"• • lipton, ltd., cophee & cocoa planters, rotherham, sheffield and barns) cey lon. the large and in- creasin.g demand: for :1 lipton's teas.- is striking evidence of their re- marka..."
cocoa,1910,0,406,204,5.7199,True,"in the flavour that the w are favour- lect cocoa 'ebuary74, 1911. ',undies ih heaps, on the floor wan an old leather portmanteau, open, and with a few articles of clothing in it; into this from ""lim..."
cocoa,1910,0,406,206,5.7326,True,"the most warming. inttcorating. strengthening, nourishing, winter beverage f. the cocoa with charm ,bromo. co-so. or soluble). e. and s. c.xlr.arretdt,b' nvii""ft woras at tuil6l. 0.4 7ere tirtl; b-1 f"
cocoa,1910,0,406,207,5.7361,True,"a dainty supper dish. out out rounds of bread with th'2 lid of a quarter pound cocoa tin and fry them a crisp brown. boil a small finnan haddock until well cooked, bone it, and break the fish up into "
cocoa,1910,0,406,209,5.7477,True,"listen they met the wondrous talking well. an oracle, far-famed. let's put a riddle to it now 1"" each cocoa nib exclaimed."
cocoa,1910,0,406,211,5.768,True,"tea. register with the oldtstabbehed-11361—fires. t. r. gee & co.. tea, coffee, and cocoa merchants, 62, stanley street coprosm: gilveral postofifice), liverpool noted for quality. iw-16"
