word,decade,cluster,cluster_size,rank_in_cluster,distance_to_centroid,target_word_visible,snippet
cocoa,1870,1,957,262,4.1087,True,"12, 1872. iv. r to epps's cocoa ma/147actont.—throunb the kindness of messrs. epps, i recently had;an to- r. tunity of seeing the many complicated andjvaried r ceases the cacao bean..."
cocoa,1870,1,957,263,4.1089,True,"-oclcol=sai taylor bros., london. thz cocoa for cacao) of lif aravilla is the tram theoblerna of liutsfeles. taylor wicrinicas boring wand tho exelissirs *apply of this omni% a my', rovoa, ham ..."
cocoa,1870,1,957,267,4.1126,True,"breakfast.—epps's cocoa —grateful and co forting.—"" by a thorough knowledge ot the natural laws which govern the operatioos of digestion and nutrition, and by a careful appl..."
cocoa,1870,1,957,273,4.1196,True,"four rim. breakfast. —epps s cocoa.— urateful and com fortino. —"" by a t} °rough knowledge of the natural laws which govern the operations of digestion and nutri- tion, and by a carefu..."
cocoa,1870,1,957,275,4.1209,True,"i am sir. yours truly, a itatkpaybil ""a. vitit to icppa's cocoa matufactort.—mtocib the kindness of liessr.. epps, i recently had ad oppor• trinity of seeing the many complicated and varied prft cease"
cocoa,1870,1,957,276,4.1221,True,"irtho, warringto, and graft blac-i.-ni- iiii,-. breakfaat.—epps's cocoa.—grateful and com- forting.—the very agreeable character of this pre- paration has rendered it a general favourite. 'l'he civil "
cocoa,1870,1,957,279,4.1249,True,"cowbridge railway. account of traffic week ending june sth, 1870. s. a. goods passengus ••• 20 15 4 cattle ~. 0 13 4 1:48 3 1 breakfast. —epps's cocoa.—gratefcl and cum forting.—the very agreeable cha"
cocoa,1870,1,957,281,4.1289,True,"kta's compound essencz or lawman. for colds end coughs, cures nine cases out of ten. sold by all chemists. cocoa.—all the year round eays—"" let us stroll to the easton road, hard by the regent's park,"
cocoa,1870,1,957,284,4.1371,True,"coooa as an economical food for cattle and horses. the morning advertiser, quoting from bell's life, ;tyly 4th, says: ""the nutritious cocoa ex- tract is the finest and cheapest cattle food in the mark"
cocoa,1870,1,957,287,4.1434,True,"epps's cocoa.—"" civilian"" says :—""ln the 17111 century, before either tea or coffee had fitund their way into the english markets, chocolate was a faveurite bever..."
cocoa,1870,1,957,288,4.1437,True,"am and north york review. delivered is. id. per quarter in advance. unstamped is. 3d. „ „ credit. one penny. cocoa as an economical food for cattle and horses. the morning advertiser, quoting from bel"
cocoa,1870,1,957,291,4.1474,True,pure soluble cocoa. vanhoijten's cocoa has- been introduced for some years as the only gyaranteed pure b‘doble cocoa. and by all who are now acquainted uith it it is ap...
cocoa,1870,1,957,293,4.15,True,"breakfast.—epps's cocoa —grateful and co forting.—"" by a thorough knowledge ot the natural laws which govern the operatioos of digestion and nutrition, and by a careful appl..."
cocoa,1870,1,957,294,4.1504,True,breakfast—errs' s cocoa.—g itateful and com- forting.—the very agreeable character of this pre- paration has rend.red it a general favourite. the civil service gazette remar...
cocoa,1870,1,957,296,4.1549,True,"mailii villa cocoa. the perizotion of filizabad 0000 l fiwan it iwo"" listaluilsbed 110 yearn. lama stook pim obis bmk (wawa gad oesseal dietary la the lmdom at tie lowi..."
cocoa,1870,1,957,299,4.1596,True,"187. a visit to epps's cocoa manufactori.—through the kindness of messrs. epps, i fccently • had an ""oppoi, tunjtv of seeing the many complicate& aud vaiied.processes• the cacao ..."
cocoa,1870,1,957,302,4.1623,True,"marv donovan. mr. heuery samuel, briti museum-stree brood-street, bloomsbury. at mr. oliva. errs's cocoa.—ail the year round says—. let no strol- to the euston rand, hard by the regent's park. to epps"
cocoa,1870,1,957,303,4.1632,True,"eio.pps's cocoa.—."" cassell's household guide"" says:— ""we will now give an account of the process adopted by messrs. james epps and anufacturers of dietetic articles..."
cocoa,1870,1,957,304,4.1683,True,"‘1 alt a villa' coc a 0--. the perybction of prepared- cocoa. ti aravilla cocoa. for breakfast ltj- thet//obesays:—""tayloß brothers maravilla cocoa has achieved a thorough success, and supersedes ever"
cocoa,1870,1,957,306,4.1722,True,"the per%won of prip•red r -- m a ravilla cocoa. —delicious, unto- rstlec sat sustaining to 111. ma ravi ll• cocoa.—th. blotto.= and dpap•pdgft la a ravilla cocoa.—one trial will setaltlish its mel..."
cocoa,1870,1,957,308,4.1762,True,"-f:pps's cocoa.—"" civilian"" says in the 17th century, before either tea or coffee had found their way into the english market•s, chocolate was a favourite beve- rag..."
cocoa,1870,1,957,311,4.1836,True,"telford and mackenzie's, norton road. hf.eakfast.— epps's cocoa. grateful and com. forting.—"" by a thorough knowledge of the nature. laws which govern ti operations of digestion and nutrition, and by "
cocoa,1870,1,957,322,4.2063,True,"the perfection of piepared cocoa. maravilla cocoa. m a ravill a cocoa. —widow.: invigo- rating anti auvtainlng to all. nlmr a ravilla cocoa.-th. beatbleivr,elaidres and dy.napt in. 1..."
cocoa,1870,1,957,323,4.2068,True,"epps's cocoa.—""aii the year round"" says :----ilaviti 4 now disposed .4 iancy let us stroll to holland-street, inackiri.n., to cocoa manufactory, where inay be stu..."
cocoa,1870,1,957,324,4.2082,True,"epps's cocoa.—"" civilian"" says :—""ln the 17111 century, before either tea or coffee had fitund their way into the english markets, chocolate was a faveurite bever..."
cocoa,1870,1,957,325,4.2129,True,"...ng machines, ll kindel rand and foot. asy terms of payment. who furnish all machines at maxim& mims. machines repaired. machines exchanged. maravilla cocoa for break.- fast. the"
cocoa,1870,1,957,327,4.2133,True,"mabavilla cocoa for break- fast. the mob. nye— taylor brotorrw raw/tula cocoa ha. soloorod a quieten snoom, and buper:33)sb ii,oey olant cocos is ude market. for hci..."
cocoa,1870,1,957,328,4.2152,True,"d.w a. w.k.. telegr,4, /.iuvilla—pioi: 11,4 rimnicrion d itt cocoa. isatavilu cocoaizoltol;,agg.lltoar. taylor tilt cocoa (or cacao) yaravilla mennen of donne. cone is loannoom to sou. amens ol ell ma"
cocoa,1870,1,957,330,4.2236,True,"berkswell, 4. tile hill. printed and published by c. r. adams, kenilworth, set)tember 5, 1872. • a emit to epps's cocoa maniipactolt.—through the kindness of messrs epps, i recently had an opportunity"
cocoa,1870,1,957,334,4.2294,True,"liverpool cotton market.-(this day) sale? probably 10,000 bales, the market eras quiet. breakfast. -epps's cocoa.—grateful and colt fortrno,—the very agnmable character of this preparation has r: r. i"
cocoa,1870,1,957,336,4.2326,True,"§‘'ag'ain plooadilly mau villa cocoa tm picrtikvoi d munn) 0000 l i was i gal uyam lewd nock *1 fint own mitl.gemini dioney as m tits lo cluivlolllolll awls, km sad ilireamtnell. lee"" w...."
cocoa,1870,1,957,338,4.2355,True,"lilviews cocoa sail iu, + n‘...,,.2.. i= ..••••••11k tb.. iliwazdim venzirs issuccg a cocoa sold •••11511/d 113..1. as o__ t_ ma* ma lama hers chocolat tohdit, plam..."
cocoa,1870,1,957,347,4.2537,True,"thousands are unable to take cocoa because the varieties commonly sold are mixed with starch, under the plea of rendering them soluble while really making them thick, hoary, and indigr..."
cocoa,1870,1,957,348,4.2573,True,"-ii- tl.ousande are nrcibla to take cocoa because the wari oct colamouly sold are mixed with starch. under the plea of rendering them cot chic while really making them hersey, and indigestibl..."
cocoa,1870,1,957,350,4.2592,True,"maravilla 0000 a. the pgarsanor a primo 0000 a. maravilla 0000a.--solc propristors, taylor bros. london. tel cocoa (ea cacao) of nar.avilla d the tame nacho:ma of lkinatta coosa la indigenous to south"
cocoa,1870,1,957,357,4.276,True,"paragraph advertisements. ""& visit to epps's cocoa manufartoim— through the kindness of. messrs. epps. i recently had an opportunity of seeing the many complicated and varied processes the cacao bean "
cocoa,1870,1,957,360,4.2809,True,"...ot. railtitia.--116 laws which govern ti e operations a digestion and nutrition, and by 4 oareful application of the fine properties of well selected cocoa, mr epp has provided our breakfast t"
cocoa,1870,1,957,361,4.2834,True,"epps's cocoa.—""john bull"" aas in no branche, of industry are rec..int scientific and chemical discoveries more generally applied watt in those upon i which our fo..."
cocoa,1870,1,957,362,4.2856,True,"maravilla cocoa. the ...ereectiox of prepared cocoa. maravilla cocoa.---80-le-p-1170-p-rre-torb,-- taylor bros., london., the cocoa (or cacao) of maravilla is the tr..."
cocoa,1870,1,957,364,4.2882,True,"epps's cocoa.—"" civilian"" says ""is the 17th century, before either tea or coffee had found their way into the english markets, chocolate was a favourite beve- rag..."
cocoa,1870,1,957,366,4.2916,True,... of a kind not' evidence upon • systems. cm tion-showea vent for some the _ depending -.uot admitted by their _ medical profession are now ordains es cocoa essenc
cocoa,1870,1,957,367,4.2936,True,"i remain, yours, &c., t. s. bourne, hon. sec. kenilworth, zbth aug., 1872. a visit to epps's cocoa mahuipactort.—iitro•oio the kindness of maus epps, i recently had ao opportunity el seeing the many c"
cocoa,1870,1,957,369,4.2984,True,"avillia cocoa. th perpect/on of prepared cocoa. jaaravilla cocoa.--sole proprietors, vt.cip rros,„ lannox the cocoa (or cacao) of maravilla is the true theoliroma ..."
cocoa,1870,1,957,371,4.3031,True,"-f:pps's cocoa.—"" civilian"" says in the 17th century, before either tea or coffee had found their way into the english market•s, chocolate was a favourite beve- rag..."
cocoa,1870,1,957,373,4.3064,True,"...ng machines, ll kindel rand and foot. asy terms of payment. who furnish all machines at maxim& mims. machines repaired. machines exchanged. maravilla cocoa for break.- fast. the"
cocoa,1870,1,957,375,4.3082,True,"dihd. monstront.—on t 1 leth instant, tlie youngest son ol altek hiensught, of mount-street, in tni wwii. ""a visit to eppa's cocoa manimactort.—throngh the kindness of messrs. epps, i recently had an "
cocoa,1870,1,957,377,4.3111,True,"v. kaiuvilla 0000 a. primction of r1{721010 colva. maravilla cocot.—sole protrirtors, taylor bros. london. the cocoa (or cacao) t.i 11ainvilla la the on thenbroma of idiom°, c... iv intligenoto to sou"
cocoa,1870,1,957,378,4.3147,True,"prison a. thousands lue unable to take cocoa because the varieties commonly sold idie mixed with starch, under the plea of rendering them soluble while many making them thick, heavy and indigest..."
cocoa,1870,1,957,383,4.3298,True,"maravilla cocoa. -7-- for bileakfa3t. 'fhe abbe say, variety; importers and manufactuters h,tv ttempted to attain a reputation for their pro- pared cocas, but wo• do..."
cocoa,1870,1,957,385,4.3323,True,"mizav.ll/ 0001111.—sole piutprietors, taylor bros. 1001(0w the cocoa (or cacao) mara ieill la tha one thad... al lianas cue. la edits... to son. amens .0 .000 mane. s wenn porn.. tayiair rrophern have"
cocoa,1870,1,957,389,4.3363,True,"the amateu}'s guide to howeopathic treatment—ooix 9d. hoireopathic cocoa is the best shilling.cocoa.spiti,_ _ tirrelus taraxacijm cocoa ill th,, b,:st cocoa for invalids, and a luxury for those in hea"
cocoa,1870,1,957,394,4.3443,True,"-f:pps's cocoa.—"" civilian"" says in the 17th century, before either tea or coffee had found their way into the english market•s, chocolate was a favourite beve- rag..."
cocoa,1870,1,957,397,4.3509,True,"epps's cocoa.—"" church review"" says :—"" although we cannot ya boast of a free breakfast table, still the active legislation in furtherance of that object during t..."
cocoa,1870,1,957,398,4.3536,True,"• epps's cocoa.—""joint-stook com- panies journal"" says:—"" it is said of cardinal richelieu that, suffering from marasmus, or a general asting away of the body, he c..."
cocoa,1870,1,957,402,4.3563,True,"....—on the 18th instant, at halnsane!' church, mr. charles wright, to sarah, only daughter of the late charles harnett, nag no cards. a visit to epps's cocoa manufactoby.—th"
cocoa,1870,1,957,406,4.3589,True,"saturday, july 10, 1875 go""r° „ epps's cocoa —gratr fin and cobifortina.... a thorough knowledge of the natural laws which the operations of digestion and nutrition, and by fat application of th..."
cocoa,1870,1,957,411,4.3638,True,"i remaio, yours bre., a visitor. a visit to 'epps's cocoa ma giipactort.—throiioi the kindness of messrs epps. i recently had ao opportunity if seeing the many &implicated and varied processes the cac"
cocoa,1870,1,957,414,4.3708,True,"kta's compound essencz or lawman. for colds end coughs, cures nine cases out of ten. sold by all chemists. cocoa.—all the year round eays—"" let us stroll to the easton road, hard by the regent's park,"
cocoa,1870,1,957,415,4.3724,True,"• epps's cocoa.—""joint-stook com- panies journal"" says:—"" it is said of cardinal richelieu that, suffering from marasmus, or a general asting away of the body, he c..."
cocoa,1870,1,957,422,4.3911,True,"[aii.avilla cocoa. the piarca= of pillparid 0000 a. evan's'. valuable omni midianite. evans's stimulant drinks of great a"".• use in eases whore the rnimal lease sppeti..."
cocoa,1870,1,957,429,4.3985,True,"marv donovan. mr. heuery samuel, briti museum-stree brood-street, bloomsbury. at mr. oliva. errs's cocoa.—ail the year round says—. let no strol- to the euston rand, hard by the regent's park. to epps"
cocoa,1870,1,957,430,4.4006,True,"• epps's cocoa.—"" cassell's household guide"" sariol we will now give an account of the process adop of by messrs. james epps and co. manufacturers_,,v dietetic arti..."
cocoa,1870,1,957,432,4.4012,True,"am and north york review. delivered is. id. per quarter in advance. unstamped is. 3d. „ „ credit. one penny. cocoa as an economical food for cattle and horses. the morning advertiser, quoting from bel"
cocoa,1870,1,957,435,4.4049,True,"maelyilla cows-soln pr iprintors, taylor lonpon. toe cocoa (or cacao) 01 manavilla la the true ilwobrows ef umlaut, coo. la luiliseuon in. america of who. map.. le • 0p.,. portion, taylor brothers na,"
cocoa,1870,1,957,436,4.4077,True,"e""''s cocoa.—"" john bull"" says :—"" in no branches of industry are recent scientific and chemical discoveries more generally applied than in those upon which our ..."
cocoa,1870,1,957,437,4.4086,True,"hireavilts 0000 a. ilte prarsorios 0000 a. 0000,slz ramnitrou, tat wi tilt 111l0fl winos cocoa (oe cacao) of mara villa la the tree lbeebroree laroeur. coma la ...rep... to &las *merles whirth klestri"
cocoa,1870,1,957,440,4.4185,True,"neig -uttlin_presses „ epps's cocoa.—"" cassell's household guide"" says:— ""we will now give an account of the process adopted by messrs. james epps and co. manufacturers of dietetic tift..."
cocoa,1870,1,957,441,4.4186,True,"cocoa ne perfection of preparcd cocoa mailavilla cocoa.-bede proprleterstaywß, london. ne coca (er caen)°, marseille le the tree ',tette nine 0 orb.. l•lnd..."
cocoa,1870,1,957,444,4.4244,True,"l 14ci:l in, tl 4 .4 p_arat.itni li.. til,t 1,,, ,-• • which mr. tioh of cocoa hw h. •t. i, :,1 i asp og- ....bayacterf till,. pre- fc.rocriie. 'the _ the siitg,ulsr stiece,..; by 111,, hii;eopathic p"
cocoa,1870,1,957,445,4.4253,True,"mabavilla cocoa for break- fast. the mob. nye— taylor brotorrw raw/tula cocoa ha. soloorod a quieten snoom, and buper:33)sb ii,oey olant cocos is ude market. for hci..."
cocoa,1870,1,957,449,4.4303,True,"why supterp-rzliem is certain. l o'v e ift t 8 • cil/malted cocoa tlectimil li i a safe eacl• acetate eure for all mawrlet isis di ~,agliast and amftka, conghatilli ."" •ce .-.1""1"".••• !ma— .11.114 pi "
cocoa,1870,1,957,451,4.4331,True,"epps's cocoa.—""naval and military gazette"" say4l: ""the nuttitive qualities of cocoa over thoie of tea or coffea are now so generally acknowledgedtbat the steady i..."
cocoa,1870,1,957,453,4.4337,True,"(to be continued.) thousands are unable to take cocoa because the varieties commonly sold are mixed with starch, under the plea of rendering them soluble whit really making them thick, heavy, and indi"
cocoa,1870,1,957,455,4.4366,True,"epps's cocoa.—""cassell's household guide"" says:— we will now give an account of the process adopted by messrs. james epps and co., manufacturers of dietetic artic..."
cocoa,1870,1,957,458,4.4399,True,"...ve no -agents-. see trade mark on every package. sittton's priced list on application royal berkshire seed establishment, reading. ""a visit to epps's cocoa manufactory.— through the "
cocoa,1870,1,957,460,4.4432,True,"i ao eifs's cocoa.—"" christian world"" says:—"" if- to take cocoa,' said i, i must know what it is made o‘fi4. must examine the_precess i must dive into the of its manuf..."
cocoa,1870,1,957,464,4.4507,True,"f4pps's cocoa.—"" naval and military gazette"" says :—"" the nutritive qualities of cocoa over either those of tea or coffee are now so generally acknowledged that th..."
cocoa,1870,1,957,465,4.4528,True,"the per%won of prip•red r -- m a ravilla cocoa. —delicious, unto- rstlec sat sustaining to 111. ma ravi ll• cocoa.—th. blotto.= and dpap•pdgft la a ravilla cocoa.—one trial will setaltlish its mel..."
cocoa,1870,1,957,467,4.455,True,"i reman, sir, • yours truly, thomas hu st thousands are unable to take cocoa because tl.e varieties commonly sold are mixed with starch, unler the plea of rendering them soluble while really malty; th"
cocoa,1870,1,957,468,4.4582,True,"-oclcol=sai taylor bros., london. thz cocoa for cacao) of lif aravilla is the tram theoblerna of liutsfeles. taylor wicrinicas boring wand tho exelissirs *apply of this omni% a my', rovoa, ham ..."
cocoa,1870,1,957,470,4.4609,True,"c....... i;;z:i16.—.1—....., .... alwrier, co kyia in wo ilk pack- .••• 11113 ms a way.i.i, li[dai ade viei.ina x.r""7.7.7 %lim' er's essence of cocoa sold in &act grtirtltut: st"
cocoa,1870,1,957,471,4.4632,True,"• epps's cocoa.—""joint-stook com- panies journal"" says:—"" it is said of cardinal richelieu that, suffering from marasmus, or a general asting away of the body, he c..."
cocoa,1870,1,957,472,4.4636,True,"epps's cocoa.—"" civilian"" says ""is the 17th century, before either tea or coffee had found their way into the english markets, chocolate was a favourite beve- rag..."
cocoa,1870,1,957,473,4.4637,True,"...garette"" says :—"" by a thur ugh natural laws which govern the operatioi.a and nutrition, and by a careful anlication ut c properties of well-selected cocoa. mr. epps l-ti"
cocoa,1870,1,957,476,4.4677,True,"restminster npt a moment's credit. good caiwou better 2/44, bee-2/9, lapsatg sondh6ng 279. pure grantlated cocoa 1/2. read lancet 1851. £2 wortilßail paid to all england &wales. handford 4ic davie e 6"
cocoa,1870,1,957,482,4.4777,True,"mailii villa cocoa. the perizotion of filizabad 0000 l fiwan it iwo"" listaluilsbed 110 yearn. lama stook pim obis bmk (wawa gad oesseal dietary la the lmdom at tie lowi..."
cocoa,1870,1,957,483,4.4781,True,"homteopathy, the amateur's guide to homeopathic treatment—oniy 6d. tirrell's homeopathic cocoa is the bebt shilling cocoa sold. tirrell's taraxacum cocoa is the best cocoa for invalids, and a luxury f"
cocoa,1870,1,957,486,4.4832,True,"epps's 0000 a.—"" naval and military gazette"" says :—"" tile nutritive qualities of cocoa over either those of tea or coffee are now so generally acimowledged that the steady increase shewn by official "
cocoa,1870,1,957,488,4.4874,True,"cocoa ne perfection of preparcd cocoa mailavilla cocoa.-bede proprleterstaywß, london. ne coca (er caen)°, marseille le the tree ',tette nine 0 orb.. l•lnd..."
cocoa,1870,1,957,490,4.4961,True,"11.a.r cocoa 0“. era*. lona,. taylor broviikry havd tn. unrivalled docoa', what le lo unden.l,ly ^ derirovion •it• vii, let ulicoa, ile ps.ioiioii el '•iiiavilla ..."
cocoa,1870,1,957,492,4.5007,True,"avillia cocoa. th perpect/on of prepared cocoa. jaaravilla cocoa.--sole proprietors, vt.cip rros,„ lannox the cocoa (or cacao) of maravilla is the true theoliroma ..."
cocoa,1870,1,957,493,4.5014,True,"homteopathy, the amateur's guide to homeopathic treatment—oniy 6d. tirrell's homeopathic cocoa is the bebt shilling cocoa sold. tirrell's taraxacum cocoa is the best cocoa for invalids, and a luxury f"
cocoa,1870,1,957,494,4.5016,True,"----de-lidous, m•ravilla cocoa. inv**. istioff mei ovatatolog to .11. mara v 1 ll• cocoa. —the beat beverage for 'avail& and dy•evlroce. wf • r•vill• cocoa.—one trial will establis..."
cocoa,1870,1,957,496,4.5025,True,pure soluble cocoa. vanhoijten's cocoa has- been introduced for some years as the only gyaranteed pure b‘doble cocoa. and by all who are now acquainted uith it it is ap...
cocoa,1870,1,957,500,4.5138,True,"-fipps's cocoa.—"" naval and military a gazet a"" says :—"" the nutritive qualities of cocoa over either those of tea or coffee are now so generally acknowledged that ..."
cocoa,1870,1,957,502,4.5144,True,"fpps's cocoa.—"" naval and milifary. gazet'e says:—"" the nutritive qnalities of cocoa over either those of tea or coffee are now so generally acknowledged that the..."
cocoa,1870,1,957,506,4.521,True,"epps's cocoa.— mining world"" says the preparation of pure and nutritious articles of diet is, in point of philanthropy, noble work. the wear and tear upon brain a..."
cocoa,1870,1,957,509,4.5236,True,"raix„ [registered for abroad. one penny. beware or 001./ ffffff it. lea ..1 perrins, illea&vii.la cocoa th. pmumeen. et yliii,hip.9l3•l9/6. -i\i7cia-t-viegniwifa--- no.- • 1,110.1.:01.4."" tem cocoa or"
cocoa,1870,1,957,511,4.5249,True,"epps's 0000 a.—"" naval and military gazette"" says :—"" the nutritive qualities of cocoa over either those of tea or coffee are now so generally acknowledged that the steady increase shown by official s"
cocoa,1870,1,957,512,4.5258,True,"the perfection of piepared cocoa. maravilla cocoa. m a ravill a cocoa. —widow.: invigo- rating anti auvtainlng to all. nlmr a ravilla cocoa.-th. beatbleivr,elaidres and dy.napt in. 1..."
cocoa,1870,1,957,514,4.5288,True,"... woon.—on the br 4 just, at 124, lodge-road, hockley, aged 68 years, mr. joseph wood, glassmaker, late of the meath, in this town. 'a visit to eppica cocoa uano/aceort.-111toligh t"
cocoa,1870,1,957,516,4.5299,True,"iiordieopathy. —tice—iiiiiroit's guide to homceopathic treatment—oniy 61 tirrell's homeopathic cocoa is the best shilling cocoa sold. cocoa is the best cocoa for invalids, and & luxury for those in he"
cocoa,1870,1,957,519,4.5371,True,"marayilla cocoa. the rpßrecrion 0000, mabayilu cocoa—rolm proprirtori, taylor pros. lonnon. tm. cocoa (or cacao) of masavilla i. the true tbobrowe of la .v. know le ..."
cocoa,1870,1,957,522,4.5428,True,"tirrell's boilmopathic cocoa is the best shilling cocos sold,—a trial will prove its superiority over all others at the same price. save 30 per cent by wing the london lion tea c..."
cocoa,1870,1,957,524,4.5498,True,"maravilla cocoa. the ...ereectiox of prepared cocoa. maravilla cocoa.---80-le-p-1170-p-rre-torb,-- taylor bros., london., the cocoa (or cacao) of maravilla is the tr..."
cocoa,1870,1,957,526,4.5571,True,"am and north york review. delivered is. id. per quarter in advance. unstamped is. 3d. „ „ credit. one penny. cocoa as an economical food for cattle and horses. the morning advertiser, quoting from bel"
cocoa,1870,1,957,527,4.5572,True,"...on. sugar and spice have a good nursery reputation, and we are not much shocked to learn that a large proportion of the substances advertised as pure cocoa"" is adul- terated with "
cocoa,1870,1,957,529,4.5667,True,"...on. sugar and spice have a good nursery reputation, and we are not much shocked to learn that a large proportion of the substances advertised as pure cocoa"" is adul- terated with "
cocoa,1870,1,957,534,4.5747,True,"epps's cocoa.—"" naval and military gazette"" says :—""the notritii e coc over either those of tea or coffee are now so generatly acknowledged that the steady increa..."
cocoa,1870,1,957,535,4.5759,True,"-epps's cocoa.—"" church review"" says :--"" although we cannot yet boast of a free break- fast table, still the active legislation in furtherance of that object duri..."
cocoa,1870,1,957,539,4.585,True,"neig -uttlin_presses „ epps's cocoa.—"" cassell's household guide"" says:— ""we will now give an account of the process adopted by messrs. james epps and co. manufacturers of dietetic tift..."
cocoa,1870,1,957,540,4.5886,True,"rpps's cocoa.—""mining world"" says:—"" the pre- paration of pure and nutritious articles of diet is. in point of philaathrepy, noble work. the wear and tear upon br..."
cocoa,1870,1,957,542,4.5926,True,"ri iiire l l's hom geop a thic cocoa. is. per pound is pronounced by conspeteut iudgm to be the rest is. cocoa sold in the potteries. tir re ll's tarax'acum cocoa, 15. id. per pound ls t..."
cocoa,1870,1,957,546,4.5962,True,"• epps's cocoa.—""joint-stook com- panies journal"" says:—"" it is said of cardinal richelieu that, suffering from marasmus, or a general asting away of the body, he c..."
cocoa,1870,1,957,547,4.6016,True,"no. 189, new series. ri irrell's homceopathic cocoa, is. per pound is monetumed by competent judges [to be the best i. cocoa sold in the potteries tir ll's tara xacum cocoa, is. ed. per pound is the b"
