word,decade,cluster,cluster_size,rank_in_cluster,distance_to_centroid,target_word_visible,snippet
cocoa,1870,1,957,861,5.8394,True,"opening of a new cocoa and furness congreg vtional the following paper upon the subject of chriatian union with it creed,"" and ‘• union without a ('reed,"" was'rad by the re..."
cocoa,1870,1,957,864,5.8554,True,montauban's guaranteed l'utc cocoa chocolatine. montauban's economical chocolatine. montauban's try a sixpenny tin. chocolatine. montauban's see that you get it. ciiocoiatine. ciieap j...
cocoa,1870,1,957,867,5.8649,True,"in soups, _ out of them is are much same cost of rishing drink, oonteinilsg both where milk cannot be had it is infants. the great cocoa houses in many of our large towns have not been established a w"
cocoa,1870,1,957,868,5.8692,True,"cocoa room at the north end. os monday evening a new cocoa room was opened in brassey-street, at the north end. the premise. stand at the junction of two r..."
cocoa,1870,1,957,881,5.973,True,"cocoa and coke. you people, probably, s• they gip their cup of coco.. or chocolate at home, or in 01110 • coffee nod cocoa taverne ""—the modern revivals of..."
cocoa,1870,1,957,884,5.9886,True,"avillia cocoa. th perpect/on of prepared cocoa. jaaravilla cocoa.--sole proprietors, vt.cip rros,„ lannox the cocoa (or cacao) of maravilla is the true theoliroma ..."
cocoa,1870,1,957,887,6.0073,True,"cocoa room at the north end. os monday evening a new cocoa room was opened in brassey-street, at the north end. the premise. stand at the junction of two r..."
cocoa,1870,1,957,889,6.0336,True,"-eppss cocoa only in lb., lb., awl 116. packets—l-tin-lined rut] labelltll. s ad by 'hie twade in all pis. 128, hich street, si ockton• '1 d jones • 4 i3egs most ..."
cocoa,1870,1,957,891,6.0581,True,"mee cocoa cattle 1,0101.1 company's nutrition cocoa neal, for ii one.. con. pigs. ilben. dont, route. ile. moo mon for so 500 folds for 17.; iso inds toe 0.61...."
cocoa,1870,1,957,892,6.0687,True,"the liverpool cocoa rooms. in liverpool there are at present in full work 29 cocoa rooms, situated for the most part in the populous part of the town. at the meeting of ..."
cocoa,1870,1,957,895,6.0917,True,"thousands are unable to take cocoa because the varieties commonly sold are mixed with starch, under the plea of rendering them soluble while really making them thick, hoary, and indigr..."
cocoa,1870,1,957,896,6.0926,True,"opening of cocoa boom at widnes. on wodossiley night a public meeting, to cob brat. the establiehment nod openieg of coca tuom. uhr whin., woe held to ths v amities 1..."
cocoa,1870,1,957,898,6.0964,True,"cl-e 471 :13kiti„711311(11a,ppordsiiire cocoa and coyfee, h:tekil,?t co imited) reqtiire the services of etill-s'gkßy,.w.hlo will be expected to exercise a f the business, toil' b pervision over ..."
cocoa,1870,1,957,900,6.1011,True,"cocoa room at the north end. os monday evening a new cocoa room was opened in brassey-street, at the north end. the premise. stand at the junction of two r..."
cocoa,1870,1,957,901,6.113,True,"stealing a cocoa nut. william muller, a boy of twelve, was charged with stealing a cocoa nut, value 6d., the property of thos. smith, a hawker, on the 10th inst. comp..."
cocoa,1870,1,957,902,6.1146,True,"...lakeder my.; come eceltalm, m lamb flmh,formlna matter as mel. 1 val. equal 1.000 lw; sant free fur ma, leb.pf7, it, ar,,l balk, from ma limulid,.ry, cocoa oattle food co.."
cocoa,1870,1,957,905,6.1758,True,"tee cocoa nvt mat mailers. the assistance of all friends of working men are solicited on behalf of 300 men and boys out of work at messrs. kona and sons, cocoa..."
cocoa,1870,1,957,907,6.2076,True,cocoa as a substitute for beer. it is quite clear that one of the foremost public questions in the near future will be that of tem- perance. to whatever ca...
cocoa,1870,1,957,911,6.2341,True,"hyde. stzaling cocoa nuts at the vitailicb.—at the petty ssesious on monday, before e.hibbert sod r. hall, escis a boy named thomas 011ereashaw was charged with stealing ..."
cocoa,1870,1,957,912,6.2382,True,"stealing a cocoa nut. william muller, a boy of twelve, was charged with stealing a cocoa nut, value 6d., the property of thos. smith, a hawker, on the 10th inst. comp..."
cocoa,1870,1,957,914,6.2543,True,"the win.ford coffee and cocoa house co. we ohm,' the wind ord goff. cud cocoa rouse company, limited, is now ready to metre swollen.. tiool for she., limited to mount to ten eltll..."
cocoa,1870,1,957,915,6.2644,True,other waters. agent for thompson & capper's homcepathic cocoa and medicines.
cocoa,1870,1,957,916,6.2723,True,"other waters. agent for thompson & capper's homcepathic cocoa and medicines. t r a die the herald, saturday, september 17, 1870. john wilkinson, auctioneer and valuer, house and commission agent, &c.,"
cocoa,1870,1,957,917,6.2789,True,"other waters. agent for thompson & capper:s lhomgipa.thic cocoa and medicines. trade mark. colman's british corn-flour is prepared from rice, the staple food of more than three hundred millions (300,0"
cocoa,1870,1,957,918,6.279,True,cocoa as a substitute for beer. it is quite clear that one of the foremost public questions in the near future will be that of tem- perance. to whatever ca...
cocoa,1870,1,957,919,6.2895,True,"the win.ford coffee and cocoa house co. we ohm,' the wind ord goff. cud cocoa rouse company, limited, is now ready to metre swollen.. tiool for she., limited to mount to ten eltll..."
cocoa,1870,1,957,920,6.2959,True,"the dorset county express and agricultural gazette, tuesday, october 27, 1874. --_ iogazugas sgasions. hi similar terms he touched on cocoa and mustard, and dorset it _ the legislature had taken the s"
cocoa,1870,1,957,921,6.3016,True,"cocoa room at the north end. os monday evening a new cocoa room was opened in brassey-street, at the north end. the premise. stand at the junction of two r..."
cocoa,1870,1,957,924,6.3125,True,"the cocoa room movement in liverpool. the twenty-fourth home established by the british workman public houle co., of liveoel, wee opened on tuesday afternoon. ..."
cocoa,1870,1,957,925,6.3167,True,"opening of a new cocoa and furness congreg vtional the following paper upon the subject of chriatian union with it creed,"" and ‘• union without a ('reed,"" was'rad by the re..."
cocoa,1870,1,957,926,6.3534,True,"complete house furnishf:its, 10 k 12, oldham-street, manchester. works -spear-street. wav celey cocoa r 0 oms, h a dwick. te rrac e, top or hign at. :..lest door to mr hughes, dentist.) the hoc•s prem"
cocoa,1870,1,957,929,6.3802,True,"hyde. stzaling cocoa nuts at the vitailicb.—at the petty ssesious on monday, before e.hibbert sod r. hall, escis a boy named thomas 011ereashaw was charged with stealing ..."
cocoa,1870,1,957,930,6.3917,True,cocoa as a substitute for beer. it is quite clear that one of the foremost public questions in the near future will be that of tem- perance. to whatever ca...
cocoa,1870,1,957,932,6.4023,True,"west broiiwici3.. the coffee ii ousir movearent.—on monday a coffee and cocoa house was formally opened by mr. h. farley, chairman of the improvement commissioners, who expressed his opinion that plac"
cocoa,1870,1,957,935,6.5443,True,"coffee _ and cocoa _maces itovetiirt in giaraiii7 on thursday evening mr lewis dodshon de- livered an address on the above subject in the temperance hall, stockton, to ..."
cocoa,1870,1,957,937,6.5613,True,"is excellent. thy it. the r i ch tore for all kizale of bird for quality and prises see the window!! at 28, silver-street, stockton-os-tel ivaverley cocoa rooms, ftos, ha_.,‘c'7ii•terrace, top of high"
cocoa,1870,1,957,940,6.6016,True,"*war fir sod 1711, piera6ll,ll,--` poriii4, cocoa we will dew gi sea. oft. am& ca, *attie p.444;44 it ',mir reeks at tie &intim 411 iinawthuld • • deaths.. idby wm= 74.;.; •, ...._ ciii tbelidlth oil..."
cocoa,1870,1,957,941,6.6362,True,"horses and oattls inkllb highly nutritious food is propane 1 um from tho cocoa bona, birds& wft hooka giving seeds, herb& and room. known s. ponme nod grown for their invigorating tonia,and mbar prmis"
cocoa,1870,1,957,942,6.6722,True,"the sunday opening of cocoa houses. the poll at southa:uip;;;;lion the question of opening the cocoa-rooms on sunday during the hours that public-houses are open, and which has ..."
cocoa,1870,1,957,943,6.6771,True,"other waters. agent for thompson & capper's homcepathic cocoa and medicines. i royal charlie & river queen. me ssr s. duncan's passenger steaeboats. until further notice, the above•natned steamboats w"
cocoa,1870,1,957,945,6.6941,True,"other waters. agent for thompson & capper's howepathic cocoa and medicines. i royal charlie & river queen. i 4414.41;,iita messrs. duncan's passengeb steaeboats. until further notice, the above-named "
cocoa,1870,1,957,946,6.7188,True,"441 xaniiiter kghats. saturday, march 23, 1878. the cocoa and coffee house movement. no small amount of the evil which preys upon human nature is produced by the circumttances that hedge men around on"
cocoa,1870,1,957,949,6.7594,True,"vie wm,road_coffee and cocoa kiottse 00. we °beery° the winsford coffee and cocoa mom c""pwr, liccasd, is now ready to octave applies- woe for shame. incited in amount to too eegb..."
cocoa,1870,1,957,950,6.768,True,"the • herald. establisiied january lont, 1863. bakrow-in-fursesb. tuesday, marcii 11, 1879. the cocoa and coffee house movement has made rapid strides in bartow. the third of these est lishments itt :"
cocoa,1870,1,957,952,6.7766,True,"vie wm,road_coffee and cocoa kiottse 00. we °beery° the winsford coffee and cocoa mom c""pwr, liccasd, is now ready to octave applies- woe for shame. incited in amount to too eegb..."
cocoa,1870,1,957,954,6.8763,True,other waters. agent for thompson & capper's homcepathic cocoa and medicines. i royal charlie i.; river queen. g•stit' alteration of time table for messrs. duncan's passenger steaeboats. on and after s
cocoa,1870,1,957,955,6.9239,True,"eacb. (for adhom, bronchitis, horse. ev a n s'si nen, shortness of drestb, dry pectoral i cough, hors varner. &a a cocoa most efficient sod agrassblo lozenges. i rem.dy. sold is boxes, 70„ i and is. l"
cocoa,1870,2,485,43,4.9213,True,"!ai great•sale by artingstall 8: hind (auctioneers), of the entire stock manufactured in the city gaol, of. cocoa matting and mate, hall and door mats, in wool and cocoa fibre. e. le•wis and co. havin"
cocoa,1870,2,485,52,4.9879,True,...ers • wish the public to know that they keep the largest and cheapest stock of paper hangings (all new patterns) of any firm in the north of england. cocoa mattmgs and mats. well-seasoned 
cocoa,1870,2,485,65,5.042,True,"...hers wish the public to know that they keep the largest and cheapest stock of paper-hangings, (all new patterns) of any firm in the nortn of england. cocoa matti/stgs and mats. well-seasone"
cocoa,1870,2,485,78,5.0823,True,"b. lithgow's toilet glasses in great variety, all equally reduced in price. brussels, tapestry, & e carpets. hearth rugg, skinnatf, cocoa matting & mats n,te tim addziiib-.• samuel litegow"
cocoa,1870,2,485,79,5.0824,True,"...hers wish the public to know that they keep the largest and cheapest stock of paper-hangings, (all new patterns) of any firm in the north of england. cocoa mattings and mats. well-seasoned"
cocoa,1870,2,485,84,5.1112,True,"furnishing department. a large assortment of tapestry, kidder- minster, dutch, felt, & hemp carpets. cocoa mattings, in plain and striped, all widths. 10 pieces cretonnes, twilled, 3d. per yard. 10 pi"
cocoa,1870,2,485,88,5.1205,True,"...t -, 1! a\4 nv ,1 er advertis- litp3da' ik 18. 1913. carpets and geniral4 furnishing. a largi: and varied assortment of carpets in the newiter-style. cocoa mats and cocoa. mattingxell season"
cocoa,1870,2,485,98,5.1457,True,"au equally reduced in price. brussels, tapestry, & kidderminster carpets. earth raga, skin mats, cocoa klatting and mats. -notis tex addr2bb- samuel lithgovir, leeds house, market place, mid daditiaii"
cocoa,1870,2,485,107,5.1974,True,"...remnants of ali. wool cloth. less than the • brussels, hemp, blips, whole of their carpft stock, comprising i, tapestry. ki.iderminster, felt, dutch, cocoa matting, rugs, door mats, door hassocks,"
cocoa,1870,2,485,119,5.2355,True,"s. ursoows toilet glasses in great variety, all equally reduced in price. bbvssels, tapestry, & kidderminster carpets. hearth rugs, skin mats, cocoa matting & mats. nmi tex addissi-- samijel lithgow, "
cocoa,1870,2,485,120,5.2367,True,"t to'iphi eh furnishing department. a large assortment of tapestry, kidder- minster, dutch, felt, & hemp carpets. cocoa mattings, in plain and striped, all widths. 10 pieces cretonnes, twilled, nd. pe"
cocoa,1870,2,485,122,5.239,True,"...ers wish the public to know that they keep the largest and cheapest stock of pa.per-hangings, (all new patterns) of any firm in the north of england. cocoa mattings and mats. well-season"
cocoa,1870,2,485,128,5.2649,True,"furnishing department. a large assortment of tapestry, kidder- minster, dutch, felt, & hemp carpets. cocoa matting s, in plain and striped, 911 widths. 10 pieces cretonnes, twilled, nd. per yard. 10 p"
cocoa,1870,2,485,139,5.3033,True,"furnishing department. a large assortment of tapestry, kidder- minster, dutch, felt, & hemp carpets. cocoa mattings, in plain and striped, all widths. 10 pieces cretonnes, twilled, nd. per yard. 10 pi"
cocoa,1870,2,485,140,5.3035,True,"furnishing department. a large assortment of tapestry, kidder- minster, dutch, felt, & hemp carpets. cocoa mattings, in plain and striped, all widths. 10 pieces cretonnes, twilled, na. per yard. 10 pi"
cocoa,1870,2,485,141,5.3044,True,"s. lithgows toilet glasses in great variety, all equally reduced in price. brussels, tapestry, & kiddermlnster carpets. hearth rugs, skin mats, cocoa matting it mats nutr tee addeiisb- litiigow leeds "
cocoa,1870,2,485,148,5.3327,True,"furnishing. department. a large assortment of tapestry, kidder- minster, dutch, felt, & hemp carpets. cocoa ma ttings, in plain and striped, all widths. 10 pieces cretonnes, twilled, na. per yard. 10 "
cocoa,1870,2,485,149,5.3339,True,...thers wish the public to know that they keep the largest and cheapest stock of paper-hangings (all new patterns) of any firm in the north of england. cocoa mattings and mats. well seasoned 
cocoa,1870,2,485,151,5.34,True,"furnishing department. a large assortment of tapestry, kidder- minster, dutch, felt, & hemp carpets. cocoa mattings, in plain and striped, all widths. 10 pieces cretonnes, twilled, per yard. 10 pieces"
cocoa,1870,2,485,161,5.3626,True,"furnishing department. a -large assortment of tapestry, kidder- minster, dutch, felt, & hemp carpets. cocoa mattings, in plain and striped, all widths. 10 pieces cretonnes, twilled, nd. per yard. 10 p"
cocoa,1870,2,485,163,5.3649,True,"s. lithgow's toilet glasses di great variety, al! equally reduced in price. brussels, tapestry, & kidderminsi er car.rnts. hearth rugs, skin mats, cocoa matting & mats. nom the address— s amuel tithgo"
cocoa,1870,2,485,169,5.38,True,"... eis wish the public to know that they keep the largest and cheapest stock of paper-hangings, (all new patterns) of any firm in the north of england. cocoa mattings and mats. well-seasoned"
cocoa,1870,2,485,170,5.3805,True,"furnishing department. a large assortment of tapestry, kidder- minster, dutch, felt, & hemp carpets. cocoa mattings, in plain and striped, all widths. 10 pieces cretonnes, twilled, 3.0. per yard. 10 p"
cocoa,1870,2,485,172,5.3874,True,"s. lithgow's toilet glasses fl great variety, all equally reduced in pte. brussels, tapestry, tremde,'ruinster carpets. hoarth rags,jbkinritats, cocoa leatting & mato. note tei address-- samiteil lith"
cocoa,1870,2,485,179,5.4325,True,"hearth huge, skin mate, cocoa matting & mats. nam tem amputee— samuel tiithgow, leeds house. middlesbrough. ‘l.-uo-:4).140646 wills' one oz. packet, p. ""old friend"" tobacco. qnly ..."
cocoa,1870,2,485,180,5.4376,True,"... for beds. ready-made bed ticks, 2s, ds, ds, ss, 53 9d, 6s 6d. 78 6d, 5,7 e. sheets, blankets, fed quilts, tic. carpets, hearth rugs, oil cloths, and cocoa mattings. timmins's"
cocoa,1870,2,485,184,5.448,True,"... clothing op all hinds girls' straw —ll-1-llffe—go7l; ...vordom nod 01l nnw 111111'88 from 2id. omoll kiddirminstir oad fut carpet, /marti( hug r oad cocoa matting m 01l 'isla april, 1873. "
cocoa,1870,2,485,192,5.4644,True,"..., ~ felt juts, „ stlk hats, j • kendall, tail harreu.,'' 2, dictbetii, walsall j • j • hawley. rope and twine manufacturer, 49, park-street, walsall. cocoa nut mats a"
cocoa,1870,2,485,198,5.4951,True,"cocoa mattings da mats. well-seasoned oilcloths, all widths. iron bedsteads & bedding. our brussels & tapestry carpets are well worthy., special journey to..."
cocoa,1870,2,485,203,5.5145,True,"and bedrooms. floor oil cloth, well seasoned, from 20 1 long to 8 yards wide, cut to any size. cocoa mattings in all widths, with mats of et description. a large quantity of french and german tai baiz"
cocoa,1870,2,485,208,5.5337,True,"...ps, from seal caps, „ felt hats, „ silk hats, „ j. kendall, ""the hatter.' digbth, walsall ~.j•_j•___h.awle y. rope -and twine 49 park-street walsall. cocoa"
cocoa,1870,2,485,212,5.5436,True,"hearth rugs, skin hate, cocoa matting it math. note tee address- samuel taithgow, leeds house. middlesbrough."
cocoa,1870,2,485,213,5.5713,True,"winsfurd coffee and cocoa boum company, limited. the subscription list of atilt company s,a pes. th., shares aro ilmited a aleour.t to tan elailleage, and ilo imuottent uomber..."
cocoa,1870,2,485,214,5.5742,True,"...lt hats, „ silk hfi.ts„., 1.6 d. j • kendall, ""the iuttteil,"" 2, digbeth, walsall. j• j. _hawley, rope and twtne manufacturer, 49 park-street walsall cocoa nut "
cocoa,1870,2,485,227,5.6612,True,"hurdle leaping. horses—lst, j. b. shield, ho!wick, llonntain betty; 2od, w. watmou, brown. witton park, cocoa nut. pouis—lst, j. 13. shield, holdwiek, mountain betty. crook floral, horticultural, and "
cocoa,1870,2,485,228,5.6645,True,"brussels, tapestry, & kiddermins' carpets. earth rugs, skin mats, cocoa matting and mats. -notei the a.ddbebb- samuel lit hgow leeds house, market place, middlesbrough. a: rand invention. extracting t"
cocoa,1870,2,485,229,5.6709,True,"runcorn coffee and cocoa rouse. the investor? guardian say. :—this company pro- peseta, with a capital of ssa°, in al shares, to carry on the busin•is of tereperanoe refreshm..."
cocoa,1870,2,485,235,5.7258,True,"hearth rugs, skin mats, cocoa matting jz mats. deafness, noises in the fars, essence for for deafness has proved an extraordinary remedy. it always relieves, generally cures and i..."
cocoa,1870,2,485,236,5.7329,True,"...he sher old ach dus ,om -00l1 'to( kc. all he w cloth stmeihude towd.kon's (o. 3, iron walnut gp mabegai mahogaz tiofaa clot lady's ta hearth paseagc cocoa m whd wood p aentrob"
cocoa,1870,2,485,243,5.7578,True,"letter to the editor. coffee and cocoa houses. dear sir,—being a customer at the co ff ee house, i have noticed, with surprise, the very late hours to which the 'barmaids' are kept at nigh..."
cocoa,1870,2,485,244,5.7631,True,"s. litegow's toilet glasses in great variety, all equally reduced in price. brussels, tapestry, & kidderminster carpets. heartit rugs, skin mate, cocoa matting bc mats. note tim admix's- samuel lithgo"
cocoa,1870,2,485,246,5.7744,True,"31 )a, manila, jute mk hemp carpets. cocoa mats. apply to e. sh ephe rd sons, burton. westmoreland. the city clock company, 7. cullum-street, london. sup ply every doctiption of clocks (with a..."
cocoa,1870,2,485,256,5.8321,True,"!ai great•sale by artingstall 8: hind (auctioneers), of the entire stock manufactured in the city gaol, of. cocoa matting and mate, hall and door mats, in wool and cocoa fibre. e. le•wis and co. havin"
cocoa,1870,2,485,261,5.8525,True,"& litinows toelet glasses in great variety, all equally reduced in price. •bbijssels, tapestry, 8c kidderminster carpets. hearth rugs, skin mats, cocoa matting & mats. no the address— samuel taithgow,"
cocoa,1870,2,485,269,5.8824,True,"s. litieigow's toilet glasses di great variety, all equally reduced in price. brussels, tapestry, & kidderminster carpets. hearth rugs, skin mate, cocoa matting & mats. notic the addbiob- lithgow, lee"
cocoa,1870,2,485,270,5.8853,True,"... 34d. white moist sugars, 34. and 31d. splendid sparkling lump, 4d. and 40. condensed milk (english) ed., (swiss) od. per 11b. tin. coffee & milk and cocoa"
cocoa,1870,2,485,279,5.9532,True,"the chester cup. hush money, knight of the garter, nobleman, glen- falloch, zapolya, cocoa nut, see saw, sylva, mont blanc, cock of the walk, vansittart, knight of athol, merry lass, *startor, beautif"
cocoa,1870,2,485,280,5.9689,True,"winsford copts"" and cocoa rome cvmplny, the subscription list of this company is only noel, the share, are limited in an.nunt to tan milling% and an important number already t..."
cocoa,1870,2,485,282,5.9728,True,"the bristol and west of eng- land la.boubers. on saturday afternoon a largely-attended meet- ing of the labourers employed at the messrs. fry's cocoa works, union-street, took place at the coach and h"
cocoa,1870,2,485,288,5.9963,True,"rudy made clothing of all hind& girls. straw ram de, tod.. ard .11 new shapps from 1. not. kidderminster ow, felt carpets, kurth rugs, and cocoa ratting la all nooo.f4iis sud.tßrio,tvßdlng room, ..w. "
cocoa,1870,2,485,297,6.0605,True,"the mat-makers. the following appeal from the cocoa ana and matting weavers' society has been mado t...) the trades generally fellow worr3ien,—we beg most respect- fully to appeal to you for :assistan"
cocoa,1870,2,485,300,6.0744,True,"lublic sows. v inspond coffee and cocoa house codipany,limitzi?.. the subscription list of this company a is now op.. tbu tibwei •os broiled on sto..tiot to ten •billings, and no importent ..."
cocoa,1870,2,485,301,6.0767,True,"cradley heath. opening or a coffee house.—on wednesday last, a coffee and cocoa house, was opened at the four ways, cradley heath, through the kindness of mr. strawson. ithas long been felt desirable "
cocoa,1870,2,485,303,6.0843,True,"city and suburban. glaieul, cocoa nut, cymbal, tabernacle, birthday, ldus, notusk°, gondolier, ouragan, oxonian, evohe, baal°, terre do feu, thinskiu, neuchatel, disguise, lady of lyo..."
cocoa,1870,2,485,304,6.0898,True,"robbery by street arabs. thomas moran, nine years of age, and john dooley, aged ten, were charged with dealing a cocoa nut. the prisoner dooley was seen to enter the shop of joseph lyons, widnes, on t"
cocoa,1870,2,485,309,6.1253,True,"baker and confectioner. ii 0t tea, coffee, and cocoa ready every day from eight in the morning till eight i the evening. fresh 72es. cakes and pastry every day. d. mcgregor. 18, linthorpe-road, middle"
cocoa,1870,2,485,314,6.1479,True,":44 the 1-14 t, corn 1-b..examiner ""nothing extenuate, nor set down aught in maliee.""—shakespeare. wncspoan coffee and cocoa house ccmpany, limited. tee bubsctiption list of this company is now open. "
cocoa,1870,2,485,316,6.1507,True,"4d to ited by town talk. the town of runcorn possesses a building devoted to whlti i may call the coffee and cocoa room undertaking, whith in its furniture and arrrangement is probably second to pow i"
cocoa,1870,2,485,317,6.1517,True,"segal and 6pgrai. a new cocoa saloon has been opened in wellington street, gateshead, by messrs webster and bennett. a marriage is arranged between the countess. dowager of dunrav..."
cocoa,1870,2,485,319,6.1611,True,"produce. --- liverpool, 1103iday.--ergat the market continues dull, and the few sales effected are at moderate prices. coffee and cocoa unchanged. londo. monday.—sugar the transactions here have beens"
cocoa,1870,2,485,321,6.1717,True,"...at• messing or slus national ilerift sorts., nrns use lon.a. terilusit on naturday. tiro lullowing resolutions wore pussd t. rbat the coffee palaces, cocoa hone, iwta. blithe i, datio"
cocoa,1870,2,485,322,6.1797,True,raspberry ratifia savoy sponge tea cakes plain wafers cocoa nut drops ginger wafers orange dessert lemon ditto sponge rusks meat wafers court biscuits christmas dessert mazeua wafer brooms and brushes
cocoa,1870,2,485,324,6.1947,True,"'rego ea an duncan mcg: _ir, baker and confectioner. ""rot tea, coff.ee, and cocoa ready every day from tight in the morning till eight i the evening. fresh tea cakes said pastry every day. d. mcgregor"
cocoa,1870,2,485,326,6.2103,True,"kr. 81ros re.... bas mama from bis raant rwer• ....ch.e.fire at nmi* tepor's cocoa rectory, on frenday, destroyed mwebitery alone to the value of £60,c03. tbe oopyrtglit of cbistiso whisk pobliehed or"
cocoa,1870,2,485,334,6.2286,True,".4 arnim is now at vienna, but-vai shortly to italy. -has followed i4yerpool's example in count return establhing the ^ cocoa and coffee houses. autumnal meeting of associated chambers -,eree commence"
cocoa,1870,2,485,335,6.2375,True,"opening of the 'osborne' coffee house. the first business premises of the staffordshire cocoa house company, limited, situated in north street, wolverhampton, were opened on thursday morning under the"
cocoa,1870,2,485,336,6.2386,True,"baker and confectioner. hot tea, coffee. and cocoa ready every day from eight in the morning till eight i the evening. fresh tea cakes and pastry every day. d. mcgregor, li, linthorpe-road, middlesbro"
cocoa,1870,2,485,337,6.241,True,"opening of a -coffee house 'at wolverhampton. on tuesday morning another toffee and cocoa house establishment belonging to the com- pany which has been promoted for that purpose, was opened in the den"
cocoa,1870,2,485,340,6.2666,True,"produce. livenpool, monnay.--segar the market continues dull, and the few sales efftcted are at moderate prices. coffee and cocoa unchanged. los von, alonday.—sugar the transactions here have been on "
