word,decade,cluster,cluster_size,rank_in_cluster,distance_to_centroid,target_word_visible,snippet
cocoa,1910,1,901,115,4.0025,True,"weleo cocoa. welco cocoa, which has the additional recom- mendation of being prepared locally, is a fine nourishing drink, and its price hag not been raised to a..."
cocoa,1910,1,901,117,4.008,True,"14 orient"" delicious to the last drop, and absolutely pure, collinson's orient cocoa is the most invigorating, sustaining and nourish- ing beverage for young and old. children delight in its rich choc"
cocoa,1910,1,901,118,4.0107,True,"distress in the potteries. in consequence of the distress in the pottery towns, the proprietors of rova cocoa are distributing to every house in the area affected vouchers entitling each recipient to "
cocoa,1910,1,901,120,4.0135,True,rowntree flavour _ so delightful that they enjoy the cocoa year after year. but those who have not yet tried rowntree's elect cocoa t. 111 and do not know its special flavour should take this opportun
cocoa,1910,1,901,123,4.0246,True,"royal recognition of a well- known cocoa firm. we learn as we are going to press that messrs. rowntree and co., ltd., of york, have been appointed makers of cocoa and chocolate to his majest..."
cocoa,1910,1,901,124,4.0264,True,"weleo cocoa. welco cocoa, which has the additional recom- mendation of being prepared locally, is a fine nourishing drink, and its price has not been raised to a..."
cocoa,1910,1,901,125,4.0265,True,"sunlight soap i used to laugh at him a little."" y husbancf has taken cocoa for years, and i used to laugh at him a litt!e because he set such store by it. he's strong man, and i did not think he d coc"
cocoa,1910,1,901,127,4.0296,True,"• lis they met the wondrous talking an oracle, far-famed. let's put a riddle to it now !"" each cocoa nib exclaimed. well, what food is meat and drink in one? your anstver quickly tell! s' the splendid"
cocoa,1910,1,901,129,4.0352,True,"royal recognition of a weil-known cocoa firm. we learn as we are going to press that 'messrs. rowntree and co.. ltd., of york. have been appointed makers of cocoa and chocolate to his majes..."
cocoa,1910,1,901,132,4.0515,True,"insoes r: ~.' 1: coa '1 oon's cocoa is quite distinctive. it is like liquid chocolate, with its tine natural flavour—yet is four times as economical as chocolate powder. it is british m..."
cocoa,1910,1,901,133,4.0587,True,"rowntree's elect 'whether you are a cocoa drinker or no, ta4 advantage of this exceptional opportunity to test the excellence of rovvntree's. if you once began a tin of cocoa and lost interes..."
cocoa,1910,1,901,135,4.0614,True,"a €44,0 • / i used to laugh at him a little."" my husband has taken cocoa for years, and i used to laugh at him a little, because he set such store by it. he's a big, strong man, and i did not think he"
cocoa,1910,1,901,137,4.0639,True,"ro y t ntree's elect cocoa if you write for full particulars now and use the coupon below, we will at once send four of these vouchers free. give them to the children who will ..."
cocoa,1910,1,901,138,4.0642,True,"save t e coupons we have used your famous weloo cocoa in this household, for seieral years, and highly recommend it to all .our friends."" j.— e.— j.—, moss side, manchester. • b: i • • • co ca for lad"
cocoa,1910,1,901,141,4.0718,True,"ro y t ntree's elect cocoa if you write for full particulars now and use the coupon below, we will at once send four of these vouchers free. give them to the children who will ..."
cocoa,1910,1,901,143,4.0785,True,",k(1 -, i • 4 \ 1., ~, 1 1 0 c 0 n this lovely casket of chocolates—fßee ii‘t the end of your first tin of r ova cocoa you realise that all we have claimed for this pure cocoa is true. at the end of y"
cocoa,1910,1,901,144,4.0792,True,"caerphilly. g. couzens & soni suchard 's cocoa and chocolate will come regular purchasers of these speciali- ties, obtaining future supplies, of course, through the regiflar channels of trade: suc..."
cocoa,1910,1,901,145,4.081,True,"royal recognition of a well- known cocoa firm. we learn as we are going to press that messrs. rowntree and co., ltd., of york, have been appointed makers of cocoa and chocolate to his majest..."
cocoa,1910,1,901,146,4.086,True,"elect cocoa ""i have been a user of elect cocoa for years, and being a railwayman i find 4t is a most delicious and sustaining beverage. my wife and family take e..."
cocoa,1910,1,901,147,4.0899,True,"competitors ten years of age' and *rink we le co,, ;ritish pure cocoa wilco cocoa when one's weary, warms one, soothes one, makes one try a .i*-ib. pkt. to-day, 9d. cheery."
cocoa,1910,1,901,149,4.1003,True,"cogrip / goaaris. / _ __ • api ..... ,-- 0 -00/1:1 ••■■=l% ""orient"" ca, oco • ‘ because of its high concen- tration collinson's 'orient' cocoa is the finest value obtainable. one quarter pound packet "
cocoa,1910,1,901,151,4.1026,True,test them side by side. perhaps you may be using another cocoa. now you can test the two cocoas side by side. note the delicious flavour and refreshing fragrance of rowntree's. note the comparative ea
cocoa,1910,1,901,152,4.1034,True,"ocoa l net weigh :h tin contains a cocoa. independent of tin and paper. after all the talk about cocoa --liptons is the most delicious. apart from its fascinating flavour, you can do more an..."
cocoa,1910,1,901,153,4.1084,True,"royal recognition of a weil-known cocoa firm. we learn as we are going to press that 'messrs. rowntree and co.. ltd., of york. have been appointed makers of cocoa and chocolate to his majes..."
cocoa,1910,1,901,154,4.1101,True,"rie:001 '1 ollinson's cocoa issquite distinctive. it is like liquid cliocolate, with its true natural flavour— yet is four times as economical as chocolate powder. it is british..."
cocoa,1910,1,901,156,4.1147,True,"... secret. ""pe ople wonder sometimes how i manage to keep so happy and strong with all the work to do at home. i do as dad does i make rowntree's elect cocoa my stand-by. when- ev"
cocoa,1910,1,901,158,4.1256,True,"_ read what actual users say:— ""flavour 8 economy"" freemantle, southampton. i have been a regular purchaser of your delicious cocoa for a considerable time, and i firmly believe it has coequal for fla"
cocoa,1910,1,901,159,4.1263,True,"_ read what actual users say:— ""flavour 8 economy"" freemantle, southampton. i have been a regular purchaser of your delicious cocoa for a considerable time, and i firmly believe it has coequal for fla"
cocoa,1910,1,901,160,4.1272,True,...ecause she couldn t get a flat. and said she never .telt the cold in spite of being rather old she drank teithin.her; house of silk. hot row ittree s cocoa mad
cocoa,1910,1,901,161,4.1278,True,british ‘. ure cocoa always ask for cheapest and best. 7d. per -4 lb. tin. save the coupons. john rothwell the cocoa factory. golborne. lanes i 11 • • • • r .. r / • .. r...
cocoa,1910,1,901,162,4.129,True,"upons ""we have used your famous welco cocoa in this household for several years, and highly recommend it to all our friends."" • j.— j.—, moss side, manchester. • • '• • -.y••:,-1-''•ii•--7,*,;y..."
cocoa,1910,1,901,163,4.1293,True,"british pure cocoa always ask for cheapest and best. 7d. per -4; lb. tin. save the coupons. john pothwell the cocoa factory. colborne. lanes .. • 4 • ,/ .' .. i • ,•, ...."
cocoa,1910,1,901,164,4.1293,True,"... 26, st. barnobas'-place, oft lovely-lane (evelyn-street council school).- t*/=""o°' 74,5"" '44'. rsed to laugh at him a little."" nly husband has taken cocoa for y"
cocoa,1910,1,901,165,4.1302,True,"elect cocoa lorraster.—"" after using your cocoa for a period extending over lc years, i can truthfully and conscientiously say that it far exceeds any i have tri..."
cocoa,1910,1,901,166,4.1305,True,"penistone urban council. a cap of 4, 9 g el. porkers ""i used to laugh at him a little"" :vey husband has taken cocoa for years, and i used to laugh at him a little because he set such store by it. he's"
cocoa,1910,1,901,167,4.1338,True,"elect cocoa ""i have been a user of elect cocoa for years, and being a railwayman i find 4t is a most delicious and sustaining beverage. my wife and family take e..."
cocoa,1910,1,901,171,4.1414,True,the rowntree's elect cocoa dilir captivates the sense of taste. its delicate and sadelicious aroma is irresistible. the rowntree flavour ireess is distinctive and the test of t...
cocoa,1910,1,901,172,4.1427,True,test them side by side. perhaps you may be using another cocoa. now you can test the two cocoas side by side. note the delicious flavour and refreshing fragrance of rowntree's. note the comparative ea
cocoa,1910,1,901,175,4.1534,True,"cocoa for 3 the cocoa nibs were glad to meet a sign-post on their way. the strangest sign post they had met for many and many a day, oh. mr. sign-post. _ d..."
cocoa,1910,1,901,177,4.1824,True,"s. f. and s. p. t. ltd. ""i used to laugh at him a little."" 'y husband has taken cocoa for years, and i used to laugh at him a little because he set such store by it. he's a big strong man, and i did n"
cocoa,1910,1,901,178,4.1826,True,"rowntree's elect 'whether you are a cocoa drinker or no, ta4 advantage of this exceptional opportunity to test the excellence of rovvntree's. if you once began a tin of cocoa and lost interes..."
cocoa,1910,1,901,180,4.1847,True,"rescued by ""the cocoa nibs."" the cocoa nibs first met a man who had a curious notion. to live upon a biscuit in the middle of the ocean. he broke a piece of biscuit off fo..."
cocoa,1910,1,901,182,4.1916,True,"british wie c:lco cocoa i gives the glow that makes our dirls admired 2, _ joax tat •cbeilt factory, gol#ovnr, tn • • pure cocoa. 9d. per 4th tin."
cocoa,1910,1,901,184,4.202,True,"breakfas time. cup of collinson's cocoa • ..c.tore starting our, takes' the nip' out of the morning air, keeps the kiddies healthy and happy and puts extra vir. way you tackle your work. fo..."
cocoa,1910,1,901,185,4.2027,True,"or 3 the cocoa nibs were glad to meet a sign-post on their way, the strangest sign post they had mct for many and many a day. oh. mr. sign-post, don't you find _lt ..."
cocoa,1910,1,901,186,4.2043,True,"'1 • • • • 1. • • • • ''"" • save the coui,k4ts ""we have used your famous welco cocoa in this household for several years, and highly recommend it to all our friends."" j.— e.--- j.—, moss side, manches"
cocoa,1910,1,901,189,4.2155,True,"... 'the very finest products.""—the medical map, we take this opportunity to state that we are supplying our trade customers with as large a quantity of cocoa and chocolate"
cocoa,1910,1,901,191,4.2165,True,"mrsztl7l. of. 'yt y, dissoird. betfor• uuttiti bread bait fiat-buffo. !nada with. rowntree's cocoa take my' margarifie, and ern 'weu tem now to maze (two teaspoonfuls) rowntree's sleet cocoa, two oss."
cocoa,1910,1,901,192,4.2165,True,"distress in the potteries. in consequence of the distress in the pottery towns, the proprietors of rova cocoa are distributing to every house in the area affected vouchers entitling each recipient to "
cocoa,1910,1,901,193,4.2335,True,"genuine rolled gold spectacles, eye glasses, or rimless, throushout the world ""fry's of bristol- is known as the synonym for cocoa and choco- lat, in their purest anl most delicious forms. the history"
cocoa,1910,1,901,195,4.2374,True,"lli/ sailors' and your welcome tins of w elco cocoa arrived this morning, thank you very much; it is considered the best we have ever tasted."" [he soldiers do enjoy it so much; these ights one wants a"
cocoa,1910,1,901,196,4.2401,True,"12), for making chocolate cakes, puddings and ices, welco cocoa is the best. welco gives such delicious flavour. try it! save the coupons."
cocoa,1910,1,901,197,4.2446,True,"that's why i like 9: elect cocoa no other cocoa has the dalicious rowntree flavour. ellit4sub impr,alllr mir own qm ea qiir ""or 41111. gewinap eposap tawrofer e 4-72"
cocoa,1910,1,901,198,4.2473,True,that's why i lake tree' elect cocoa no other cocoa has the delicious rowntree flavour. war 44110 41111 p onmp yaw mop md 411110 411111 p 4111bp anar embilillar 410 am 1•11044.
cocoa,1910,1,901,202,4.2537,True,"_ read what actual users say:— ""flavour 8 economy"" freemantle, southampton. i have been a regular purchaser of your delicious cocoa for a considerable time, and i firmly believe it has coequal for fla"
cocoa,1910,1,901,204,4.2616,True,"five cups a penny. iirtal rhat cocoa forms part of our *old- ie sufficient to show the ingtsagagingt= upon its nutritive proper. ties by the y authorities. to the chilila, cocoa is even ..."
cocoa,1910,1,901,205,4.2616,True,"ramon cocoa is ten times more nutpitious daao oramary cocoa -vrds lancet. cocoa in perfection, 9d., 1/4, 2,6. supplied to the royal family. a special art metal b..."
cocoa,1910,1,901,206,4.2631,True,"run down? •• how is it. the cocoa nibs enquired. ""you neccr stop work and you don t get tired? because. said the clock. ""there s a man in town who winds me up when i get run iowa!"" th..."
cocoa,1910,1,901,208,4.2645,True,",ettnoei.leta94oo an think ther irinl d more enjoyable too! first thing in the morning, last g at night —""welco"" cocoa is always ""welcome."" re is no comparison between welco and other ks.for quality, "
cocoa,1910,1,901,215,4.2726,True,"on every of cocoa. we have arranged for your grocer until april 27th, to make a special trial allow- ance of id. on a *-lb. tin (or any other size) if you will fill in..."
cocoa,1910,1,901,217,4.2757,True,"welco cocoa. welco cocoa, which has the additional recom- mendation of being prepared locally, is a fine nourishing drink, and its price has not been raised to a..."
cocoa,1910,1,901,219,4.2795,True,"2z111i1111111he1111111111111111i1111111111111!111111111111111111111111 food value of chocolate chocolate is made with cocoa and sugar and forms a palatable and convenient food, containing such essenti"
cocoa,1910,1,901,220,4.2797,True,iyelco free gift pure british cocoa save the coupons
cocoa,1910,1,901,222,4.2863,True,"cocoas at _ -a more, are less economical a.. pure than rova—a fact which it will pay you to test. rova cocoa contains all the essential cocoa elements in p..."
cocoa,1910,1,901,224,4.2879,True,"iivntr you can obtain this casket free by saving vouchers from tins of ronvll- fee's cocoa. no other cocoa has .owntree flavour, no other cocoa brings casket. filled with delicious chocolates. to-day "
cocoa,1910,1,901,225,4.2888,True,that's why i lake tree' elect cocoa no other cocoa has the delicious rowntree flavour. war 44110 41111 p onmp yaw mop md 411110 411111 p 4111bp anar embilillar 410 am 1•11044.
cocoa,1910,1,901,232,4.2999,True,"in *0 -9s coa don't be content just to read about collinson's cocoa ;—don't risk a shortage of fat in your diet, but go to your grocer and get a fib tin to-day, and lest it—the cost is only iod. also "
cocoa,1910,1,901,233,4.3119,True,"welco is n but plentn c ""one, of our c cocoa—free from ""please send 36 coupons enclos, them to france tc where i send your week.""—(mrs. b.) b—, cpl. bth batt. e.l.r 8.e.f., f free gift boxes for..."
cocoa,1910,1,901,234,4.3141,True,"nelcor;""ree gift pure british cocoa save the coupons"
cocoa,1910,1,901,235,4.3146,True,test them side by side. perhaps you may be using another cocoa. now you can test the two cocoas side by side. note the delicious flavour and refreshing fragrance of rowntree's. note the comparative ea
cocoa,1910,1,901,237,4.3159,True,"british pure cocoa. the law requires we stint our fires: there's heat in welco cocoa! yes, it's just wilco, cups of welco you need, to maintain the proper warmth & nour..."
cocoa,1910,1,901,238,4.3174,True,"you can obtain this casket free by saving vouchers from tins of rown- tree's cocoa. no other cocoa has -owntree flavour, no other cocoa brings casket. filled with delicious chocolates. to-day drinking"
cocoa,1910,1,901,239,4.3197,True,itizo free gift • pure british cocoa save the coupons
cocoa,1910,1,901,240,4.3209,True,"that's why i like t • 4 t ••3 • 4 • •'k -' .:•• • :. • ~'„: ,• • ‘, • ~ ••,,' .•:,,,,, • • •,' i • elect cocoa? no-other cocoa has the delicious rowntr ee flavour. an) ater moo vw aft imp t 44110 4ini"
cocoa,1910,1,901,243,4.3262,True,"al on cold mornings' after dressing in a cold bedroom, elect cocoa at breakfast warms arid cheers. it fortifies tile system against the earl morning chill on the wy to work. early risers; or those ""ex"
cocoa,1910,1,901,244,4.3263,True,"the matron whose duties seem never to end, find welco cocoa an excellent friend. will 9, d. pei ilb. pkt, john rothwt it, the cocoa factory, go!borne, lancashire _,.<4,- _ 1......:7,1aw "";,--. :‘,''' "
cocoa,1910,1,901,246,4.3296,True,"acbcoa it rnake.3 all the difference. every zrocez sells vi- cocoa in 6d packets, and 9d and 146 tins. .1f id ,-- i tpit if ~"
cocoa,1910,1,901,247,4.3322,True,"besides, when you buy rova at 41d., you get a better, purer cocoa into the bargain ro vcocoa ask your grocer for particulars of the gift caskets, or write to rova cocoa, 57, city road, london, e.c. 00"
cocoa,1910,1,901,250,4.3375,True,mom milk shortage. we lc 0 cocoa contains just a similar butter to the butter contained in fresh milk. the natural butter in nvelco is most easily di- gested and very nourij. cocoa i...
cocoa,1910,1,901,252,4.3381,True,"sketch of free those who are already users of rowntree's elect cocoa will welcome these two handsome souvenirs, although they really need no such inducement to continue using it. they find the cocoa s"
cocoa,1910,1,901,253,4.3386,True,"that's why i like 9: elect cocoa no other cocoa has the dalicious rowntree flavour. ellit4sub impr,alllr mir own qm ea qiir ""or 41111. gewinap eposap tawrofer e 4-72"
cocoa,1910,1,901,259,4.3497,True,the seizure of cocoa. prize court's decision for the famous french airman's 70 claimants. 1 miles an hour for six hours. sir samuel evans in the prize court heard the cla...
cocoa,1910,1,901,264,4.3588,True,"i used to laugh at v him a little."" my ht,,hand has taken cocoa for years, a and 1 used to laugh at him a little because hc set luch store by it. he's a big, strong man, anl i did not think he needed "
cocoa,1910,1,901,265,4.3602,True,"weleo cocoa. welco cocoa, which has the additional recom- mendation of being prepared locally, is a fine nourishing drink, and its price hag not been raised to a..."
cocoa,1910,1,901,266,4.3604,True,"that's why i like rowntreels elect cocoa no other cocoa has the delicious rowiltree fiavour. mbii nd mr se vim mr igua 41110 '7-4'4_ (am ev ind os ,26 am am ell 1, st this mi 4a 7h e i z _ _..."
cocoa,1910,1,901,267,4.3611,True,i cocoa a real food or breakfast or ade in the model re works st 'pry co-operstive is it. zative store nos.erc else .....11o.m.mm.1•11 ft* .r7.lral 1111hiras...
cocoa,1910,1,901,268,4.3617,True,"rowntree's elect 'whether you are a cocoa drinker or no, ta4 advantage of this exceptional opportunity to test the excellence of rovvntree's. if you once began a tin of cocoa and lost interes..."
cocoa,1910,1,901,276,4.3735,True,rowntree flavour _ so delightful that they enjoy the cocoa year after year. but those who have not yet tried rowntree's elect cocoa t. 111 and do not know its special flavour should take this opportun
cocoa,1910,1,901,277,4.3773,True,"t als why i like • • • 1115 • • • 0 • • • • • • elect cocoa no other cocoa has ihe delicious rowntree :flavour. qns) imp oar wnw low 41111 p imp cap imp 41110tomp catti, wow 40.4111110 oft awe 1111.11"
cocoa,1910,1,901,279,4.3794,True,"ntree's elect cocoa no other cocoa has the delicious rowntree 'flavour. 10041266 wilp quip mvp mar mo ow asp •sweskawy giew eftwiso ark ow."" f 6 75a"
cocoa,1910,1,901,283,4.3852,True,mom milk shortage. we lc 0 cocoa contains just a similar butter to the butter contained in fresh milk. the natural butter in nvelco is most easily di- gested and very nourij. cocoa i...
cocoa,1910,1,901,284,4.3868,True,"• 6, ili my husband has taken cocoa for years, and i used to laugh at him a little because he set such store by it. he's a big strong man, and i did not think he needed cocoa. it never ..."
cocoa,1910,1,901,285,4.387,True,i cocoa a real food or breakfast or ade in the model re works st 'pry co-operstive is it. zative store nos.erc else .....11o.m.mm.1•11 ft* .r7.lral 1111hiras...
cocoa,1910,1,901,288,4.3942,True,bbles cocoa —it makes all the difference. every grocer sells vi-cocoa in gd. packets and 9d. and 18.6 d. tins.
cocoa,1910,1,901,289,4.3947,True,"ntree's elect cocoa no other cocoa has the delicious rowntree 'flavour. 10041266 wilp quip mvp mar mo ow asp •sweskawy giew eftwiso ark ow."" f 6 75a"
cocoa,1910,1,901,296,4.4077,True,"~. f, r 3 the cocoa nibs were glad lo meet a sign-post on their tvay, the strangest sign post they had mct for many and many a day. oh, mr. sign-post, don't you find it ..."
cocoa,1910,1,901,298,4.4092,True,"91area93waelge, —an think thet drinl id more enjoyable too! first thing in the morning, last g at night—""welco"" cocoa is always ""weicome."" re is no comparison between welco and other ks for quality, f"
cocoa,1910,1,901,300,4.4121,True,hand loom -ji h.m. the king the striking response to the offer of the rowntree gift casket shows in no uncertain way how the public appreciate a cocoa characterised hy that intensity and delicacy of f
cocoa,1910,1,901,302,4.4137,True,"is the cocoa with a charm >erative store nov, me fic £i.sl ~ acid concessions in west -1- parts of the british ch to supply raw materials es e home. at luton it :..."
cocoa,1910,1,901,303,4.4167,True,...the filled with rowntree's delicious chocolates and pastilles can easily be obtained if you save the vouchers to be found in tins of rowntree's elect cocoa. start drinking rowntree's cocoa
cocoa,1910,1,901,304,4.4168,True,acccocoa ft nakte all tbe difference. every grocer sell. vi. cocoa in cd. packets and 9d and 13. c. tine.
cocoa,1910,1,901,305,4.4189,True,"weleo cocoa. welco cocoa, which has the additional recom- mendation of being prepared locally, is a fine nourishing drink, and its price has not been raised to a..."
cocoa,1910,1,901,308,4.4221,True,"25,000 sixpenny sample packets of chocolate free for fresh purchasers of suchard's ""ibis"" cocoa, knowing that 'suchard's ibis cocoa lecd oalebe tried once to be u.iad always, the :la :lufacturers have"
cocoa,1910,1,901,309,4.4222,True,"""i used to laugh at him a little."" women workers' series. niy husband has taken cocoa for years, and i used to laugh at him a little because he set such store by it. he's a big strong man, and i did n"
cocoa,1910,1,901,310,4.4229,True,welco milk shortage. welco cocoa contains just a similar butter to the butter contained in fresh milk. the natural butter in welco is most easily di- gested and very nourisiatui coco...
cocoa,1910,1,901,312,4.4236,True,"the stage of real drama. sip it & see kindly taste sample of ask .ottr grocer for welco cocoa. the' • c wel 0 cocoa which will j delivered during the next few days, at every home in warrington and dis"
cocoa,1910,1,901,313,4.4244,True,"that's why hike • .•... •.. elect cocoa no other cocoa has the delicious rowntree flavour. 1t,.754,m, omp_imatium..•mte ems, ow imp wo osp imp nw alb_ 111110 4110 orap."
cocoa,1910,1,901,314,4.4248,True,the seizure of cocoa. prize court's decision for the famous french airman's 70 claimants. 1 miles an hour for six hours. sir samuel evans in the prize court heard the cla...
cocoa,1910,1,901,315,4.4267,True,"elect cocoa ""i have been a user of elect cocoa for years, and being a railwayman i find 4t is a most delicious and sustaining beverage. my wife and family take e..."
cocoa,1910,1,901,316,4.4273,True,"-and more enjoyable too first thing in the morning, last hing at nighc—""welco"" cocoa is always ""welcome."" rhere is no comparison between welco and other irinks for quality, fragrance and sustenance an"
cocoa,1910,1,901,319,4.4314,True,"moderation is necessary. thus, while tea and coffee and cocoa are to be reckoned necessary they should be used on a definite plan. custom has placed them in eom. manding positions upon the breakfast a"
cocoa,1910,1,901,321,4.4336,True,.... 'mbles vi-cocea thanked for what they sell. bettor. of thanks keep pt.uring in from tvery county in britain to the manufacturer. of br. tibbles' vi-cocoa. the f
cocoa,1910,1,901,326,4.4435,True,"_ read what actual users say:— ""flavour 8 economy"" freemantle, southampton. i have been a regular purchaser of your delicious cocoa for a considerable time, and i firmly believe it has coequal for fla"
cocoa,1910,1,901,330,4.4445,True,"flavour. ga,iicos cocoa for flavour, flavour, oorrect answers to all the above puzzlow have been received from: a. livenddge, john young. bouth kirkby; john naylor. wood- ho..."
cocoa,1910,1,901,331,4.445,True,"t""'""7::,. -,. ....1 1 • t.:, 1 ki -- \ if-y -, t\ ..,..nr4ta; 4-• 4,,q 5---rt ant • appetising. as you pour the boiling water on rova cocoa what a ddicious aroma it sends forth. that is because it :s "
cocoa,1910,1,901,332,4.4453,True,"food value while milk is scarce, is take cocoa, which both food and drink— a fragrant and refresh- in, ing beverage, rich strength-giving proper- ties for nerve and body. buy the best. bournville ..."
cocoa,1910,1,901,335,4.4543,True,"""help yourselves!"" buy rova cocoa regularly, and whilst getting a better cocoa for less money gain for your children a rova gift casket of choco- lates by sav:ng 12 coupons from 41d. ..."
cocoa,1910,1,901,336,4.4571,True,"food .'....*.:tl:.urie while milk is scarce, take cocoa which is both food and drink a fragrant and refreshing beverage, rich in strength-giving properties for nerve and body. buy the best cad6ury's c"
